Headline,Link
World Bank: Developing countries pay $741bn more than they receive,https://citinewsroom.com/2025/12/world-bank-developing-countries-pay-741bn-more-than-they-receive/
"Galamsey: 11 Chinese, 10 Ghanaians arrested in Yakombo Forest",https://citinewsroom.com/2025/12/galamsey-11-chinese-10-ghanaians-arrested-in-yakombo-forest/
40 vehicles only the first batch; more support coming – Mahama to Police Service,https://citinewsroom.com/2025/12/40-vehicles-only-the-first-batch-more-support-coming-mahama-to-police-service/
"Muntaka to Police: New armoured vehicles for protection, not oppression",https://citinewsroom.com/2025/12/muntaka-to-police-new-armoured-vehicles-for-protection-not-oppression/
Inflation decline: Ghana seeing real progress – Ato Forson,https://citinewsroom.com/2025/12/inflation-decline-ghana-seeing-real-progress-ato-forson/
Mahama hands over 40 armoured vehicles to Ghana Police,https://citinewsroom.com/2025/12/mahama-hands-over-40-armoured-vehicles-to-ghana-police/
Vanderpuye: Restoring discipline key to refocusing students on academics,https://citinewsroom.com/2025/12/vanderpuye-restoring-discipline-key-to-refocusing-students-on-academics/
New utility tariffs too high – Nii Lante Vanderpuye,https://citinewsroom.com/2025/12/new-utility-tariffs-too-high-nii-lante-vanderpuye/
"WAEC fails students wrongly, system needs total overhaul – Elvis Darko",https://citinewsroom.com/2025/12/waec-fails-students-wrongly-system-needs-total-overhaul-elvis-darko/
Social media and poor reading culture behind WASSCE decline – Vanderpuye,https://citinewsroom.com/2025/12/social-media-and-poor-reading-culture-behind-wassce-decline-vanderpuye/
"Mahama, EU Official discuss regional anti-terror strategy",https://citinewsroom.com/2025/12/mahama-eu-official-discuss-regional-anti-terror-strategy/
"Keep morale high, step up crime fight — IGP to Police Officers",https://citinewsroom.com/2025/12/keep-morale-high-step-up-crime-fight-igp-to-police-officers/
Avoid middlemen during registration — DVLA urges vehicle owners,https://citinewsroom.com/2025/12/avoid-middlemen-during-registration-dvla-urges-vehicle-owners/
FIFA announces major entertainment acts for World Cup Final Draw,https://citinewsroom.com/2025/12/fifa-announces-major-entertainment-acts-for-world-cup-final-draw/
AUDIO:  Does 2026 budget balance growth and stability well enough? | #CitiCBS,https://citinewsroom.com/2025/11/audio-does-2025-budget-balance-growth-and-stability-well-enough-citicbs/
AUDIO: The ultimate local vs imported chicken debate as #AgriFair edges closer | #CitiCBS,https://citinewsroom.com/2025/11/audio-the-ultimate-local-vs-imported-chicken-debate-as-agrifair-edges-closer-citicbs/
"AUDIO: Dissecting the 2026 Budget – Bernard Avle interviews Finance Minister, Dr. Cassiel Ato Forson | #CitiCBS",https://citinewsroom.com/2025/11/audio-dissecting-the-2026-budget-bernard-avle-interviews-finance-minister-dr-cassiel-ato-forson-citicbs/
"AUDIO: El-Wak Military recruitment chaos: Desperation, poor planning leaves innocent families wrecked | #CitiCBS",https://citinewsroom.com/2025/11/audio-el-wak-military-recruitment-chaos-desperation-poor-planning-leaves-innocent-families-wrecked-citicbs/
40 vehicles only the first batch; more support coming – Mahama to Police Service,https://citinewsroom.com/2025/12/40-vehicles-only-the-first-batch-more-support-coming-mahama-to-police-service/
"WAEC fails students wrongly, system needs total overhaul – Elvis Darko",https://citinewsroom.com/2025/12/waec-fails-students-wrongly-system-needs-total-overhaul-elvis-darko/
Martin Kpebu: ‘My arrest a suicide mission by OSP’,https://citinewsroom.com/2025/12/martin-kpebu-my-arrest-a-suicide-mission-by-kissi-agyebengs-osp/
Martin Kpebu released by OSP,https://citinewsroom.com/2025/12/martin-kpebu-released-by-osp/
Kpandai Rerun: Court failed to cite case law – Haruna Mohammed,https://citinewsroom.com/2025/12/kpandai-rerun-court-failed-to-cite-case-law-haruna-mohammed/
World Bank: Developing countries pay $741bn more than they receive,https://citinewsroom.com/2025/12/world-bank-developing-countries-pay-741bn-more-than-they-receive/
Inflation decline: Ghana seeing real progress – Ato Forson,https://citinewsroom.com/2025/12/inflation-decline-ghana-seeing-real-progress-ato-forson/
New utility tariffs too high – Nii Lante Vanderpuye,https://citinewsroom.com/2025/12/new-utility-tariffs-too-high-nii-lante-vanderpuye/
"Charcoal, plantain, bread among top drivers of November inflation",https://citinewsroom.com/2025/12/charcoal-plantain-bread-among-top-drivers-of-november-inflation/
"Tax reforms lift business confidence, firms pin 2026 outlook on sustained policy stability",https://citinewsroom.com/2025/12/tax-reforms-lift-business-confidence-firms-pin-2026-outlook-on-sustained-policy-stability/
Nyarko Ampem: Asuogyaman’s doors open to tourists for December festivities,https://citinewsroom.com/2025/12/nyarko-ampem-asuogyamans-doors-open-to-tourists-for-december-festivities/
"200 women in Gushegu graduate from DARE Digital, Entrepreneurship programme",https://citinewsroom.com/2025/12/200-women-in-gushegu-graduate-from-dare-digital-entrepreneurship-programme/
"Ga Mantse unveils plan to transform Agbogbloshie into 100,000-stall market",https://citinewsroom.com/2025/12/ga-mantse-unveils-plan-to-transform-agbogbloshie-into-100000-stall-market/
"OSP breaks down events behind Kpebu’s arrest, rejects ‘trap’ allegation",https://citinewsroom.com/2025/12/osp-breaks-down-events-behind-kpebus-arrest-rejects-trap-allegation/
Ahafo Region: Two robbers arrested after series of violent attacks,https://citinewsroom.com/2025/12/ahafo-region-two-robbers-arrested-after-series-of-violent-attacks/
FIFA announces major entertainment acts for World Cup Final Draw,https://citinewsroom.com/2025/12/fifa-announces-major-entertainment-acts-for-world-cup-final-draw/
Mbappe shines as Real Madrid beat Athletic to close on Barcelona,https://citinewsroom.com/2025/12/mbappe-shines-as-real-madrid-beat-athletic-to-close-on-barcelona/
La Liga: Barcelona mount comeback to beat Atletico 3-1 at Camp Nou,https://citinewsroom.com/2025/12/la-liga-barcelona-mount-comeback-to-beat-atletico-3-1-at-camp-nou/
Black Queens take on England’s Lionesses in international friendly today,https://citinewsroom.com/2025/12/black-queens-take-on-englands-lionesses-in-international-friendly-today/
Nyaho Nyaho-Tamakloe: Players who rejected earlier call-ups shouldn’t join Black Stars,https://citinewsroom.com/2025/12/nyaho-nyaho-tamakloe-players-who-rejected-earlier-call-ups-shouldnt-join-black-stars/
GTA hails Delta’s new Accra–Atlanta Service as boost for Ghana Tourism,https://citinewsroom.com/2025/12/gta-hails-deltas-new-accra-atlanta-service-as-boost-for-ghana-tourism/
Agradaa Case: Court directs parties to submit plea bargain details,https://citinewsroom.com/2025/12/agradaa-case-court-directs-parties-to-submit-plea-bargain-details/
Ghanaian singer Justice Plo Prempeh to attempt world record for longest singing marathon,https://citinewsroom.com/2025/12/ghanaian-singer-justice-plo-prempeh-to-attempt-world-record-for-longest-singing-marathon/
Daddy Lumba: Akosua Serwaa to appeal High Court ruling in widowhood case,https://citinewsroom.com/2025/12/daddy-lumba-akosua-serwaa-to-appeal-high-court-ruling-in-widowhood-case/
Nkyinkyim Band crowns AgriFair 2025 with electrifying closing performance,https://citinewsroom.com/2025/11/nkyinkyim-band-crowns-agrifair-2025-with-electrifying-closing-performance/
South Korea developing app that shows real-time location of stalkers,https://citinewsroom.com/2025/12/south-korea-developing-app-that-shows-real-time-location-of-stalkers/
Amnesty calls for war crimes probe on RSF attack on Sudan refugee camp,https://citinewsroom.com/2025/12/amnesty-calls-for-war-crimes-probe-on-rsf-attack-on-sudan-refugee-camp/
74-year-old Cameroonian opposition leader dies in detention,https://citinewsroom.com/2025/12/74-year-old-cameroonian-opposition-leader-dies-in-detention/
"Russia-Ukraine war: If Europe wants war, Russia is ‘ready’ – Putin",https://citinewsroom.com/2025/12/russia-ukraine-war-if-europe-wants-war-russia-is-ready-putin/
"AI could increase divide between rich and poor states, UN report warns",https://citinewsroom.com/2025/12/ai-could-increase-divide-between-rich-and-poor-states-un-report-warns/
Porn company fined £1m over inadequate age checks,https://citinewsroom.com/2025/12/porn-company-fined-1m-over-inadequate-age-checks/
YouTube says it will comply with Australia’s teen social media ban,https://citinewsroom.com/2025/12/youtube-says-it-will-comply-with-australias-teen-social-media-ban/
New email scam uses hidden characters to slip past filters,https://citinewsroom.com/2025/12/new-email-scam-uses-hidden-characters-to-slip-past-filters/
Australian teen challenging social media ban says internet will be less safe,https://citinewsroom.com/2025/12/australian-teen-challenging-social-media-ban-says-internet-will-be-less-safe/
Samsung unveils first multi-folding phone as competition set to heat up,https://citinewsroom.com/2025/12/samsung-unveils-first-multi-folding-phone-as-competition-set-to-heat-up/
"Health Ministry: Over 6,000 newly recruited nurses paid",https://citinewsroom.com/2025/12/health-ministry-over-6000-newly-recruited-nurses-paid/
"Gov’t reviewing, not ending Zipline contract – Hamza Suhuyini",https://citinewsroom.com/2025/12/govt-reviewing-not-ending-zipline-contract-hamza-suhuyini/
"GMA: Poor facilities, limited incentives hampering rural doctor deployment",https://citinewsroom.com/2025/12/gma-poor-facilities-limited-incentives-hampering-rural-doctor-deployment/
Prof. Beyuo: Shift Zipline funding to district blood banks,https://citinewsroom.com/2025/12/prof-beyuo-shift-funding-to-district-blood-banks-not-drones/
NHIS active users increase now 20m – Akandoh,https://citinewsroom.com/2025/12/nhis-active-users-increase-now-20m-akandoh/
"Mission Values and Academic Excellence: A Critical, Evidence-Based Inquiry from Ghana to Africa and Beyond",https://citinewsroom.com/2025/12/mission-values-and-academic-excellence-a-critical-evidence-based-inquiry-from-ghana-to-africa-and-beyond/
Drop in WASSCE 2025 performance – Reality check or victory for integrity?,https://citinewsroom.com/2025/12/drop-in-wassce-2025-performance-reality-check-or-victory-for-integrity/
People of the land in the eyes of the politician: Mere voters or citizens of a nation?,https://citinewsroom.com/2025/12/people-of-the-land-in-the-eyes-of-the-politician-mere-voters-or-citizens-of-a-nation/
Nana Konadu Agyeman-Rawlings through the lens of a Gen Z – Juliana Odame writes,https://citinewsroom.com/2025/12/nana-konadu-agyeman-rawlings-through-the-lens-of-a-gen-z-juliana-odame-writes/
Ghana’s Heritage Fund: Safeguarding tomorrow or seizing today? -Samuel Ackom writes,https://citinewsroom.com/2025/12/ghanas-heritage-fund-safeguarding-tomorrow-or-seizing-today-samuel-ackom-writes/
