Headline,Link
Reverse 25% fee hikes or face sanctions – GTEC to UG,https://citinewsroom.com/2026/01/reverse-25-fee-hikes-or-face-sanctions-gtec-to-ug/
Agbodza: Dec 31 Philadelphia Church traffic not due to road capacity,https://citinewsroom.com/2026/01/agbodza-dec-31-philadelphia-church-traffic-not-due-to-road-capacity/
Ayawaso East MP Naser Toure laid to rest,https://citinewsroom.com/2026/01/ayawaso-east-mp-naser-toure-laid-to-rest/
“Maduro is reaping consequences” of rigged election – Ibrahim Adjei backs removal,https://citinewsroom.com/2026/01/maduro-is-reaping-consequences-of-rigged-election-ibrahim-adjei-backs-removal/
Govt to scale up road projects nationwide in 2026 – Agbodza,https://citinewsroom.com/2026/01/govt-to-scale-up-road-projects-nationwide-in-2026-agbodza/
DDEP-affected road projects being reactivated – Agbodza,https://citinewsroom.com/2026/01/ddep-affected-road-projects-being-reactivated-agbodza/
"Importers and Exporters credit BoG for Cedi recovery, lower trade costs",https://citinewsroom.com/2026/01/importers-and-exporters-credit-bog-for-cedi-recovery-lower-trade-costs/
Pay our salary arrears or we will protest again – unpaid teachers warn govt,https://citinewsroom.com/2026/01/pay-our-salary-arrears-or-we-will-protest-again-unpaid-teachers-warn-govt/
From policy to pockets: What Mahama’s second year means for prices and SMEs,https://citinewsroom.com/2026/01/from-policy-to-pockets-what-mahamas-second-year-means-for-prices-and-smes/
Ayine: Succession talks in NDC a distraction,https://citinewsroom.com/2026/01/ayine-succession-talks-in-ndc-a-distraction/
Fanteakwa residents petition IGP over food vendor’s murder,https://citinewsroom.com/2026/01/fanteakwa-residents-petition-igp-over-food-vendors-murder/
Man United coach Ruben Amorim sacked,https://citinewsroom.com/2026/01/man-united-coach-ruben-amorim-sacked/
OASL to establish 300 customary land secretariats nationwide in 2026,https://citinewsroom.com/2026/01/oasl-to-establish-300-customary-land-secretariats-nationwide-in-2026/
TOR acquires new vehicles to boost operational efficiency,https://citinewsroom.com/2026/01/tor-acquires-new-vehicles-to-boost-operational-efficiency/
AUDIO: Gov’t deploys buses to ease transport concerns – Are we only papering over the massive cracks? | #CitiCBS,https://citinewsroom.com/2025/12/audio-govt-deploys-buses-to-ease-transport-concerns-are-we-only-papering-over-the-massive-cracks-citicbs/
AUDIO: The party to end ALL parties! Here’s why you can’t miss #Citiuation2025 on Christmas Eve | #CitiCBS,https://citinewsroom.com/2025/12/audio-the-party-to-end-all-parties-heres-why-you-cant-miss-citiuation2025-on-christmas-eve-citicbs/
AUDIO: Channel One Community Legends: Here’s your chance to celebrate local heroes who are changing lives! | #CitiCBS,https://citinewsroom.com/2025/12/audio-channel-one-community-legends-heres-your-chance-to-celebrate-local-heroes-who-are-changing-lives-citicbs/
AUDIO: Failed Benin coup: Assessing the insecurity in the sub region and how Ghana can stave off chaos | #CitiCBS,https://citinewsroom.com/2025/12/audio-failed-benin-coup-assessing-the-insecurity-in-the-sub-region-and-how-ghana-can-stave-off-chaos-citicbs/
George Kofi Arthur seeks Western Regional NDC chairmanship,https://citinewsroom.com/2026/01/george-kofi-arthur-seeks-western-regional-ndc-chairmanship/
“Maduro is reaping consequences” of rigged election – Ibrahim Adjei backs removal,https://citinewsroom.com/2026/01/maduro-is-reaping-consequences-of-rigged-election-ibrahim-adjei-backs-removal/
Govt to scale up road projects nationwide in 2026 – Agbodza,https://citinewsroom.com/2026/01/govt-to-scale-up-road-projects-nationwide-in-2026-agbodza/
DDEP-affected road projects being reactivated – Agbodza,https://citinewsroom.com/2026/01/ddep-affected-road-projects-being-reactivated-agbodza/
Ayawaso East MP Naser Toure to be laid to rest today,https://citinewsroom.com/2026/01/ayawaso-east-mp-to-be-laid-to-rest-january-5/
"Importers and Exporters credit BoG for Cedi recovery, lower trade costs",https://citinewsroom.com/2026/01/importers-and-exporters-credit-bog-for-cedi-recovery-lower-trade-costs/
BoG tightens rules on International Money Transfers,https://citinewsroom.com/2026/01/bog-tightens-rules-on-international-money-transfers/
"ORC bans bearer shares, warns companies of sanctions",https://citinewsroom.com/2026/01/orc-bans-bearer-shares-warns-companies-of-sanctions/
"Robust T-bill demand sets tone for 2026 borrowing, bids exceed target by 19%",https://citinewsroom.com/2026/01/robust-t-bill-demand-sets-tone-for-2026-borrowing-bids-exceed-target-by-19/
From policy to pockets: What Mahama’s second year means for prices and SMEs,https://citinewsroom.com/2026/01/from-policy-to-pockets-what-mahamas-second-year-means-for-prices-and-smes/
Ministry of Interior announces revised curfew for Nalerigu,https://citinewsroom.com/2026/01/ministry-of-interior-announces-revised-curfew-for-nalerigu/
Police launch manhunt for third suspect in assault of 12-year-old girl,https://citinewsroom.com/2026/01/police-launch-manhunt-for-third-suspect-in-assault-of-12-year-old-girl/
Lead with courage and accountability – Anglican priest urges govt,https://citinewsroom.com/2026/01/lead-with-courage-and-accountability-anglican-priest-urges-govt/
Open manhole at Adidome lorry park poses danger to commuters and traders,https://citinewsroom.com/2026/01/open-manhole-at-adidome-lorry-park-poses-danger-to-commuters-and-traders/
Ayawaso East MP Mahama Naser Toure dies after short illness,https://citinewsroom.com/2026/01/ayawaso-east-mp-mahama-naser-toure-dies-after-short-illness/
Man United coach Ruben Amorim sacked,https://citinewsroom.com/2026/01/man-united-coach-ruben-amorim-sacked/
"AFCON Day 7: Cameroon, Ivory Coast in stalemate as Algeria reach last 16",https://citinewsroom.com/2025/12/afcon-day-7-cameroon-ivory-coast-in-stalemate-as-algeria-reach-last-16/
2026 African Athletics Championships: Local Organising Committee inaugurated,https://citinewsroom.com/2025/12/2026-african-athletics-championships-local-organising-committee-inaugurated/
2025 AFCON: Salah scores late winner goal as Egypt come from behind to beat Zimbabwe,https://citinewsroom.com/2025/12/2025-afcon-salah-scores-late-winner-goal-as-egypt-come-from-behind-to-beat-zimbabwe/
2025 AFCON officially kicks off today in Morocco,https://citinewsroom.com/2025/12/2025-afcon-officially-kicks-off-today-in-morocco/
Savannah Foto Festival puts Northern Ghana in global spotlight,https://citinewsroom.com/2026/01/savannah-foto-festival-puts-northern-ghana-in-global-spotlight/
Sarkodie: I knew Ebo Noah was creating content from day one,https://citinewsroom.com/2026/01/sarkodie-i-knew-ebo-noah-was-creating-content-from-day-one/
Nkyinkyim Band set to rekindle Ghana’s Hi-life spirit at Old Skool Night,https://citinewsroom.com/2026/01/nkyinkyim-band-set-to-rekindle-ghanas-hi-life-spirit-at-old-skool-night/
2025 in review: Controversies that shaped Ghana’s entertainment industry,https://citinewsroom.com/2025/12/2025-in-review-controversies-that-shaped-ghanas-entertainment-industry/
GTA to host “Ghana in Praise” Jan 3,https://citinewsroom.com/2025/12/gta-to-host-ghana-in-praise-jan-3/
Pope Leo calls for Venezuela to remain an independent country,https://citinewsroom.com/2026/01/pope-leo-calls-for-venezuela-to-remain-an-independent-country/
"Ghana condemns US invasion of Venezuela, calls for Maduro’s release",https://citinewsroom.com/2026/01/ghana-condemns-us-invasion-of-venezuela-calls-for-maduros-release/
Maduro in custody at New York detention centre as Trump says US will ‘run’ Venezuela,https://citinewsroom.com/2026/01/maduro-in-custody-at-new-york-detention-centre-as-trump-says-us-will-run-venezuela/
‘Deeply shocked’: World leaders react to US attack on Venezuela,https://citinewsroom.com/2026/01/deeply-shocked-world-leaders-react-to-us-attack-on-venezuela/
"Trump says Venezuelan President Maduro captured, confirms US strikes",https://citinewsroom.com/2026/01/trump-says-venezuelan-president-maduro-captured-confirms-us-strikes/
Ghanaian girls excel at Wuzhen AI competition,https://citinewsroom.com/2026/01/ghanaian-girls-excel-at-wuzhen-ai-competition/
China issues draft rules to regulate AI with human-like interaction,https://citinewsroom.com/2025/12/china-issues-draft-rules-to-regulate-ai-with-human-like-interaction/
Nvidia to license Groq technology,https://citinewsroom.com/2025/12/nvidia-to-license-groq-technology/
Virtual Assets Bill 2025:  What Its Passage Means for Ghana’s Digital Economy,https://citinewsroom.com/2025/12/virtual-assets-bill-2025-what-its-passage-means-for-ghanas-digital-economy/
"Ghana targets 30,000 AI professionals through Japan partnership",https://citinewsroom.com/2025/12/ghana-targets-30000-ai-professionals-through-japan-partnership/
NACOC: Raids on drug dens to be sustained nationwide,https://citinewsroom.com/2025/12/nacoc-raids-on-drug-dens-to-be-sustained-nationwide/
Stigmatisation discourages people from HIV testing – Gold Fields Ghana,https://citinewsroom.com/2025/12/stigmatisation-discourages-people-from-hiv-testing-gold-fields-ghana/
"Akandoh praises doctors, nurses, frontline staff for sustaining healthcare delivery",https://citinewsroom.com/2025/12/akandoh-praises-doctors-nurses-frontline-staff-for-sustaining-healthcare-delivery/
Korle-Bu to conduct mass burial of 320 unclaimed bodies,https://citinewsroom.com/2025/12/korle-bu-to-conduct-mass-burial-of-320-unclaimed-bodies/
KATH calls for urgent completion of Heal Komfo Anokye project,https://citinewsroom.com/2025/12/kath-calls-for-urgent-completion-of-heal-komfo-anokye-project/
The African aspiration for a permanent seat on the security council: The law and politics behind the elusive goal – Akua Serwaa Ampong ESQ writes,https://citinewsroom.com/2026/01/the-african-aspiration-for-a-permanent-seat-on-the-security-council-the-law-and-politics-behind-the-elusive-goal-akua-serwaa-ampong-esq-writes/
From Mining to Owning: Ghana’s Path to a Gold Investment Culture,https://citinewsroom.com/2026/01/from-mining-to-owning-ghanas-path-to-a-gold-investment-culture/
We should dance to the Cedi’s beat but remember Unilever –  Bright Simons writes,https://citinewsroom.com/2026/01/we-should-dance-to-the-cedis-beat-but-remember-unilever-bright-simons-writes/
Education in Review: 2025 marks turning point as Mahama resets Ghana’s education sector – Hashmin Mohammed writes,https://citinewsroom.com/2025/12/education-in-review-2025-marks-turning-point-as-mahama-resets-ghanas-education-sector/
GOLDBOD: Loss or no loss? The Price of Everything and The Value of Nothing,https://citinewsroom.com/2025/12/goldbod-loss-or-no-loss-the-price-of-everything-and-the-value-of-nothing/
