Headline,Link
University of Ghana probes heated Gyampo–Domfeh clash,https://citinewsroom.com/2025/11/university-of-ghana-probes-heated-gyampo-domfeh-clash/
Minority accuses gov’t of blocking reintroduction of anti-LGBTQ Bill,https://citinewsroom.com/2025/11/minority-accuses-govt-of-blocking-reintroduction-of-anti-lgbtq-bill/
2026 Budget success hinges on spending discipline – EY Boss,https://citinewsroom.com/2025/11/2026-budget-success-hinges-on-spending-discipline-ey-boss/
Blogger arrested for publishing false news granted GH¢50K bail,https://citinewsroom.com/2025/11/blogger-arrested-for-publishing-false-news-granted-gh%c2%a250k-bail/
Agent fees fuel Ghana’s high rent – Rent Control Department,https://citinewsroom.com/2025/11/agent-fees-fuel-ghanas-high-rent-rent-control-department/
Accra: Police arrest mason over alleged murder of his 13-year-old daughter,https://citinewsroom.com/2025/11/police/
Fitch Solutions projects strong economic growth for Ghana in 2026,https://citinewsroom.com/2025/11/fitch-solutions-projects-strong-economic-growth-for-ghana-in-2026/
Major Mahama case: No evidence linking Assemblyman to murder – Lawyer,https://citinewsroom.com/2025/11/major-mahama-case-no-evidence-linking-assemblyman-to-murder-lawyer/
Govt to move all MDAs to E-Payment systems by Q1 2026 – CAGD,https://citinewsroom.com/2025/11/govt-to-move-all-mdas-to-e-payment-systems-by-q1-2026-cagd/
Reduce VAT to 17.5% in mid-year review – Deloitte,https://citinewsroom.com/2025/11/reduce-vat-to-17-5-in-mid-year-review-deloitte/
Police arrest Blogger for spreading false claims about former NCA Chair,https://citinewsroom.com/2025/11/police-arrest-blogger-for-spreading-false-claims-about-former-nca-chair/
Volta Region: Police destroy 600 sacks of Indian Hemp worth GH¢4.2bn,https://citinewsroom.com/2025/11/volta-region-police-destroy-600-sacks-of-indian-hemp-worth-gh%c2%a24-2bn/
Patience Akyianu replaces Hans Nilsson as Hubtel Board Chair,https://citinewsroom.com/2025/11/patience-akyianu-replaces-hans-nilsson-as-hubtel-board-chair/
"Nearly 20,000 people living with HIV in Bono Region – Ghana AIDS Commission",https://citinewsroom.com/2025/11/nearly-20000-people-living-with-hiv-in-bono-region-ghana-aids-commission/
"Prof. Opoku-Agyemang, Egypt’s Ambassador push youth empowerment and bilateral growth",https://citinewsroom.com/2025/11/prof-opoku-agyemang-egypts-ambassador-push-youth-empowerment-and-bilateral-growth/
AUDIO:  Does 2025 budget balance growth and stability well enough? | #CitiCBS,https://citinewsroom.com/2025/11/audio-does-2025-budget-balance-growth-and-stability-well-enough-citicbs/
AUDIO: The ultimate local vs imported chicken debate as #AgriFair edges closer | #CitiCBS,https://citinewsroom.com/2025/11/audio-the-ultimate-local-vs-imported-chicken-debate-as-agrifair-edges-closer-citicbs/
"AUDIO: Dissecting the 2026 Budget – Bernard Avle interviews Finance Minister, Dr. Cassiel Ato Forson | #CitiCBS",https://citinewsroom.com/2025/11/audio-dissecting-the-2026-budget-bernard-avle-interviews-finance-minister-dr-cassiel-ato-forson-citicbs/
"AUDIO: El-Wak Military recruitment chaos: Desperation, poor planning leaves innocent families wrecked | #CitiCBS",https://citinewsroom.com/2025/11/audio-el-wak-military-recruitment-chaos-desperation-poor-planning-leaves-innocent-families-wrecked-citicbs/
Minority accuses gov’t of blocking reintroduction of anti-LGBTQ Bill,https://citinewsroom.com/2025/11/minority-accuses-govt-of-blocking-reintroduction-of-anti-lgbtq-bill/
University of Ghana probes heated Gyampo–Domfeh clash,https://citinewsroom.com/2025/11/university-of-ghana-probes-heated-gyampo-domfeh-clash/
Lands Ministry to review NAIMOS operations after tragic accident,https://citinewsroom.com/2025/11/lands-ministry-to-review-naimos-operations-after-tragic-accident/
Ghana’s economy strong enough for new jets – Ernest Norgbey,https://citinewsroom.com/2025/11/ghanas-economy-strong-enough-for-new-jets-ernest-norgbey/
2026 Budget: 141% CAPEX ambitious and unrealistic — CPS warns,https://citinewsroom.com/2025/11/2026-budget-141-capex-ambitious-and-unrealistic-cps-warns/
2026 Budget success hinges on spending discipline – EY Boss,https://citinewsroom.com/2025/11/2026-budget-success-hinges-on-spending-discipline-ey-boss/
Fitch Solutions projects strong economic growth for Ghana in 2026,https://citinewsroom.com/2025/11/fitch-solutions-projects-strong-economic-growth-for-ghana-in-2026/
Reduce VAT to 17.5% in mid-year review – Deloitte,https://citinewsroom.com/2025/11/reduce-vat-to-17-5-in-mid-year-review-deloitte/
"Strong disinflation, lower interest rates create foundation for 2026 recovery — CPS",https://citinewsroom.com/2025/11/strong-disinflation-lower-interest-rates-create-foundation-for-2026-recovery-cps/
Denmark–Ghana cold chain partnership intensifies push to minimise $3bn post-harvest losses,https://citinewsroom.com/2025/11/denmark-ghana-cold-chain-partnership-intensifies-push-to-minimise-3bn-post-harvest-losses/
French Embassy reaffirms support for Ghana’s creative and cultural industries,https://citinewsroom.com/2025/11/french-embassy-reaffirms-support-for-ghanas-creative-and-cultural-industries/
Namibia eyes Jospong partnership on waste transformation at COP30,https://citinewsroom.com/2025/11/namibia-eyes-jospong-partnership-on-waste-transformation-at-cop30/
"Pru Life Ghana, United Way commission toilet facility for Chemunaa Schools",https://citinewsroom.com/2025/11/pru-life-ghana-united-way-commission-toilet-facility-for-chemunaa-schools/
"2026 budget not fit for purpose, lacks substance – Boamah-Nyarko",https://citinewsroom.com/2025/11/2026-budget-not-fit-for-purpose-lacks-substance-boamah-nyarko/
Apologise to Ghanaians and justify need for new aircraft – Nitiwul to govt,https://citinewsroom.com/2025/11/apologise-to-ghanaians-and-justify-need-for-new-aircraft-nitiwul-to-govt/
2026 World Cup: US to prioritise visa interviews for ticket-holding fans,https://citinewsroom.com/2025/11/2026-world-cup-us-to-prioritise-visa-interviews-for-ticket-holding-fans/
DR Congo shatters Nigeria’s World Cup dream as Mbemba delivers penalty heartbreak,https://citinewsroom.com/2025/11/dr-congo-shatters-nigerias-world-cup-dream-as-mbemba-delivers-penalty-heartbreak/
Ghana’s Francis Abu successfully undergoes surgery – GFA,https://citinewsroom.com/2025/11/ghanas-francis-abu-successfully-undergoes-surgery-gfa/
2026 Budget: GH¢200m allocated for construction of mini stadiums – Ato Forson,https://citinewsroom.com/2025/11/2026-budget-gh%c2%a2200m-allocated-for-construction-of-mini-stadiums-ato-forson/
2026 Budget: GH¢150m allocated for Black Stars’ World Cup participation – Ato Forson,https://citinewsroom.com/2025/11/2026-budget-gh%c2%a2150m-allocated-for-black-stars-world-cup-participation-ato-forson/
Citiuation All-White Party set for December 24 at Ghud Park,https://citinewsroom.com/2025/11/citiuation-all-white-party-set-for-december-24-at-ghud-park/
"Channel One TV to premiere two new Ghanaian series, Junction 5 and SOSO",https://citinewsroom.com/2025/11/channel-one-tv-to-premiere-two-new-ghanaian-series-junction-5-and-soso/
"GTA CEO sets strict standards for a safer, bigger ‘Dec in GH’ 2025”",https://citinewsroom.com/2025/11/gta-ceo-sets-strict-standards-for-a-safer-bigger-dec-in-gh-2025/
‘Put Am God’ by AratheJay hits dual Apple Music “Best of 2025” playlists,https://citinewsroom.com/2025/11/put-am-god-by-arathejay-hits-dual-apple-music-best-of-2025-playlists/
Gyakie shines at Tidal Rave Wild Card event,https://citinewsroom.com/2025/11/gyakie-shines-at-tidal-rave-wild-card-event/
Trump signs bill ordering justice department to release Jeffrey Epstein files,https://citinewsroom.com/2025/11/trump-signs-bill-ordering-justice-department-to-release-jeffrey-epstein-files/
"INTERPOL Operation: 62 arrested, ammunition, 136 stolen vehicles seized in West Africa",https://citinewsroom.com/2025/11/interpol-operation-62-arrested-ammunition-stolen-vehicles-seized-in-west-africa/
At least 20 killed in one of Russia’s deadliest strikes on western Ukraine,https://citinewsroom.com/2025/11/at-least-20-killed-in-one-of-russias-deadliest-strikes-on-western-ukraine/
Epstein files bill to be sent to Trump after approval from Congress,https://citinewsroom.com/2025/11/epstein-files-bill-to-be-sent-to-trump-after-approval-from-congress/
Congress approves bill to release Epstein files that will head to Trump’s desk,https://citinewsroom.com/2025/11/congress-approves-bill-to-release-epstein-files-that-will-head-to-trumps-desk/
Yango Ride introduces new safety flow within its app in Ghana,https://citinewsroom.com/2025/11/yango-ride-introduces-new-safety-flow-within-its-app-in-ghana/
Cybastion introduces American Tech Hub at 20th Burkina Faso Digital Week,https://citinewsroom.com/2025/11/cybastion-introduces-american-tech-hub-at-20th-burkina-faso-digital-week/
Ghanaian Researcher Revolutionizes Antimicrobial Resistance Surveillance Globally,https://citinewsroom.com/2025/11/ghanaian-researcher-revolutionizes-antimicrobial-resistance-surveillance-globally/
Don’t blindly trust what AI tells you – Google’s Sundar Pichai,https://citinewsroom.com/2025/11/dont-blindly-trust-what-ai-tells-you-googles-sundar-pichai/
MEST Africa Opens Applications for Third Cohort of the Mastercard Foundation EdTech Fellowship in Ghana,https://citinewsroom.com/2025/11/mest-africa-opens-applications-for-third-cohort-of-the-mastercard-foundation-edtech-fellowship-in-ghana/
"Nearly 20,000 people living with HIV in Bono Region – Ghana AIDS Commission",https://citinewsroom.com/2025/11/nearly-20000-people-living-with-hiv-in-bono-region-ghana-aids-commission/
GMA condemns violence at Northern Regional Hospital,https://citinewsroom.com/2025/11/gma-condemns-violence-at-northern-regional-hospital/
"Rotation Nurses, Midwives threaten nationwide demonstration over delayed allowances",https://citinewsroom.com/2025/11/rotation-nurses-midwives-threaten-nationwide-demonstration-over-delayed-allowances/
Frankel foundation urges gov’t support diabetes fight,https://citinewsroom.com/2025/11/frankel-foundation-urges-govt-support-diabetes-fight/
"Radiographers push for six-year training to boost imaging quality, specialist skills",https://citinewsroom.com/2025/11/radiographers-push-for-six-year-training-to-boost-imaging-quality-specialist-skills/
In defence of justice: Reconsidering Ghana’s abolition of the death penalty – Gifty Nti Konadu writes,https://citinewsroom.com/2025/11/in-defence-of-justice-reconsidering-ghanas-abolition-of-the-death-penalty-gifty-nti-konadu-writes/
Fire breaks out in pavilion at COP30 climate talks,https://citinewsroom.com/2025/11/fire-breaks-out-in-pavilion-at-cop30-climate-talks/
Are Ghanaian institutions becoming more inclusive? Citizens say ‘yes’ but not equally,https://citinewsroom.com/2025/11/are-ghanaian-institutions-becoming-more-inclusive-citizens-say-yes-but-not-equally/
Reforming police traffic enforcement and revenue transparency in Ghana,https://citinewsroom.com/2025/11/reforming-police-traffic-enforcement-and-revenue-transparency-in-ghana/
"Healthcare, Utilities, and Schools: The public institutions Ghanaians rely on — and where informal payments still flow",https://citinewsroom.com/2025/11/healthcare-utilities-and-schools-the-public-institutions-ghanaians-rely-on-and-where-informal-payments-still-flow/
