Headline,Link
Kwanyako Water Treatment Plant resumes 100% production – GWL MD,https://citinewsroom.com/2025/10/kwanyako-water-treatment-plant-resumes-100-production-gwl-md/
"Galamsey crisis deepening, could cripple key industries – Ghana Water MD",https://citinewsroom.com/2025/10/galamsey-crisis-deepening-could-cripple-key-industries-ghana-water-md/
"CSSPS not working well, I’ll review it – Education Minister",https://citinewsroom.com/2025/10/cssps-not-working-well-ill-review-it-education-minister/
Frequent cedi swings hurting economy — Prof. Baah-Boateng warns BoG,https://citinewsroom.com/2025/10/frequent-cedi-swings-hurting-economy-prof-baah-boateng-warns-bog/
"OSP increases charges against Mustapha Hamid, nine others from 25 to 54",https://citinewsroom.com/2025/10/charges-against-mustapha-hamid-nine-others-rise-to-54-as-osp-uncovers-new-evidence/
United Party won’t survive beyond Alan — Palgrave Boakye-Danquah,https://citinewsroom.com/2025/10/united-party-wont-survive-beyond-alan-palgrave-boakye-danquah/
Ursula Owusu-Ekuful declares bid for NPP General Secretary position,https://citinewsroom.com/2025/10/ursula-owusu-ekuful-declares-bid-for-npp-general-secretary-position/
‘It’s anti-growth and a threat to industry’ – Business community rejects tariff hikes,https://citinewsroom.com/2025/10/its-anti-growth-and-a-threat-to-industry-business-community-rejects-tariff-hikes/
BoG assures of operational stability despite balance sheet pressures – Governor,https://citinewsroom.com/2025/10/bog-assures-of-operational-stability-despite-balance-sheet-pressures-governor/
OSP outlines active corruption cases as courts reopen,https://citinewsroom.com/2025/10/osp-outlines-active-corruption-cases-as-courts-reopen/
Military approach won’t end galamsey — National Coalition on Mining,https://citinewsroom.com/2025/10/military-approach-wont-end-galamsey-national-coalition-on-mining/
Zenith Bank marks 20 years with fitness and fun in Accra,https://citinewsroom.com/2025/10/zenith-bank-marks-20-years-with-fitness-and-fun-in-accra/
Investor demand for T-bills slumps as gov’t misses target by GHC3.68bn,https://citinewsroom.com/2025/10/investor-demand-for-t-bills-slumps-as-govt-misses-target-by-ghc3-68bn/
GES warns students against negative use of social media,https://citinewsroom.com/2025/10/ges-warns-students-against-negative-use-of-social-media/
VEEP assures completion of Legacy of Hope Paediatric and Children’s cancer hospital,https://citinewsroom.com/2025/10/veep-assures-completion-of-legacy-of-hope-paediatric-and-childrens-cancer-hospital/
AUDIO: Should Eddie Nketiah & Hudson-Odoi go to the World Cup with Ghana? | #CitiCBS,https://citinewsroom.com/2025/10/audio-should-eddie-nketiah-hudson-odoi-go-to-the-world-cup-with-ghana-citicbs/
AUDIO: Indiscipline on our roads! Are the police not doing enough to stop it? | #CitiCBS,https://citinewsroom.com/2025/10/audio-indiscipline-on-our-roads-are-the-police-not-doing-enough-to-stop-it-citicbs/
"Government vs Contractors: Unpaid claims, shoddy work and suffering Ghanaians | #CitiCBS",https://citinewsroom.com/2025/10/government-vs-contractors-unpaid-claims-shoddy-work-and-suffering-ghanaians-citicbs/
"AUDIO: GHS5bn arrears paid to road contractors! Roads Minister, Governs Agbodza reveals | #CitiCBS",https://citinewsroom.com/2025/10/audio-ghs5bn-arrears-paid-to-road-contractors-roads-minister-governs-agbodza-reveals-citicbs/
NDC not threatened by Alan’s United Party – Presidential staffer,https://citinewsroom.com/2025/10/ndc-not-threatened-by-alans-united-party-presidential-staffer/
"OSP increases charges against Mustapha Hamid, nine others from 25 to 54",https://citinewsroom.com/2025/10/charges-against-mustapha-hamid-nine-others-rise-to-54-as-osp-uncovers-new-evidence/
United Party won’t survive beyond Alan — Palgrave Boakye-Danquah,https://citinewsroom.com/2025/10/united-party-wont-survive-beyond-alan-palgrave-boakye-danquah/
Ursula Owusu-Ekuful declares bid for NPP General Secretary position,https://citinewsroom.com/2025/10/ursula-owusu-ekuful-declares-bid-for-npp-general-secretary-position/
Bawumia pledges annual grassroots engagement as President,https://citinewsroom.com/2025/10/bawumia-pledges-annual-grassroots-engagement-as-president/
Frequent cedi swings hurting economy — Prof. Baah-Boateng warns BoG,https://citinewsroom.com/2025/10/frequent-cedi-swings-hurting-economy-prof-baah-boateng-warns-bog/
‘It’s anti-growth and a threat to industry’ – Business community rejects tariff hikes,https://citinewsroom.com/2025/10/its-anti-growth-and-a-threat-to-industry-business-community-rejects-tariff-hikes/
BoG assures of operational stability despite balance sheet pressures – Governor,https://citinewsroom.com/2025/10/bog-assures-of-operational-stability-despite-balance-sheet-pressures-governor/
Cross-border interoperability key to Africa’s digital future – Telecom Chamber CEO,https://citinewsroom.com/2025/10/cross-border-interoperability-key-to-africas-digital-future-telecom-chamber-ceo/
Zenith Bank marks 20 years with fitness and fun in Accra,https://citinewsroom.com/2025/10/zenith-bank-marks-20-years-with-fitness-and-fun-in-accra/
"Galamsey fueling rise in kidney, liver diseases — GHOSPA warns",https://citinewsroom.com/2025/10/galamsey-fueling-rise-in-kidney-liver-diseases-ghospa-warns/
Interior Minister receives top honour from Ghana Optometric Association,https://citinewsroom.com/2025/10/interior-minister-receives-top-honour-from-ghana-optometric-association/
"Heightened security at Elubo Border as over 1,500 Ivorians flee election violence",https://citinewsroom.com/2025/10/heightened-security-at-elubo-border-as-over-1500-ivorians-flee-election-violence/
Sissala West MP supports 450 first-year SHS students,https://citinewsroom.com/2025/10/sissala-west-mp-supports-450-first-year-shs-students/
Sakumono: Three arrested over shooting and trespassing at celebrity Golf Club,https://citinewsroom.com/2025/10/sakumono-three-arrested-over-shooting-and-trespassing-at-celebrity-golf-club/
KGL Group congratulates Black Stars on qualifying for 2026 FIFA World Cup,https://citinewsroom.com/2025/10/kgl-group-congratulates-black-stars-on-qualifying-for-2026-fifa-world-cup/
Ablakwa: I’ll use World Cup qualification to secure more visa slots for fans,https://citinewsroom.com/2025/10/ablakwa-ill-use-world-cup-qualification-to-secure-more-visa-slots-for-fans/
Mahama hails Black Stars’ World Cup Qualification,https://citinewsroom.com/2025/10/mahama-hails-black-stars-world-cup-qualification/
‘Investing in youth secures our future’ – John Jinapor on ₵50K donation to Yapei United FC,https://citinewsroom.com/2025/10/investing-in-youth-secures-our-future-john-jinapor-on-%e2%82%b550k-donation-to-yapei-united-fc/
Black Stars qualify for 2026 World Cup after narrow win over Comoros,https://citinewsroom.com/2025/10/black-stars-qualify-for-2026-world-cup-after-narrow-win-over-comoros/
"Ned Nwoko blames Regina Daniels’s drug, alcohol abuse for marital crisis",https://citinewsroom.com/2025/10/ned-nwoko-blames-regina-danielss-drug-alcohol-abuse-for-marital-crisis/
"AratheJay unveils tracklist for forthcoming LP “The Odyssey”, out October 24",https://citinewsroom.com/2025/10/arathejay-unveils-tracklist-for-forthcoming-lp-the-odyssey-out-october-24/
"Osman Ayariga, Medikal, other celebrities lead fight against drug abuse",https://citinewsroom.com/2025/10/osman-ayariga-medikal-other-celebrities-lead-fight-against-drug-abuse/
Dominion TV to end broadcast October 31; relaunches as Dominion Studios,https://citinewsroom.com/2025/10/dominion-tv-to-end-broadcast-october-31-relaunches-as-dominion-studios/
Wendy Shay drops “Ready” album cover; confirms October 24 release date,https://citinewsroom.com/2025/10/wendy-shay-drops-ready-album-cover-confirms-october-24-release-date/
US warns of ‘imminent’ breach of Gaza ceasefire with planned attack on civilians,https://citinewsroom.com/2025/10/us-warns-of-imminent-breach-of-gaza-ceasefire-with-planned-attack-on-civilians/
Millions join anti-Trump ‘No Kings’ protests across US,https://citinewsroom.com/2025/10/millions-join-anti-trump-no-kings-protests-across-us/
Zelensky fails to secure Tomahawk missiles at talks with Trump,https://citinewsroom.com/2025/10/zelensky-fails-to-secure-tomahawk-missiles-at-talks-with-trump/
"After all those scandals, why did Andrew quit his titles now?",https://citinewsroom.com/2025/10/after-all-those-scandals-why-did-andrew-quit-his-titles-now/
Titan imploded due to poor engineering – US officials,https://citinewsroom.com/2025/10/titan-imploded-due-to-poor-engineering-us-officials/
AI and Health in Africa: The Race to End Preventable Maternal Deaths – Dr Abena Ntim Asamoah Writes,https://citinewsroom.com/2025/10/ai-and-health-in-africa-the-race-to-end-preventable-maternal-deaths-dr-abena-ntim-asamoah-writes/
Former UK Security Minister visits Virtual Infosec’s AI-driven cybersecurity hub,https://citinewsroom.com/2025/10/former-uk-security-minister-visits-virtual-infosecs-ai-driven-cybersecurity-hub/
"Gadgets for Ghana (G4G) presents laptops, tablets to Dzorwulu Special School",https://citinewsroom.com/2025/10/gadgets-for-ghana-g4g-presents-laptops-tablets-to-dzorwulu-special-school/
Philip Owusu-Gyamfi appointed CEO of JUMO Ghana,https://citinewsroom.com/2025/10/philip-owusu-gyamfi-appointed-ceo-of-jumo-ghana/
Yango champions e-mobility adoption in Ghana’s delivery sector,https://citinewsroom.com/2025/10/yango-bboxx-and-kofa-partner-to-accelerate-e-mobility-adoption-in-ghanas-delivery-sector/
UGMC’s HR Director honoured for excellence in healthcare workforce leadership,https://citinewsroom.com/2025/10/ugmcs-hr-director-honoured-for-excellence-in-healthcare-workforce-leadership/
"Ghana could face 180,000 unemployed health professionals by 2028 – Akandoh",https://citinewsroom.com/2025/10/ghana-could-face-180000-unemployed-health-professionals-by-2028-akandoh/
Ghana needs GHS6bn to employ 74k unemployed health workers – Akandoh,https://citinewsroom.com/2025/10/ghana-needs-ghs6bn-to-employ-74k-unemployed-health-workers-akandoh/
"Akufo-Addo govt made no budget for over 13,000 nurses recruited in 2024 – Akandoh",https://citinewsroom.com/2025/10/akufo-addo-govt-made-no-budget-for-over-13000-nurses-recruited-in-2024-akandoh/
Free primary healthcare to roll out by January 2026 – Health Minister,https://citinewsroom.com/2025/10/free-primary-healthcare-to-roll-out-by-january-2026-health-minister/
Sweet Poison: How hidden sugars are fueling Ghana’s diabetes crisis and what your doctor isn’t telling you – Abigail Arthur writes,https://citinewsroom.com/2025/10/sweet-poison-how-hidden-sugars-are-fueling-ghanas-diabetes-crisis-and-what-your-doctor-isnt-telling-you-abigail-arthur-writes/
Nathalie Yamb Urges Sahel Leaders to Break Free from the CFA Franc System,https://citinewsroom.com/2025/10/nathalie-yamb-urges-sahel-leaders-to-break-free-from-the-cfa-franc-system/
Digital Habits: The Overlooked Key to Secure Banking (Part 2),https://citinewsroom.com/2025/10/digital-habits-the-overlooked-key-to-secure-banking-part-2/
Reconsidering classroom practices for developing critical thinkers in Ghana: Insights from the UK,https://citinewsroom.com/2025/10/reconsidering-classroom-practices-for-developing-critical-thinkers-in-ghana-insights-from-the-uk/
"Made in Ghana: Our Heritage, Our Pride",https://citinewsroom.com/2025/10/made-in-ghana-our-heritage-our-pride/
