Headline,Link
Two allegedly shot dead by police in Abosso galamsey protest,https://citinewsroom.com/2025/12/two-allegedly-shot-dead-by-police-in-abosso-galamsey-protest/
ACEPA slams ninth parliament over weak fight against galamsey,https://citinewsroom.com/2025/12/acepa-slams-ninth-parliament-over-weak-fight-against-galamsey/
"Ashanti Region: Two arrested over unlawful possession of 2,600 AK-47 ammunition",https://citinewsroom.com/2025/12/ashanti-region-two-arrested-over-unlawful-possession-of-2600-ak-47-ammunition/
Senyo Hosi: GoldBod’s $214m ‘loss’ a policy cost,https://citinewsroom.com/2025/12/senyo-hosi-goldbods-214m-loss-a-policy-cost/
Mahama pays courtesy visit to Kufuor [Pictures],https://citinewsroom.com/2025/12/mahama-pays-courtesy-visit-to-kufuor-pictures/
"Tema Port dismisses claims of strike, operational disruptions",https://citinewsroom.com/2025/12/tema-port-dismisses-claims-of-strike-operational-disruptions/
Mahama set for landslide in hypothetical 2024 re-run – Global InfoAnalytics,https://citinewsroom.com/2025/12/mahama-set-for-landslide-in-hypothetical-2024-re-run-global-infoanalytics/
Oti Region: 23-year-old arrested for killing father,https://citinewsroom.com/2025/12/oti-region-23-year-old-arrested-for-killing-father/
"Mahama succession: Iddrisu, Ato Forson, Asiedu Nketia in close contest – Global InfoAnalytics",https://citinewsroom.com/2025/12/mahama-succession-iddrisu-ato-forson-asiedu-nketia-in-close-contest-global-infoanalytics/
Gov’t settles US$709m Eurobond obligation ahead of schedule,https://citinewsroom.com/2025/12/govt-settles-us709m-eurobond-obligation-ahead-of-schedule/
"Sissala West MP donates rice, cloth to widows ahead of new year",https://citinewsroom.com/2025/12/sissala-west-mp-donates-rice-cloth-to-widows-ahead-of-new-year/
"Why Star Oil, GOIL and TotalEnergies could reduce fuel prices further from January 1",https://citinewsroom.com/2025/12/why-star-oil-goil-and-totalenergies-could-reduce-fuel-prices-further-from-january-1/
"MTN announces data, airtime downtime to implement new VAT reforms",https://citinewsroom.com/2025/12/mtn-announces-data-airtime-downtime-to-implement-new-vat-reforms/
GOLDBOD: Loss or no loss? The Price of Everything and The Value of Nothing,https://citinewsroom.com/2025/12/goldbod-loss-or-no-loss-the-price-of-everything-and-the-value-of-nothing/
AUDIO: Gov’t deploys buses to ease transport concerns – Are we only papering over the massive cracks? | #CitiCBS,https://citinewsroom.com/2025/12/audio-govt-deploys-buses-to-ease-transport-concerns-are-we-only-papering-over-the-massive-cracks-citicbs/
AUDIO: The party to end ALL parties! Here’s why you can’t miss #Citiuation2025 on Christmas Eve | #CitiCBS,https://citinewsroom.com/2025/12/audio-the-party-to-end-all-parties-heres-why-you-cant-miss-citiuation2025-on-christmas-eve-citicbs/
AUDIO: Channel One Community Legends: Here’s your chance to celebrate local heroes who are changing lives! | #CitiCBS,https://citinewsroom.com/2025/12/audio-channel-one-community-legends-heres-your-chance-to-celebrate-local-heroes-who-are-changing-lives-citicbs/
AUDIO: Failed Benin coup: Assessing the insecurity in the sub region and how Ghana can stave off chaos | #CitiCBS,https://citinewsroom.com/2025/12/audio-failed-benin-coup-assessing-the-insecurity-in-the-sub-region-and-how-ghana-can-stave-off-chaos-citicbs/
"Mahama succession: Iddrisu, Ato Forson, Asiedu Nketia in close contest – Global InfoAnalytics",https://citinewsroom.com/2025/12/mahama-succession-iddrisu-ato-forson-asiedu-nketia-in-close-contest-global-infoanalytics/
Global InfoAnalytics: Bawumia opens clear lead ahead of January 31 flagbearer race,https://citinewsroom.com/2025/12/bawumia-opens-clear-lead-ahead-of-january-31-flagbearer-race/
Mustapha Gbande: NDC gov’t has shown renewed commitment in galamsey fight,https://citinewsroom.com/2025/12/mustapha-gbande-ndc-govt-has-shown-renewed-commitment-in-galamsey-fight/
Majority: GoldBod ‘losses’ are transaction costs; Minority peddling $214m propaganda,https://citinewsroom.com/2025/12/majority-goldbod-losses-are-transaction-costs-minority-peddling-214m-propaganda/
"Minority: NDC govt has no new economic ideas, just rebranding",https://citinewsroom.com/2025/12/minority-ndc-govt-has-no-new-economic-ideas-just-rebranding/
Senyo Hosi: GoldBod’s $214m ‘loss’ a policy cost,https://citinewsroom.com/2025/12/senyo-hosi-goldbods-214m-loss-a-policy-cost/
"Why Star Oil, GOIL and TotalEnergies could reduce fuel prices further from January 1",https://citinewsroom.com/2025/12/why-star-oil-goil-and-totalenergies-could-reduce-fuel-prices-further-from-january-1/
"Tema Port dismisses claims of strike, operational disruptions",https://citinewsroom.com/2025/12/tema-port-dismisses-claims-of-strike-operational-disruptions/
Mahama set for landslide in hypothetical 2024 re-run – Global InfoAnalytics,https://citinewsroom.com/2025/12/mahama-set-for-landslide-in-hypothetical-2024-re-run-global-infoanalytics/
Gov’t settles US$709m Eurobond obligation ahead of schedule,https://citinewsroom.com/2025/12/govt-settles-us709m-eurobond-obligation-ahead-of-schedule/
Heath Goldfields cleared to restart full operations at Bogoso–Prestea,https://citinewsroom.com/2025/12/heath-goldfields-cleared-to-restart-full-operations-at-bogoso-prestea/
Mahama signs Virtual Asset Service Providers law to regulate crypto in Ghana,https://citinewsroom.com/2025/12/mahama-signs-virtual-asset-service-providers-law-to-regulate-crypto-in-ghana/
Yagbonwura applauds Northern Ghana Foto Festival,https://citinewsroom.com/2025/12/yagbonwura-applauds-northern-ghana-foto-festival/
24-Hour livestock market launched in Shai-Osudoku to drive economic growth,https://citinewsroom.com/2025/12/24-hour-livestock-market-launched-in-shai-osudoku-to-drive-economic-growth/
Abuakwa: 20-year-old labourer remanded for illegal firearm possession,https://citinewsroom.com/2025/12/abuakwa-20-year-old-labourer-remanded-for-illegal-firearm-possession/
"AFCON Day 7: Cameroon, Ivory Coast in stalemate as Algeria reach last 16",https://citinewsroom.com/2025/12/afcon-day-7-cameroon-ivory-coast-in-stalemate-as-algeria-reach-last-16/
2026 African Athletics Championships: Local Organising Committee inaugurated,https://citinewsroom.com/2025/12/2026-african-athletics-championships-local-organising-committee-inaugurated/
2025 AFCON: Salah scores late winner goal as Egypt come from behind to beat Zimbabwe,https://citinewsroom.com/2025/12/2025-afcon-salah-scores-late-winner-goal-as-egypt-come-from-behind-to-beat-zimbabwe/
2025 AFCON officially kicks off today in Morocco,https://citinewsroom.com/2025/12/2025-afcon-officially-kicks-off-today-in-morocco/
Morocco set for colourful opening ceremony as AFCON 2025 kicks off,https://citinewsroom.com/2025/12/morocco-set-for-colourful-opening-ceremony-as-afcon-2025-kicks-off/
GTA to host “Ghana in Praise” Jan 3,https://citinewsroom.com/2025/12/gta-to-host-ghana-in-praise-jan-3/
Yagbonwura applauds Northern Ghana Foto Festival,https://citinewsroom.com/2025/12/yagbonwura-applauds-northern-ghana-foto-festival/
Despite denies taking sides in Daddy Lumba family dispute,https://citinewsroom.com/2025/12/despite-denies-taking-sides-in-daddy-lumba-family-dispute/
Kumasi Evangel Choir tours Europe and Asia,https://citinewsroom.com/2025/12/kumasi-evangel-choir-tours-europe-and-asia/
Michael Adangba’s legacy concert draws massive turnout,https://citinewsroom.com/2025/12/michael-adangbas-legacy-concert-draws-massive-turnout/
Guinea junta chief wins presidential election by landslide,https://citinewsroom.com/2025/12/guinea-junta-chief-wins-presidential-election-by-landslide/
Thieves drill into German bank vault and make off with millions,https://citinewsroom.com/2025/12/thieves-drill-into-german-bank-vault-and-make-off-with-millions/
Your ‘talk talk party’ couldn’t deliver stable currency – Kobby Mensah to Oppong Nkrumah,https://citinewsroom.com/2025/12/your-talk-talk-party-couldnt-deliver-stable-currency-kobby-mensah-to-oppong-nkrumah/
Trump hopes to reach phase two of Gaza ceasefire ‘very quickly’,https://citinewsroom.com/2025/12/trump-hopes-to-reach-phase-two-of-gaza-ceasefire-very-quickly/
Ukraine denies claim that drone attack targeted Putin’s residence,https://citinewsroom.com/2025/12/ukraine-denies-claim-that-drone-attack-targeted-putins-residence/
China issues draft rules to regulate AI with human-like interaction,https://citinewsroom.com/2025/12/china-issues-draft-rules-to-regulate-ai-with-human-like-interaction/
Nvidia to license Groq technology,https://citinewsroom.com/2025/12/nvidia-to-license-groq-technology/
Virtual Assets Bill 2025:  What Its Passage Means for Ghana’s Digital Economy,https://citinewsroom.com/2025/12/virtual-assets-bill-2025-what-its-passage-means-for-ghanas-digital-economy/
"Ghana targets 30,000 AI professionals through Japan partnership",https://citinewsroom.com/2025/12/ghana-targets-30000-ai-professionals-through-japan-partnership/
"With freebies, OpenAI, Google vie for Indian users and training data",https://citinewsroom.com/2025/12/with-freebies-openai-google-vie-for-indian-users-and-training-data/
NACOC: Raids on drug dens to be sustained nationwide,https://citinewsroom.com/2025/12/nacoc-raids-on-drug-dens-to-be-sustained-nationwide/
Stigmatisation discourages people from HIV testing – Gold Fields Ghana,https://citinewsroom.com/2025/12/stigmatisation-discourages-people-from-hiv-testing-gold-fields-ghana/
"Akandoh praises doctors, nurses, frontline staff for sustaining healthcare delivery",https://citinewsroom.com/2025/12/akandoh-praises-doctors-nurses-frontline-staff-for-sustaining-healthcare-delivery/
Korle-Bu to conduct mass burial of 320 unclaimed bodies,https://citinewsroom.com/2025/12/korle-bu-to-conduct-mass-burial-of-320-unclaimed-bodies/
KATH calls for urgent completion of Heal Komfo Anokye project,https://citinewsroom.com/2025/12/kath-calls-for-urgent-completion-of-heal-komfo-anokye-project/
GOLDBOD: Loss or no loss? The Price of Everything and The Value of Nothing,https://citinewsroom.com/2025/12/goldbod-loss-or-no-loss-the-price-of-everything-and-the-value-of-nothing/
The side of Ghana’s festive season nobody talks about: December is becoming exploitation — And we pretend it’s all vibes,https://citinewsroom.com/2025/12/the-side-of-ghanas-festive-season-nobody-talks-about-december-is-becoming-exploitation-and-we-pretend-its-all-vibes/
"Ghana in 2025: A year that tested, turned, and transformed the Nation",https://citinewsroom.com/2025/12/ghana-in-2025-a-year-that-tested-turned-and-transformed-the-nation/
Bright Simons writes: Is talk of “losses” by GoldBod just abstract drivel?,https://citinewsroom.com/2025/12/bright-simons-writes-is-talk-of-losses-by-goldbod-just-abstract-drivel/
Part two: Key observations on the Constitutional Review Committee report submitted to President Mahama – Alex Boateng writes,https://citinewsroom.com/2025/12/part-two-key-observations-on-the-constitutional-review-committee-report-submitted-to-president-mahama-alex-boateng-writes/
