Headline,Link
VAT threshold raised to GHS750K to support small businesses – GRA,https://citinewsroom.com/2025/11/vat-threshold-raised-to-ghs750k-to-support-small-businesses-gra/
"Security forces arrest Kwahuhene, Queen Mother amid Kwahu palace tensions",https://citinewsroom.com/2025/11/security-forces-arrest-kwahuhene-queen-mother-amid-kwahu-palace-tensions/
Place youth at the heart of policy — Lord Paul Boateng tells African leaders,https://citinewsroom.com/2025/11/place-youth-at-the-heart-of-policy-lord-paul-boateng-tells-african-leaders/
"Australia, Canada, UK launch joint campaign to combat visa fraud in Ghana",https://citinewsroom.com/2025/11/australia-canada-uk-launch-joint-campaign-to-combat-visa-fraud-in-ghana/
Assin Breku: NPP Polling Station Chairman dies in motorbike accident,https://citinewsroom.com/2025/11/assin-breku-npp-polling-station-chairman-dies-in-motorbike-accident/
New appliance import rules take effect Dec 1 — Energy Commission warns,https://citinewsroom.com/2025/11/new-appliance-import-rules-take-effect-dec-1-energy-commission-warns/
"Sell Presidential Jet, buy new one if necessary – Ibrahim Adjei advises gov’t",https://citinewsroom.com/2025/11/sell-presidential-jet-buy-new-one-if-necessary-ibrahim-adjei-advises-govt/
"GoldBod denies GH¢3bn loss claim, calls report “false and contrived”",https://citinewsroom.com/2025/11/goldbod-denies-gh%c2%a23bn-loss-claim-calls-report-false-and-contrived/
GAF recruitment stampede: Allow the investigation to proceed – Deputy NPA Boss,https://citinewsroom.com/2025/11/gaf-recruitment-stampede-allow-the-investigation-to-proceed-deputy-npa-boss/
"GAF recruitment resumes November 20 in Accra, Four more locations added",https://citinewsroom.com/2025/11/gaf-recruitment-resumes-november-20-in-accra-four-more-locations-added/
Nationwide security agencies recruitment begins today — Here’s how to apply,https://citinewsroom.com/2025/11/nationwide-security-agencies-recruitment-begins-today-heres-how-to-apply/
Newmont pays GH₵2.3bn to Ghana’s gov’t,https://citinewsroom.com/2025/11/newmont-pays-gh%e2%82%b52-3bn-to-ghanas-govt/
"Cedi appreciation could hurt exports, jobs — Economist cautions",https://citinewsroom.com/2025/11/cedi-appreciation-could-hurt-exports-jobs-economist-cautions/
DR Congo shatters Nigeria’s World Cup dream as Mbemba delivers penalty heartbreak,https://citinewsroom.com/2025/11/dr-congo-shatters-nigerias-world-cup-dream-as-mbemba-delivers-penalty-heartbreak/
Ghana’s Francis Abu successfully undergoes surgery – GFA,https://citinewsroom.com/2025/11/ghanas-francis-abu-successfully-undergoes-surgery-gfa/
"AUDIO: Man burns wife, 5 kids over infidelity claims: Has society let down domestic abuse survivors? | #CitiCBS",https://citinewsroom.com/2025/11/audio-man-burns-wife-5-kids-over-infidelity-claims-has-society-let-down-domestic-abuse-survivors-citicbs/
AUDIO: Local rice is BETTER! The Citi Breakfast Show team explains why | #CitiCBS,https://citinewsroom.com/2025/11/audio-local-rice-is-better-the-citi-breakfast-show-team-explains-why-citicbs/
AUDIO: What’s Ghana’s best path to devt? Are MPs overburdened by constituents’ requests | #CitiCBS,https://citinewsroom.com/2025/11/audio-whats-ghanas-best-path-to-devt-are-mps-overburdened-by-constituents-requests-citicbs/
"AUDIO: Old machines, inadequate storage –  Felix Kamassah breaks down issues with rice sector | #CitiCBS",https://citinewsroom.com/2025/11/audio-old-machines-inadequate-storage-felix-kamassah-breaks-down-issues-with-rice-sector-citicbs/
Assin Breku: NPP Polling Station Chairman dies in motorbike accident,https://citinewsroom.com/2025/11/assin-breku-npp-polling-station-chairman-dies-in-motorbike-accident/
GAF recruitment: Stop giving youth ‘false hope’ on public sector jobs — Ibrahim Adjei,https://citinewsroom.com/2025/11/gaf-recruitment-stop-giving-youth-false-hope-on-public-sector-jobs-ibrahim-adjei/
"Sell Presidential Jet, buy new one if necessary – Ibrahim Adjei advises gov’t",https://citinewsroom.com/2025/11/sell-presidential-jet-buy-new-one-if-necessary-ibrahim-adjei-advises-govt/
GAF recruitment stampede: Allow the investigation to proceed – Deputy NPA Boss,https://citinewsroom.com/2025/11/gaf-recruitment-stampede-allow-the-investigation-to-proceed-deputy-npa-boss/
Ghana to establish specialised courts for audit failures and galamsey cases,https://citinewsroom.com/2025/11/ghana-to-establish-specialised-courts-for-audit-failures-and-galamsey-cases/
VAT threshold raised to GHS750K to support small businesses – GRA,https://citinewsroom.com/2025/11/vat-threshold-raised-to-ghs750k-to-support-small-businesses-gra/
Newmont pays GH₵2.3bn to Ghana’s gov’t,https://citinewsroom.com/2025/11/newmont-pays-gh%e2%82%b52-3bn-to-ghanas-govt/
New appliance import rules take effect Dec 1 — Energy Commission warns,https://citinewsroom.com/2025/11/new-appliance-import-rules-take-effect-dec-1-energy-commission-warns/
"Cedi appreciation could hurt exports, jobs — Economist cautions",https://citinewsroom.com/2025/11/cedi-appreciation-could-hurt-exports-jobs-economist-cautions/
Kwame Pianim to deliver keynote at University of Gold Coast’s 2025 graduation,https://citinewsroom.com/2025/11/kwame-pianim-to-deliver-keynote-at-university-of-gold-coasts-2025-graduation/
"Jospong Group showcases over 1,000 green jobs from recycling initiative at COP30 Brazil",https://citinewsroom.com/2025/11/jospong-group-showcases-over-1000-green-jobs-from-recycling-initiative-at-cop30-brazil/
"Gunmen in Police uniform attack Kwahu Palace, Queenmother abducted",https://citinewsroom.com/2025/11/gunmen-in-police-uniform-attack-kwahu-palace-queenmother-abducted/
Declare state of emergency in galamsey-hit zones – Catholic Bishops urge gov’t,https://citinewsroom.com/2025/11/declare-state-of-emergency-in-galamsey-hit-zones-catholic-bishops-urge-govt/
EU awards Ghana €2.4m to support four forest restoration projects,https://citinewsroom.com/2025/11/eu-awards-ghana-e2-4m-to-support-four-forest-restoration-projects/
Jospong Group charts path from carbon market vision to action at COP30,https://citinewsroom.com/2025/11/jospong-group-charts-path-from-carbon-market-vision-to-action-at-cop30/
DR Congo shatters Nigeria’s World Cup dream as Mbemba delivers penalty heartbreak,https://citinewsroom.com/2025/11/dr-congo-shatters-nigerias-world-cup-dream-as-mbemba-delivers-penalty-heartbreak/
Ghana’s Francis Abu successfully undergoes surgery – GFA,https://citinewsroom.com/2025/11/ghanas-francis-abu-successfully-undergoes-surgery-gfa/
2026 Budget: GH¢200m allocated for construction of mini stadiums – Ato Forson,https://citinewsroom.com/2025/11/2026-budget-gh%c2%a2200m-allocated-for-construction-of-mini-stadiums-ato-forson/
2026 Budget: GH¢150m allocated for Black Stars’ World Cup participation – Ato Forson,https://citinewsroom.com/2025/11/2026-budget-gh%c2%a2150m-allocated-for-black-stars-world-cup-participation-ato-forson/
Sulley Muntari safe in Dubai — Manager denies arrest reports,https://citinewsroom.com/2025/11/sulley-muntari-safe-in-dubai-manager-denies-arrest-reports/
I don’t struggle to write songs – Piesie Esther,https://citinewsroom.com/2025/11/i-dont-struggle-to-write-songs-piesie-esther/
REFFA unveils nomination list with 121 film entries from 21 countries,https://citinewsroom.com/2025/11/reffa-unveils-nomination-list-with-121-film-entries-from-21-countries/
KKD appointed Ghana’s Special Envoy to the Caribbean Region,https://citinewsroom.com/2025/11/kkd-appointed-ghanas-special-envoy-to-the-caribbean-region/
The Untouchable Weekend: A three-day celebration of DJ Mensah,https://citinewsroom.com/2025/11/the-untouchable-weekend-a-three-day-celebration-of-dj-mensah/
Akwaaba UK unveils lineup of December 2025 events in Ghana,https://citinewsroom.com/2025/11/akwaaba-uk-unveils-lineup-of-december-2025-events-in-ghana/
Refugees to face 20-year wait to settle permanently under UK asylum reforms,https://citinewsroom.com/2025/11/refugees-to-face-20-year-wait-to-settle-permanently-under-uk-asylum-reforms/
Feud erupts between Trump and ally Marjorie Taylor Greene ahead of Epstein files vote,https://citinewsroom.com/2025/11/feud-erupts-between-trump-and-ally-marjorie-taylor-greene-ahead-of-epstein-files-vote/
Thousands protest against Mexican gov’t as clashes leave 120 injured,https://citinewsroom.com/2025/11/thousands-protest-against-mexican-govt-as-clashes-leave-120-injured/
Trump says he will likely sue the BBC for up to $5bn over edited speech,https://citinewsroom.com/2025/11/trump-says-he-will-likely-sue-the-bbc-for-up-to-5bn-over-edited-speech/
Gabon court sentences former first lady and son of ex-President to 20 years for corruption,https://citinewsroom.com/2025/11/gabon-court-sentences-former-first-lady-and-son-of-ex-president-to-20-years-for-corruption/
German President commends AmaliTech’s Ghana–Germany Digital Partnership,https://citinewsroom.com/2025/11/german-president-commends-amalitechs-ghana-germany-digital-partnership/
Edtech Mondays: EdTech for Special Needs: Inclusive Education for All,https://citinewsroom.com/2025/11/edtech-mondays-edtech-for-special-needs-inclusive-education-for-all-2/
"AI visibility lies, hype around chatbots and “Generative SEO” is misleading SMEs",https://citinewsroom.com/2025/11/ai-visibility-lies-hype-around-chatbots-and-generative-seo-is-misleading-smes/
Edtech Mondays: EdTech for Special Needs: Inclusive Education for All,https://citinewsroom.com/2025/10/edtech-mondays-edtech-for-special-needs-inclusive-education-for-all/
Why Your Snapchat Wasn’t Working This Morning: Inside the AWS Outage That Broke the Internet,https://citinewsroom.com/2025/10/why-your-snapchat-wasnt-working-this-morning-inside-the-aws-outage-that-broke-the-internet/
Frankel foundation urges gov’t support diabetes fight,https://citinewsroom.com/2025/11/frankel-foundation-urges-govt-support-diabetes-fight/
"Radiographers push for six-year training to boost imaging quality, specialist skills",https://citinewsroom.com/2025/11/radiographers-push-for-six-year-training-to-boost-imaging-quality-specialist-skills/
FDA orders recall of Choice Irish Cream Flavoured Drink containing erectile dysfunction drug,https://citinewsroom.com/2025/11/fda-orders-recall-of-choice-irish-cream-flavoured-drink-containing-erectile-dysfunction-drug/
80% of Junior Doctors to be posted to districts – Akandoh,https://citinewsroom.com/2025/11/80-of-junior-doctors-to-be-posted-to-districts-akandoh/
"2,500 cervical cancer deaths recorded in 2024 — Deputy Health Minister",https://citinewsroom.com/2025/11/2500-cervical-cancer-deaths-recorded-in-2024-deputy-health-minister/
"Rising Voices, Unshakable Faith: Reflections on The God Summit",https://citinewsroom.com/2025/11/rising-voices-unshakable-faith-reflections-on-the-god-summit/
Kwesi Yankah writes: Dying to be a soldier,https://citinewsroom.com/2025/11/kwesi-yankah-writes-dying-to-be-a-soldier/
"Equal education, unequal treatment: A call for justice in teacher training support",https://citinewsroom.com/2025/11/equal-education-unequal-treatment-a-call-for-justice-in-teacher-training-support/
Economic witch-hunting and the price of progress: Ghana’s silent betrayal of its builders – Nana Kofi Barfour writes,https://citinewsroom.com/2025/11/economic-witch-hunting-and-the-price-of-progress-ghanas-silent-betrayal-of-its-builders-nana-kofi-barfour-writes/
President Samia Suluhu Hassan: Test or affront to gender advocacy? -Juliana Odame writes,https://citinewsroom.com/2025/11/president-samia-suluhu-hassan-test-or-affront-to-gender-advocacy-juliana-odame-writes/
