Headline,Link
US exempts Ghana from latest visa restrictions – Ablakwa reveals,https://citinewsroom.com/2025/12/us-exempts-ghana-from-latest-visa-restrictions-ablakwa-reveals/
Asante Akyem Pekyerekye: Residents declare war on galamsey,https://citinewsroom.com/2025/12/asante-akyem-pekyerekye-residents-declare-war-on-galamsey/
Ghana deploys army engineers to aid hurricane-hit Jamaica,https://citinewsroom.com/2025/12/ghana-deploys-army-engineers-to-aid-hurricane-hit-jamaica/
Education Ministry denies 13th-month salary claim,https://citinewsroom.com/2025/12/education-ministry-denies-13th-month-salary-claim/
Bawku conflict: Allow peace to prevail – Eric Twum to factions,https://citinewsroom.com/2025/12/bawku-conflict-allow-peace-to-prevail-eric-twum-to-factions/
Obuasi: Police arrest 40 in dawn swoops on criminal hideouts,https://citinewsroom.com/2025/12/obuasi-police-arrest-40-in-dawn-swoops-on-criminal-hideouts/
FIFA introduces $60 World Cup tickets after fan outcry,https://citinewsroom.com/2025/12/fifa-introduces-60-world-cup-tickets-after-fan-outcry/
"Walewale: Gunmen open fire on bus, two critically injured",https://citinewsroom.com/2025/12/walewale-gunmen-open-fire-on-bus-two-critically-injured/
Ghana’s upstream oil sector safe for investment – Government,https://citinewsroom.com/2025/12/ghanas-upstream-petroleum-sector-safe-for-investment-govt-assures-investors/
Invest in rural healthcare to save lives – Ofori Panin tells gov’t,https://citinewsroom.com/2025/12/invest-in-rural-healthcare-to-save-lives-ofori-panin-tells-govt/
Mastercard expands acceptance network across Africa by 45% in 2025,https://citinewsroom.com/2025/12/mastercard-expands-acceptance-network-across-africa-by-45-in-2025/
Producer Price Inflation slows to 1.3% in November,https://citinewsroom.com/2025/12/producer-inflation-eases-to-1-3-in-november-as-factory-gate-prices-fall/
"Cybele Energy targets seismic studies, exploration after securing Guyana Oil Block",https://citinewsroom.com/2025/12/cybele-energy-targets-seismic-studies-exploration-after-securing-guyana-oil-block/
I’ll seek re-election – Fifi Kwetey declares,https://citinewsroom.com/2025/12/ill-seek-re-election-fifi-kwetey-declares/
AUDIO: Gov’t deploys buses to ease transport concerns – Are we only papering over the massive cracks? | #CitiCBS,https://citinewsroom.com/2025/12/audio-govt-deploys-buses-to-ease-transport-concerns-are-we-only-papering-over-the-massive-cracks-citicbs/
AUDIO: The party to end ALL parties! Here’s why you can’t miss #Citiuation2025 on Christmas Eve | #CitiCBS,https://citinewsroom.com/2025/12/audio-the-party-to-end-all-parties-heres-why-you-cant-miss-citiuation2025-on-christmas-eve-citicbs/
AUDIO: Channel One Community Legends: Here’s your chance to celebrate local heroes who are changing lives! | #CitiCBS,https://citinewsroom.com/2025/12/audio-channel-one-community-legends-heres-your-chance-to-celebrate-local-heroes-who-are-changing-lives-citicbs/
AUDIO: Failed Benin coup: Assessing the insecurity in the sub region and how Ghana can stave off chaos | #CitiCBS,https://citinewsroom.com/2025/12/audio-failed-benin-coup-assessing-the-insecurity-in-the-sub-region-and-how-ghana-can-stave-off-chaos-citicbs/
Ghana deploys army engineers to aid hurricane-hit Jamaica,https://citinewsroom.com/2025/12/ghana-deploys-army-engineers-to-aid-hurricane-hit-jamaica/
US exempts Ghana from latest visa restrictions – Ablakwa reveals,https://citinewsroom.com/2025/12/us-exempts-ghana-from-latest-visa-restrictions-ablakwa-reveals/
"Fifi Kwetey: Early flagbearer talk an insult to NDC, Mahama",https://citinewsroom.com/2025/12/fifi-kwetey-early-flagbearer-talk-an-insult-to-ndc-mahama/
I’ll seek re-election – Fifi Kwetey declares,https://citinewsroom.com/2025/12/ill-seek-re-election-fifi-kwetey-declares/
NDC: There will be no third term for Mahama,https://citinewsroom.com/2025/12/ndc-there-will-be-no-third-term-for-mahama/
Mastercard expands acceptance network across Africa by 45% in 2025,https://citinewsroom.com/2025/12/mastercard-expands-acceptance-network-across-africa-by-45-in-2025/
Producer Price Inflation slows to 1.3% in November,https://citinewsroom.com/2025/12/producer-inflation-eases-to-1-3-in-november-as-factory-gate-prices-fall/
"Cybele Energy targets seismic studies, exploration after securing Guyana Oil Block",https://citinewsroom.com/2025/12/cybele-energy-targets-seismic-studies-exploration-after-securing-guyana-oil-block/
Ghana’s upstream oil sector safe for investment – Government,https://citinewsroom.com/2025/12/ghanas-upstream-petroleum-sector-safe-for-investment-govt-assures-investors/
Ato Forson: BoG boards must remain functional despite new gov’t,https://citinewsroom.com/2025/12/ato-forson-bog-boards-must-remain-functional-despite-new-govt/
"Volta Region: Two dead, several injured in Hosita road accident",https://citinewsroom.com/2025/12/volta-region-two-dead-several-injured-in-hosita-road-accident/
Global Media Alliance ranked among Africa’s best at 2025 HR Focus Award,https://citinewsroom.com/2025/12/global-media-alliance-ranked-among-africas-best-at-2025-hr-focus-award/
"DOSH, MobileMoney Ltd partner to expand digital health insurance access in Ghana",https://citinewsroom.com/2025/12/dosh-mobilemoney-ltd-partner-to-expand-digital-health-insurance-access-in-ghana/
Ghana Card compulsory for motor insurance from Jan 2026,https://citinewsroom.com/2025/12/ghana-card-compulsory-for-motor-insurance-from-jan-2026/
DRIP low-bed truck abandoned after fire incident in Central Region,https://citinewsroom.com/2025/12/drip-low-bed-truck-abandoned-after-fire-incident-in-central-region/
FIFA introduces $60 World Cup tickets after fan outcry,https://citinewsroom.com/2025/12/fifa-introduces-60-world-cup-tickets-after-fan-outcry/
"Karim Zito must go, Kotoko needs a fresh direction – Kumasi Mayor",https://citinewsroom.com/2025/12/karim-zito-must-go-kotoko-needs-a-fresh-direction-kumasi-mayor/
Ghana gains global exposure at World Robot Olympiad finals in Singapore,https://citinewsroom.com/2025/12/ghana-gains-global-exposure-at-world-robot-olympiad-finals-in-singapore/
Keta-based supporters appeal for Dede Ayew’s inclusion in Black Stars squad,https://citinewsroom.com/2025/12/keta-based-supporters-appeal-for-dede-ayews-inclusion-in-black-stars-squad/
Angry fans throw chairs and bottles at Messi event in India,https://citinewsroom.com/2025/12/angry-fans-throw-chairs-and-bottles-at-messi-event-in-india/
R2Bees unveil double single release ‘Two Two’ and ‘Awurade Aye’,https://citinewsroom.com/2025/12/r2bees-unveil-double-single-release-two-two-and-awurade-aye/
Ooni of Ife: The modern monarch who just honoured President Mahama,https://citinewsroom.com/2025/12/ooni-of-ife-the-modern-monarch-who-just-honoured-president-mahama/
2025 Citiuation: Nkyinkyim Band promises special treat for patrons,https://citinewsroom.com/2025/12/2025-citiuation-nkyinkyim-band-promises-special-treat-for-patrons/
"REFFA Awards 2025: A night of glitz, glamour and celebration of African stories",https://citinewsroom.com/2025/12/reffa-awards-2025-a-night-of-glitz-glamour-and-celebration-of-african-stories/
China commits $30m to renovate Ghana’s National Theatre,https://citinewsroom.com/2025/12/china-commits-30m-to-renovate-ghanas-national-theatre/
Russian ban on Roblox gaming platform sparks rare protest,https://citinewsroom.com/2025/12/russian-ban-on-roblox-gaming-platform-sparks-rare-protest/
"Sydney bondi beach shooting: Father, Son named as gunmen, 15 dead",https://citinewsroom.com/2025/12/sydney-bondi-beach-shooting-father-son-named-as-gunmen-15-dead/
Coup: Benin Republic arrests Ex-president’s son,https://citinewsroom.com/2025/12/coup-benin-republic-arrests-ex-presidents-son/
"ECOWAS condemns coups, strengthens regional security measures",https://citinewsroom.com/2025/12/ecowas-condemns-coups-strengthens-regional-security-measures/
Benin coup suspect’s escape may heighten regional tensions – Analyst,https://citinewsroom.com/2025/12/benin-coup-suspects-escape-may-heighten-regional-tensions-analyst/
"Smartphone prices to rise 7% in 2026 due to AI-fueled chip shortage, new data shows",https://citinewsroom.com/2025/12/smartphone-prices-to-rise-7-in-2026-due-to-ai-fueled-chip-shortage-new-data-shows/
Resilio Africa: Google.org backs 3-year cybersecurity project,https://citinewsroom.com/2025/12/resilio-africa-google-org-backs-3-year-cybersecurity-project/
CHRAJ calls for stronger protection of Children’s digital rights,https://citinewsroom.com/2025/12/chraj-calls-for-stronger-protection-of-childrens-digital-rights/
Trump signs order to block states from enforcing own AI rules,https://citinewsroom.com/2025/12/trump-signs-order-to-block-states-from-enforcing-own-ai-rules/
"Reddit sues Australia over social media ban, citing free speech threat",https://citinewsroom.com/2025/12/reddit-sues-australia-over-social-media-ban-citing-free-speech-threat/
Invest in rural healthcare to save lives – Ofori Panin tells gov’t,https://citinewsroom.com/2025/12/invest-in-rural-healthcare-to-save-lives-ofori-panin-tells-govt/
"Mintah Akandoh: GH¢22bn health budget to strengthen infrastructure, workforce",https://citinewsroom.com/2025/12/mintah-akandoh-gh%c2%a222bn-health-budget-to-strengthen-infrastructure-workforce/
Eastern Regional Committee of Ghana AIDS Commission inaugurated,https://citinewsroom.com/2025/12/eastern-regional-committee-of-ghana-aids-commission-inaugurated/
"Unemployed graduate nurses, midwives threaten demo over posting delays",https://citinewsroom.com/2025/12/unemployed-graduate-nurses-midwives-threaten-demo-over-posting-delays/
Rising Breast Cancer cases strain Korle Bu – Surgeon demands more centres,https://citinewsroom.com/2025/12/rising-breast-cancer-cases-strain-korle-bu-surgeon-demands-more-centres/
"Tackling unemployment in Ghana, unadulterated role of SMEs -Laud Nartey writes",https://citinewsroom.com/2025/12/tackling-unemployment-in-ghana-unadulterated-role-of-smes-laud-nartey-writes/
Bright Simons asks: Is Bank of Ghana’s “Islamic Banking” Rebrand too clever by half?,https://citinewsroom.com/2025/12/bright-simons-asks-is-bank-of-ghanas-islamic-banking-rebrand-too-clever-by-half/
How global industries can benefit from next-generation AI cybersecurity models,https://citinewsroom.com/2025/12/how-global-industries-can-benefit-from-next-generation-ai-cybersecurity-models/
Beyond Abu Trica: Are Ghana’s banks failing as gatekeepers of financial integrity,https://citinewsroom.com/2025/12/beyond-abu-trica-are-ghanas-banks-failing-as-gatekeepers-of-financial-integrity/
DVLA’S new number plates; some observations…,https://citinewsroom.com/2025/12/dvlas-new-number-plates-some-observations/
