Headline,Link
"Health Ministry: Nearly 100,000 trained health workers unemployed",https://citinewsroom.com/2025/05/health-ministry-nearly-100000-trained-health-workers-unemployed/
Four Police officers promoted for outstanding professionalism,https://citinewsroom.com/2025/05/four-police-officers-promoted-for-outstanding-professionalism/
‘We are sanitising Judicial system’ – Tanko backs ruling against CJ’s injunction,https://citinewsroom.com/2025/05/we-are-sanitising-judicial-system-tanko-backs-ruling-against-cjs-injunction/
C/R: NDC Branch Executives reject MCE nominee for Effutu,https://citinewsroom.com/2025/05/c-r-ndc-branch-executives-reject-mce-nominee-for-effutu/
18 rooms destroyed in Maaha Beach Resort fire – Ellembelle Fire Commander,https://citinewsroom.com/2025/05/18-rooms-destroyed-in-maaha-beach-resort-fire-ellembelle-fire-commander/
Bryan Acheampong forms exploratory committee ahead of NPP Flagbearer bid,https://citinewsroom.com/2025/05/bryan-acheampong-forms-exploratory-committee-ahead-of-npp-flagbearer-bid/
CJ removal can’t be halted over Article 146 flaws – Martin Kpebu,https://citinewsroom.com/2025/05/cj-removal-cant-be-halted-over-article-146-flaws-martin-kpebu/
Ghana’s Embassy in Washington D.C reopens today,https://citinewsroom.com/2025/05/ghanas-embassy-in-washington-d-c-reopens-today/
"Over 2,000 health officers still unposted — Parliamentary Committee demands action",https://citinewsroom.com/2025/05/over-2000-health-officers-still-unposted-parliamentary-committee-demands-action/
Fire ravages Maaha Beach Resort; several structures destroyed,https://citinewsroom.com/2025/05/fire-erupts-at-maaha-beach-resort/
Wontumi spends another night in EOCO custody over unmet bail terms,https://citinewsroom.com/2025/05/wontumi-to-spend-another-night-in-eoco-custody-over-unmet-bail-terms/
U.S. Embassy bids farewell to Ambassador Virginia Palmer,https://citinewsroom.com/2025/05/u-s-embassy-bids-farewell-to-ambassador-virginia-palmer/
Ato Forson appointed Returning Officer for AfDB presidential elections,https://citinewsroom.com/2025/05/ato-forson-appointed-returning-officer-for-afdb-presidential-elections/
Don’t weaponise bail system against ordinary citizens – Zaato to govt,https://citinewsroom.com/2025/05/dont-weaponise-bail-system-against-ordinary-citizens-zaato-to-govt/
Venture Capital Trust Fund to Drive SME Financing Under 24-Hour Economy Policy,https://citinewsroom.com/2025/05/venture-capital-trust-fund-to-drive-sme-financing-under-24-hour-economy-policy/
"Eyewitness News, Monday, 10th March, 2025",https://citinewsroom.com/2025/03/eyewitness-news-monday-10th-march-2025/
"Citi Breakfast Show, Monday, 10th March, 2025",https://citinewsroom.com/2025/03/citi-breakfast-show-monday-10th-march-2025/
Heritage on-Air Series | Celebrating Iconic Ghanaian Music | Ep5,https://citinewsroom.com/2025/03/heritage-on-air-series-the-story-of-ghanaian-music-through-the-years-ep5/
"FamLife | Ghanaian Marriage Paradigms | Saturday, 8th March, 2025",https://citinewsroom.com/2025/03/famlife-ghanaian-marriage-paradigms-saturday-8th-march-2025/
Wontumi supporters were only marketing themselves – Tanko Computer,https://citinewsroom.com/2025/05/wontumi-supporters-were-only-marketing-themselves-tanko-computer/
Don’t weaponise bail system against ordinary citizens – Zaato to govt,https://citinewsroom.com/2025/05/dont-weaponise-bail-system-against-ordinary-citizens-zaato-to-govt/
‘We are sanitising Judicial system’ – Tanko backs ruling against CJ’s injunction,https://citinewsroom.com/2025/05/we-are-sanitising-judicial-system-tanko-backs-ruling-against-cjs-injunction/
C/R: NDC Branch Executives reject MCE nominee for Effutu,https://citinewsroom.com/2025/05/c-r-ndc-branch-executives-reject-mce-nominee-for-effutu/
Dumsor: Provide lasting solution to power crisis – Minority,https://citinewsroom.com/2025/05/dumsor-provide-lasting-solution-to-power-crisis-minority/
Govt reaffirms commitment to fair debt talks under G20 Framework,https://citinewsroom.com/2025/05/govt-reaffirms-commitment-to-fair-debt-talks-under-g20-framework/
Reduced public spending behind Cedi’s recent strength – APL,https://citinewsroom.com/2025/05/reduced-public-spending-behind-cedis-recent-strength-apl/
Recent cedi gains may be temporary without deeper reforms – APL,https://citinewsroom.com/2025/05/recent-cedi-gains-may-be-temporary-without-deeper-reforms-apl/
Ato Forson appointed Returning Officer for AfDB presidential elections,https://citinewsroom.com/2025/05/ato-forson-appointed-returning-officer-for-afdb-presidential-elections/
"GEXIM partners Saudi EXIM to facilitate trade, project financing",https://citinewsroom.com/2025/05/gexim-partners-saudi-exim-to-facilitate-trade-project-financing/
GBfoods Ghana crowned overall Manufacturing Company of the Year at 9th Ghana Manufacturing Awards,https://citinewsroom.com/2025/05/gbfoods-ghana-crowned-overall-manufacturing-company-of-the-year-at-9th-ghana-manufacturing-awards/
Residents of Jamestown benefit from ASA Savings and Loans medical screening exercise,https://citinewsroom.com/2025/05/residents-of-jamestown-benefit-from-asa-savings-and-loans-medical-screening-exercise/
Effia-Kwesimintsim MCE distributes sanitary pads to mark menstrual health day,https://citinewsroom.com/2025/05/effia-kwesimintsim-mce-distributes-sanitary-pads-to-mark-menstrual-health-day/
Awutu Senya East MP leads campaign to end menstrual stigma,https://citinewsroom.com/2025/05/awutu-senya-east-mp-leads-campaign-to-end-menstrual-stigma/
‘We are tired of excuses – GRNMA laments over poor conditions of service,https://citinewsroom.com/2025/05/we-are-tired-of-excuses-grnma-laments-over-poor-conditions-of-service/
Black Stars: Otto Addo names 23-man squad for 2025 Unity Cup in London,https://citinewsroom.com/2025/05/black-stars-otto-addo-names-23-man-squad-for-2025-unity-cup-in-london/
"Ronaldo tops Curry, Fury on Forbes’ highest-paid list",https://citinewsroom.com/2025/05/ronaldo-tops-curry-fury-on-forbes-highest-paid-list/
Liverpool trio among PL player of the season nominees,https://citinewsroom.com/2025/05/liverpool-trio-among-pl-player-of-the-season-nominees/
Why are PSG and Mbappe facing each other in court?,https://citinewsroom.com/2025/05/why-are-psg-and-mbappe-facing-each-other-in-court/
Weija-Gbawe MP re-elected President of Ghana Weightlifting Federation,https://citinewsroom.com/2025/05/weija-gbawe-mp-re-elected-president-of-ghana-weightlifting-federation/
"Team Eternity, Joe Mettle to minister at 5th anniversary of Invasion Ghana on June 22",https://citinewsroom.com/2025/05/team-eternity-joe-mettle-to-minister-at-5th-anniversary-of-invasion-ghana-on-june-22/
Minstrel Pardikie set to release new single titled ‘OKAMAFO’ on May 28,https://citinewsroom.com/2025/05/minstrel-pardikie-set-to-release-new-single-titled-okamafo-on-may-28/
‘We don’t manufacture Prophecies’ – Nigel Gaisie defends 31st Night revelations,https://citinewsroom.com/2025/05/we-dont-manufacture-prophecies-nigel-gaisie-defends-31st-night-revelations/
Lekzy De Comic adjudged Comedian of the Year for second time,https://citinewsroom.com/2025/05/lekzy-de-comic-adjudged-comedian-of-the-year-for-second-time/
Ga South: Obaakrowa D/A students fear academic disruption amid rains,https://citinewsroom.com/2025/05/ga-south-obaakrowa-d-a-students-fear-academic-disruption-amid-rains/
Elon Musk leaves White House but says DOGE will continue,https://citinewsroom.com/2025/05/elon-musk-leaves-white-house-but-says-doge-will-continue/
SpaceX launches ninth Starship test flight before spacecraft breaks apart,https://citinewsroom.com/2025/05/spacex-launches-ninth-starship-test-flight-before-spacecraft-breaks-apart/
Vatican renews offer to host Russia-Ukraine peace talks,https://citinewsroom.com/2025/05/vatican-renews-offer-to-host-russia-ukraine-peace-talks/
"Trump suspends new student visa appointments, Ghanaian applicants affected",https://citinewsroom.com/2025/05/trump-suspends-new-student-visa-appointments-ghanaian-applicants-affected/
"Ghanaian, Nigerian nationals face trial in India over $94,000 fraud scheme",https://citinewsroom.com/2025/05/ghanaian-nigerian-nationals-face-trial-in-india-over-94000-fraud-scheme/
Telegram announces partnership with Musk’s xAI,https://citinewsroom.com/2025/05/telegram-announces-partnership-with-musks-xai/
"Why Meta is in trouble in Nigeria and what this means for Facebook, Instagram, and WhatsApp users",https://citinewsroom.com/2025/05/why-meta-is-in-trouble-in-nigeria-and-what-this-means-for-facebook-instagram-and-whatsapp-users/
Data cost to reduce by end of year — Sam George,https://citinewsroom.com/2025/05/data-cost-to-reduce-by-end-of-year-sam-george/
Samsung’s QLED Technology delivers next-level TV viewing experience,https://citinewsroom.com/2025/05/samsungs-qled-technology-delivers-next-level-tv-viewing-experience/
Still booting after all these years: The people stuck using ancient Windows computers,https://citinewsroom.com/2025/05/still-booting-after-all-these-years-the-people-stuck-using-ancient-windows-computers/
"Health Ministry: Nearly 100,000 trained health workers unemployed",https://citinewsroom.com/2025/05/health-ministry-nearly-100000-trained-health-workers-unemployed/
‘We are tired of excuses – GRNMA laments over poor conditions of service,https://citinewsroom.com/2025/05/we-are-tired-of-excuses-grnma-laments-over-poor-conditions-of-service/
Approve posting of 599 Pharmacists or risk healthcare crisis – GHOSPA to govt,https://citinewsroom.com/2025/05/approve-posting-of-599-pharmacists-or-risk-healthcare-crisis-ghospa-to-govt/
MP and academic Dr. Kingsley Agyemang leads study on Africa’s obesity intervention gaps,https://citinewsroom.com/2025/05/mp-and-academic-dr-kingsley-agyemang-leads-study-on-africas-obesity-intervention-gaps/
Rotational nurses and midwives to strike on June 2,https://citinewsroom.com/2025/05/rotational-nurses-and-midwives-to-strike-on-june-2/
Is Cholesterol Good or Bad?,https://citinewsroom.com/2025/05/is-cholesterol-good-or-bad/
Powering Ghana’s Future: A Manifesto for Resetting the Energy Sector – Albert Neenyi Ayirebi-Acquah writes,https://citinewsroom.com/2025/05/powering-ghanas-future-a-manifesto-for-resetting-the-energy-sector-albert-neenyi-ayirebi-acquah-writes/
Debunking credit card myths in Ghana – Muhammad Shamsudeen Ibrahim writes,https://citinewsroom.com/2025/05/debunking-credit-card-myths-in-ghana-muhammad-shamsudeen-ibrahim-writes/
John Mahama writes: Trump’s unfounded attack on Cyril Ramaphosa was an insult to all Africans,https://citinewsroom.com/2025/05/john-mahama-writes-trumps-unfounded-attack-on-cyril-ramaphosa-was-an-insult-to-all-africans/
Aburi Botanical Gardens: A beautiful yet neglected tourist gem in need of urgent attention,https://citinewsroom.com/2025/05/aburi-botanical-gardens-a-beautiful-yet-neglected-tourist-gem-in-need-of-urgent-attention/
