Headline,Link
Violence disrupts Ablekuma North rerun as Macho men storm polling centre [Video],https://citinewsroom.com/2025/07/violence-disrupts-ablekuma-north-rerun-as-macho-men-storm-polling-centre/
Police Officer interdicted for assaulting Journalist at Ablekuma North rerun,https://citinewsroom.com/2025/07/police-officer-interdicted-for-assaulting-journalist-at-ablekuma-north-rerun/
"Ablekuma North: Hawa Koomson, Akua Afriyie assaulted by unknown Macho men [Video]",https://citinewsroom.com/2025/07/ablekuma-north-hawa-koomson-akua-afriyie-assaulted-by-unknown-macho-men/
Providing T&T is not vote-buying – Linda Ocloo justifies support for voters,https://citinewsroom.com/2025/07/providing-tt-is-not-vote-buying-linda-ocloo-justifies-support-for-voters/
"‘I feel threatened, my eyes are shaking’ – GHOne Journalist after Police assault",https://citinewsroom.com/2025/07/i-feel-threatened-my-eyes-are-shaking-ghone-journalist-after-police-assault/
Ablekuma North: Police officer assaults GHOne TV journalist,https://citinewsroom.com/2025/07/ablekuma-north-rerun-police-officer-assaults-ghone-tv-journalist/
Ablekuma North: EC under serious coercion – Okoe Boye,https://citinewsroom.com/2025/07/ablekuma-north-ec-under-serious-coercion-okoe-boye/
"Ghana responds to U.S. Visa Policy changes, seeks swift resolution",https://citinewsroom.com/2025/07/ghana-responds-to-u-s-visa-policy-changes-seeks-swift-resolution/
Ablekuma North rerun: NPP will lose all 19 polling stations – Kalamu,https://citinewsroom.com/2025/07/ablekuma-north-rerun-npp-will-lose-all-19-polling-stations-kalamu/
Ablekuma North: Suspected ‘uniformed impostors’ arrested,https://citinewsroom.com/2025/07/ablekuma-north-suspected-uniformed-impostors-arrested/
Voting begins across 19 polling stations in Ablekuma North,https://citinewsroom.com/2025/07/voting-begins-across-19-polling-stations-in-ablekuma-north/
Ablekuma North rerun [PHOTOS],https://citinewsroom.com/2025/07/ablekuma-north-rerun-photos/
Official: Tottenham sign West Ham midfielder Kudus for £55m,https://citinewsroom.com/2025/07/tottenham-sign-west-ham-midfielder-kudus-for-55m/
Haruna Iddrisu showcases Ghana’s TVET success in Botswana,https://citinewsroom.com/2025/07/haruna-iddrisu-showcases-ghanas-tvet-success-in-botswana/
Bank of Ghana orders digital asset firms to register by August 15,https://citinewsroom.com/2025/07/bank-of-ghana-orders-digital-asset-firms-to-register-by-august-15/
‘How Fintech is changing the Business Landscape’ with Martin Kwame Awagah | Citi Business Festival On-Air Series,https://citinewsroom.com/2025/06/how-fintech-is-changing-the-business-landscape-with-martin-kwame-awagah-citi-business-festival-on-air-series/
‘Understanding The Digital Economy’ with Anthony Fesu | Citi Business Festival On-Air Series,https://citinewsroom.com/2025/06/understanding-the-digital-economy-with-anthony-fesu-citi-business-festival-on-air-series/
‘Basic Legal Education for SMEs’ with Jonathan Amable | Citi Business Festival On-Air Series Ep9,https://citinewsroom.com/2025/06/basic-legal-education-for-smes-with-jonathan-amable-citi-business-festival-on-air-series-ep9/
‘Understanding The Seed And Agri-Input Economy’ with Dr. Amos Rutherford Azinu | CBF On-Air Series,https://citinewsroom.com/2025/06/understanding-the-seed-and-agri-input-economy-with-dr-amos-rutherford-azinu-cbf-on-air-series/
Police Officer interdicted for assaulting Journalist at Ablekuma North rerun,https://citinewsroom.com/2025/07/police-officer-interdicted-for-assaulting-journalist-at-ablekuma-north-rerun/
"Ablekuma North: Hawa Koomson, Akua Afriyie assaulted by unknown Macho men [Video]",https://citinewsroom.com/2025/07/ablekuma-north-hawa-koomson-akua-afriyie-assaulted-by-unknown-macho-men/
Violence disrupts Ablekuma North rerun as Macho men storm polling centre [Video],https://citinewsroom.com/2025/07/violence-disrupts-ablekuma-north-rerun-as-macho-men-storm-polling-centre/
Providing T&T is not vote-buying – Linda Ocloo justifies support for voters,https://citinewsroom.com/2025/07/providing-tt-is-not-vote-buying-linda-ocloo-justifies-support-for-voters/
Ablekuma North rerun [PHOTOS],https://citinewsroom.com/2025/07/ablekuma-north-rerun-photos/
IOMP a bold step to correct investment imbalance – Julius Debrah,https://citinewsroom.com/2025/07/iomp-a-bold-step-to-correct-investment-imbalance-julius-debrah/
Govt banks on Investment Mapping Project to decentralise FDI flows,https://citinewsroom.com/2025/07/government-banks-on-investment-mapping-project-to-decentralise-fdi-flows/
Food safety key to MSME growth – Standards Authority advises processors,https://citinewsroom.com/2025/07/food-safety-key-to-msme-growth-standards-authority-advises-processors/
SME Ghana Awards relaunched with MTN as headline sponsor to boost sector growth,https://citinewsroom.com/2025/07/sme-ghana-awards-relaunched-with-mtn-as-headline-sponsor-to-boost-sector-growth/
Bank of Ghana orders digital asset firms to register by August 15,https://citinewsroom.com/2025/07/bank-of-ghana-orders-digital-asset-firms-to-register-by-august-15/
“It’s possible to survive in Public Service without corruption” – Prof. Bawole,https://citinewsroom.com/2025/07/its-possible-to-survive-in-public-service-without-corruption-prof-bawole/
Muslimah Mentorship Network holds empowerment session at Abubakari Siddiq Islamic School,https://citinewsroom.com/2025/07/muslimah-mentorship-network-holds-empowerment-session-at-abubakari-siddiq-islamic-school/
Concerned small-scale miners’ President arrested by anti-galamsey taskforce,https://citinewsroom.com/2025/07/concerned-small-scale-miners-president-arrested-by-anti-galamsey-taskforce/
Ashigbey urges AG to reopen case of assaulted Citi FM Journalist,https://citinewsroom.com/2025/07/ashigbey-urges-ag-to-reopen-case-of-assaulted-citi-fm-journalist/
NLC orders TEWU-GH to end strike,https://citinewsroom.com/2025/07/nlc-orders-tewu-gh-to-end-strike/
GUSA to represent Ghana at 2025 FISU Games in Germany,https://citinewsroom.com/2025/07/gusa-to-represent-ghana-at-2025-fisu-games-in-germany/
Bawumia hails Kudus’ £55m move to Tottenham Hotspur,https://citinewsroom.com/2025/07/bawumia-hails-kudus-55m-move-to-tottenham-hotspur/
Ghana to host 2025 African youth and junior weightlifting championship,https://citinewsroom.com/2025/07/ghana-to-host-2025-african-youth-and-junior-weightlifting-championship/
Channel One TV and Citi FM partner Absa for Absa Black Star Marathon,https://citinewsroom.com/2025/07/channel-one-tv-citi-fm-partners-absa-for-upcoming-black-star-marathon/
"I went to Saudi for trophies, not money – Mendy",https://citinewsroom.com/2025/06/i-went-to-saudi-for-trophies-not-money-mendy/
Official: Tottenham sign West Ham midfielder Kudus for £55m,https://citinewsroom.com/2025/07/tottenham-sign-west-ham-midfielder-kudus-for-55m/
DopeNation drops third studio album GhanaPiano – The Album,https://citinewsroom.com/2025/07/dopenation-drops-third-studio-album-ghanapiano-the-album/
Addiself shines in Canada,https://citinewsroom.com/2025/07/addiself-shines-in-canada/
Meet BLR Boys: The collective redefining brotherhood through music,https://citinewsroom.com/2025/07/meet-blr-boys-the-collective-redefining-brotherhood-through-music/
"Sean ‘Diddy’ Combs convicted on prostitution counts, but cleared of more serious charges",https://citinewsroom.com/2025/07/sean-diddy-combs-convicted-on-prostitution-counts-but-cleared-of-more-serious-charges/
"Trump praises ‘good English’ of Liberian president, prompting criticism across Africa",https://citinewsroom.com/2025/07/trump-praises-good-english-of-liberian-president-prompting-criticism-across-africa/
"Kenya’s president defiant, backs security forces after deadly protests",https://citinewsroom.com/2025/07/kenyas-president-defiant-backs-security-forces-after-deadly-protests/
Deadly new Russian drone attack hits Kyiv,https://citinewsroom.com/2025/07/deadly-new-russian-drone-attack-hits-kyiv/
"Ex-Bangladesh leader authorised deadly crackdown, leaked audio suggests",https://citinewsroom.com/2025/07/ex-bangladesh-leader-authorised-deadly-crackdown-leaked-audio-suggests/
Mahama extends condolences to Trump over deadly Texas floods,https://citinewsroom.com/2025/07/mahama-extends-condolences-to-trump-over-deadly-texas-floods/
China sidesteps question on TikTok after Trump says close to deal,https://citinewsroom.com/2025/07/china-sidesteps-question-on-tiktok-after-trump-says-close-to-deal/
Cybervergent selected as World Economic Forum’s 2025 technology pioneer company,https://citinewsroom.com/2025/07/cybervergent-selected-as-world-economic-forums-2025-technology-pioneer-company/
Samsung rolls out AI-centric security upgrades,https://citinewsroom.com/2025/07/samsung-rolls-out-ai-centric-security-upgrades/
Google expands Gemini AI for classrooms. But is Africa in the room?,https://citinewsroom.com/2025/06/google-expands-gemini-ai-tools-for-classrooms-bringing-new-features-for-educators-but-is-africa-in-the-room/
Real Quantum Dot Technology in Samsung QLED TVs: Delivering Exceptional Picture Quality,https://citinewsroom.com/2025/06/real-quantum-dot-technology-in-samsung-qled-tvs-delivering-exceptional-picture-quality/
Ghana Chamber of Health pledges support to operationalize Agenda 111,https://citinewsroom.com/2025/07/__trashed-24/
HIV surge signals failure in education and support systems – Mahama,https://citinewsroom.com/2025/07/hiv-surge-signals-failure-in-education-and-support-systems-mahama/
NHIA pays additional GH¢267m to hospitals,https://citinewsroom.com/2025/07/nhia-pays-additional-gh%c2%a2267m-to-hospitals/
Health Ministry pledges Catheterisation Lab for KATH following Doctor’s death,https://citinewsroom.com/2025/07/health-ministry-pledges-catheterisation-lab-for-kath-following-doctors-death/
Health Minister to address Parliament on Ghana’s COVID-19 surge today,https://citinewsroom.com/2025/07/health-minister-to-address-parliament-on-ghanas-covid-19-surge-today/
In defence of “smart” exchange rate intervention after crises: Why the IMF may be wrong this time,https://citinewsroom.com/2025/07/in-defence-of-smart-exchange-rate-intervention-after-crises-why-the-imf-may-be-wrong-this-time/
The passing on Ernest Yaw Kumi: A loss to Akwatia and Ghana’s Parliament,https://citinewsroom.com/2025/07/the-passing-on-ernest-yaw-kumi-a-loss-to-akwatia-and-ghanas-parliament/
Keeping it agile in Ghana: How top tech is transforming modern work,https://citinewsroom.com/2025/07/keeping-it-agile-in-ghana-how-top-tech-is-transforming-modern-work-olayiwola-writes/
How scammers hack phones with links and images vrs How to outsmart them -Samuel Ackom writes,https://citinewsroom.com/2025/07/how-scammers-hack-phones-with-links-and-images-vrs-how-to-outsmart-them-samuel-ackom-writes/
Beyond Jubilee: Lessons from Ghana’s Oil and Gas Journey and Promise of Eban-Akoma Discovery -Ananpansah Bartholomew Abraham writes,https://citinewsroom.com/2025/07/beyond-jubilee-lessons-from-ghanas-oil-and-gas-journey-and-promise-of-eban-akoma-discovery-ananpansah-bartholomew-abraham-writes/
