Headline,Link
Dollarisation threatens Cedi stability — BoG Governor,https://citinewsroom.com/2025/07/dollarisation-threatens-cedi-stability-bog-governor/
Agbodza: No compensation for buildings erected after road approvals,https://citinewsroom.com/2025/07/agbodza-no-compensation-for-buildings-erected-after-road-approvals/
Ablekuma North: NPP’s indecision caused low turnout – Adomako Kissi,https://citinewsroom.com/2025/07/ablekuma-north-npps-indecision-caused-low-turnout-adomako-kissi/
Education Ministry secures $117m for Basic School interventions,https://citinewsroom.com/2025/07/education-ministry-secures-117m-for-basic-school-interventions/
NPP suspends Agona West 2024 Parliamentary Candidate for defying party directive,https://citinewsroom.com/2025/07/npp-suspends-agona-west-2024-parliamentary-candidate-for-defying-party-directive/
Parliament to pass National Scholarship Authority Bill this week – Nortsu-Kotoe,https://citinewsroom.com/2025/07/parliament-to-pass-national-scholarship-authority-bill-this-week-nortsu-kotoe/
Ablekuma North: Interdiction of Police officer inappropriate – Adomako Kissi,https://citinewsroom.com/2025/07/ablekuma-north-interdiction-of-police-officer-inappropriate-adomako-kissi/
James Agalga chairs new GACL Board; pledges support for aviation hub vision,https://citinewsroom.com/2025/07/james-agalga-chairs-new-gacl-board-pledges-support-for-aviation-hub-vision/
Mahama scraps fuel allowances for appointees,https://citinewsroom.com/2025/07/mahama-scraps-fuel-allowances-for-appointees/
Clamp down on illegal mining kingpins – Coalition against Galamsey,https://citinewsroom.com/2025/07/clamp-down-on-illegal-mining-kingpins-coalition-against-galamsey/
"GHS to roll out 24-hour services at CHPS compounds, polyclinics",https://citinewsroom.com/2025/07/ghs-to-roll-out-24-hour-services-at-chps-compounds-polyclinics/
Withdrawing Military from Bawku not the solution – Larry Dogbey,https://citinewsroom.com/2025/07/withdrawing-military-from-bawku-not-the-solution-larry-dogbey/
Madina: Two suspects arrested for defiling 14-year-old girl,https://citinewsroom.com/2025/07/madina-two-suspects-arrested-for-defiling-14-year-old-girl/
Hundreds hold candlelight procession in Akwatia to honour Ernest Kumi,https://citinewsroom.com/2025/07/hundreds-hold-candlelight-procession-in-akwatia-to-honour-ernest-kumi/
Interior Minister inaugurates new Fire Service Council,https://citinewsroom.com/2025/07/interior-minister-inaugurates-new-fire-service-council/
‘How Fintech is changing the Business Landscape’ with Martin Kwame Awagah | Citi Business Festival On-Air Series,https://citinewsroom.com/2025/06/how-fintech-is-changing-the-business-landscape-with-martin-kwame-awagah-citi-business-festival-on-air-series/
‘Understanding The Digital Economy’ with Anthony Fesu | Citi Business Festival On-Air Series,https://citinewsroom.com/2025/06/understanding-the-digital-economy-with-anthony-fesu-citi-business-festival-on-air-series/
‘Basic Legal Education for SMEs’ with Jonathan Amable | Citi Business Festival On-Air Series Ep9,https://citinewsroom.com/2025/06/basic-legal-education-for-smes-with-jonathan-amable-citi-business-festival-on-air-series-ep9/
‘Understanding The Seed And Agri-Input Economy’ with Dr. Amos Rutherford Azinu | CBF On-Air Series,https://citinewsroom.com/2025/06/understanding-the-seed-and-agri-input-economy-with-dr-amos-rutherford-azinu-cbf-on-air-series/
Ablekuma North: NPP’s indecision caused low turnout – Adomako Kissi,https://citinewsroom.com/2025/07/ablekuma-north-npps-indecision-caused-low-turnout-adomako-kissi/
NPP suspends Agona West 2024 Parliamentary Candidate for defying party directive,https://citinewsroom.com/2025/07/npp-suspends-agona-west-2024-parliamentary-candidate-for-defying-party-directive/
Withdrawing Military from Bawku not the solution – Larry Dogbey,https://citinewsroom.com/2025/07/withdrawing-military-from-bawku-not-the-solution-larry-dogbey/
NPP bigwigs condemn top-down flagbearer election ‘plot’,https://citinewsroom.com/2025/07/npp-bigwigs-condemn-top-down-flagbearer-election-plot/
Ablekuma North: Interdiction of Police officer inappropriate – Adomako Kissi,https://citinewsroom.com/2025/07/ablekuma-north-interdiction-of-police-officer-inappropriate-adomako-kissi/
Dollarisation threatens Cedi stability — BoG Governor,https://citinewsroom.com/2025/07/dollarisation-threatens-cedi-stability-bog-governor/
James Agalga chairs new GACL Board; pledges support for aviation hub vision,https://citinewsroom.com/2025/07/james-agalga-chairs-new-gacl-board-pledges-support-for-aviation-hub-vision/
BoG warns against rejection of coins,https://citinewsroom.com/2025/07/bog-warns-against-rejection-of-coins/
BudgIT Ghana launches simplified 2025 budget,https://citinewsroom.com/2025/07/budgit-ghana-launches-simplified-2025-budget/
Mahama reconstitutes GIPC Board to drive strategic investment agenda,https://citinewsroom.com/2025/07/mahama-reconstitutes-gipc-board-to-drive-strategic-investment-agenda/
Govt sets August 18 deadline for registration of mining machinery,https://citinewsroom.com/2025/07/govt-sets-august-18-deadline-for-registration-of-mining-machinery/
C/R: Two jailed 20 years for cable theft,https://citinewsroom.com/2025/07/c-r-two-jailed-20-years-for-cable-theft/
Catch the upcoming 2025/26 Football Season on DStv and GOtv!,https://citinewsroom.com/2025/07/catch-the-upcoming-2025-26-football-season-on-dstv-and-gotv/
“SafeCare is Changing Lives”: Gradually redefining quality care in Ghana,https://citinewsroom.com/2025/07/safecare-is-changing-lives-gradually-redefining-quality-care-in-ghana/
Chiefs demand inclusion in allocation of lands for extractive activities,https://citinewsroom.com/2025/07/chiefs-demand-inclusion-in-allocation-of-lands-for-extractive-activities/
GUSA to represent Ghana at 2025 FISU Games in Germany,https://citinewsroom.com/2025/07/gusa-to-represent-ghana-at-2025-fisu-games-in-germany/
Bawumia hails Kudus’ £55m move to Tottenham Hotspur,https://citinewsroom.com/2025/07/bawumia-hails-kudus-55m-move-to-tottenham-hotspur/
Ghana to host 2025 African youth and junior weightlifting championship,https://citinewsroom.com/2025/07/ghana-to-host-2025-african-youth-and-junior-weightlifting-championship/
Channel One TV and Citi FM partner Absa for Absa Black Star Marathon,https://citinewsroom.com/2025/07/channel-one-tv-citi-fm-partners-absa-for-upcoming-black-star-marathon/
"I went to Saudi for trophies, not money – Mendy",https://citinewsroom.com/2025/06/i-went-to-saudi-for-trophies-not-money-mendy/
DJ Millzy’s Pine & Jinja Campus Tour wraps up with 100K reach,https://citinewsroom.com/2025/07/dj-millzys-pine-jinja-campus-tour-wraps-up-with-100k-reach/
The Chat: Ghana lost global spotlight by abandoning hiplife – Nana Yaw 18,https://citinewsroom.com/2025/07/the-chat-ghana-lost-global-spotlight-by-abandoning-hiplife-nana-yaw-18/
Ghana grows movie premiere ignites new thinking among youth in Ashaiman,https://citinewsroom.com/2025/07/ghana-grows-movie-premiere-ignites-new-thinking-among-youth-in-ashaiman/
Official: Tottenham sign West Ham midfielder Kudus for £55m,https://citinewsroom.com/2025/07/tottenham-sign-west-ham-midfielder-kudus-for-55m/
DopeNation drops third studio album GhanaPiano – The Album,https://citinewsroom.com/2025/07/dopenation-drops-third-studio-album-ghanapiano-the-album/
Trump threatens Russia with tariffs while unveiling Ukraine weapons plan,https://citinewsroom.com/2025/07/trump-threatens-russia-with-tariffs-while-unveiling-ukraine-weapons-plan/
Kenya drops visa requirements for all African countries,https://citinewsroom.com/2025/07/kenya-drops-visa-requirement-for-all-african-countries/
South African police minister suspended over organised crime allegations,https://citinewsroom.com/2025/07/south-african-police-minister-suspended-over-organised-crime-allegations/
EU and Mexico criticise Trump’s proposed 30% tariff,https://citinewsroom.com/2025/07/eu-and-mexico-criticise-trumps-proposed-30-tariff/
"Trump praises ‘good English’ of Liberian president, prompting criticism across Africa",https://citinewsroom.com/2025/07/trump-praises-good-english-of-liberian-president-prompting-criticism-across-africa/
Yango holds 2nd edition of Ghana Hackathon to support tech innovation and youth empowerment,https://citinewsroom.com/2025/07/yango-holds-2nd-edition-of-ghana-hackathon-to-support-tech-innovation-and-youth-empowerment/
China sidesteps question on TikTok after Trump says close to deal,https://citinewsroom.com/2025/07/china-sidesteps-question-on-tiktok-after-trump-says-close-to-deal/
Cybervergent selected as World Economic Forum’s 2025 technology pioneer company,https://citinewsroom.com/2025/07/cybervergent-selected-as-world-economic-forums-2025-technology-pioneer-company/
Samsung rolls out AI-centric security upgrades,https://citinewsroom.com/2025/07/samsung-rolls-out-ai-centric-security-upgrades/
Google expands Gemini AI for classrooms. But is Africa in the room?,https://citinewsroom.com/2025/06/google-expands-gemini-ai-tools-for-classrooms-bringing-new-features-for-educators-but-is-africa-in-the-room/
"GHS to roll out 24-hour services at CHPS compounds, polyclinics",https://citinewsroom.com/2025/07/ghs-to-roll-out-24-hour-services-at-chps-compounds-polyclinics/
Mahama taps US-trained surgeon as Deputy Health Minister,https://citinewsroom.com/2025/07/mahama-taps-us-trained-surgeon-as-deputy-health-minister/
"NHIA, KOFIH hold conference on Diabetes and Hypertension management",https://citinewsroom.com/2025/07/nhia-kofih-hold-conference-on-diabetes-and-hypertension-management/
Ghana Chamber of Health pledges support to operationalize Agenda 111,https://citinewsroom.com/2025/07/__trashed-24/
HIV surge signals failure in education and support systems – Mahama,https://citinewsroom.com/2025/07/hiv-surge-signals-failure-in-education-and-support-systems-mahama/
Absa Bank’s Force for Good: The Impact So Far,https://citinewsroom.com/2025/07/absa-banks-force-for-good-the-impact-so-far/
Echoes from Ablekuma North: Can Ghana protect journalists while safeguarding democracy?”,https://citinewsroom.com/2025/07/echoes-from-ablekuma-north-can-ghana-protect-journalists-while-safeguarding-democracy/
The unending cycle of electoral violence in Ghana – Juliana Odame writes,https://citinewsroom.com/2025/07/the-unending-cycle-of-electoral-violence-in-ghana-juliana-odame-writes/
1500 women in Ghana to benefit from free future ready skills training and job placement,https://citinewsroom.com/2025/07/1500-women-in-ghana-to-benefit-from-free-future-ready-skills-training-and-job-placement/
In defence of “smart” exchange rate intervention after crises: Why the IMF may be wrong this time,https://citinewsroom.com/2025/07/in-defence-of-smart-exchange-rate-intervention-after-crises-why-the-imf-may-be-wrong-this-time/
