Headline,Link
Kwakye Ofosu: Energy levy has helped stabilise power sector,https://citinewsroom.com/2026/01/kwakye-ofosu-energy-levy-has-helped-stabilise-power-sector/
Kwakye Ofosu: Fewer Ministers have led to significant savings,https://citinewsroom.com/2026/01/kwakye-ofosu-fewer-ministers-have-led-to-significant-savings/
Eastern Region: Man arrested for attempted sale of 3-year-old son for GH¢1m,https://citinewsroom.com/2026/01/eastern-region-man-arrested-for-attempted-sale-of-3-year-old-son-for-gh%c2%a21m/
"Ghana’s economy expands 3.8% in October 2025, led by services sector",https://citinewsroom.com/2026/01/ghanas-economy-expands-3-8-in-october-2025-led-by-services-sector/
"US extends AGOA for three years, strengthening Ghana trade ties",https://citinewsroom.com/2026/01/us-extends-agoa-for-three-years-strengthening-ghana-trade-ties/
Customs intercepts 25m suspected illicit tablets at Takoradi Port,https://citinewsroom.com/2026/01/customs-intercepts-25m-suspected-illicit-tablets-at-takoradi-port/
Suspect in Kalakpa forest officer killing found dead in Police custody,https://citinewsroom.com/2026/01/suspect-in-kalakpa-forest-officer-killing-found-dead-in-police-custody/
"Urban transport challenges are district issues, not central gov’t failures – IMCC Secretary",https://citinewsroom.com/2026/01/transport-challenges-are-district-issues-not-central-govt-failures-imcc-secretary/
University of Ghana questions GTEC’s Fee and Levy figures,https://citinewsroom.com/2026/01/university-of-ghana-questions-gtecs-fee-and-levy-figures/
Don’t abandon Agenda 111 – Assibey-Yeboah tells Mahama,https://citinewsroom.com/2026/01/dont-abandon-agenda-111-assibey-yeboah-tells-mahama/
Considering Ghana Gold Coin as an investment? How to get started safely,https://citinewsroom.com/2026/01/considering-ghana-gold-coin-as-an-investment-how-to-get-started-safely/
Robert Bennin’s four steps to building a successful business plan,https://citinewsroom.com/2026/01/robert-bennins-four-steps-to-building-a-successful-business-plan/
Local gov’t faces crucial role in solving Ghana’s urban transport crisis — NDPC framework reveals,https://citinewsroom.com/2026/01/local-govt-faces-crucial-role-in-solving-ghanas-urban-transport-crisis-ndpc-framework-reveals/
Is Ghana’s job market finally turning the tide?,https://citinewsroom.com/2026/01/is-ghanas-job-market-finally-turning-the-tide/
"AUDIO: Bernard Avle interviews Ghana Water Ltd. MD, Adam Mutawakilu | #CitiCBS",https://citinewsroom.com/2026/01/audio-bernard-avle-interviews-ghana-water-ltd-md-adam-mutawakilu-citicbs/
AUDIO: How To Develop A Family Plan | w/ Letitia Ohene-Effah | #EffectiveLivingSeries 2026,https://citinewsroom.com/2026/01/audio-how-to-develop-a-family-plan-w-letitia-ohene-effah-effectivelivingseries-2026/
AUDIO: How to develop a life plan | w/ Theodore Albright | #EffectiveLivingSeries 2026 | Ep6,https://citinewsroom.com/2026/01/audio-how-to-develop-a-life-plan-w-theodore-albright-effectivelivingseries-2026-ep6/
"AUDIO: Water crisis hits Nungua, Teshie! Should Ghana Water Ltd. face more scrutiny over rationing? | #CitiCBS",https://citinewsroom.com/2026/01/audio-water-crisis-hits-nungua-teshie-should-ghana-water-ltd-face-more-scrutiny-over-rationing-citicbs/
Kwakye Ofosu: Energy levy has helped stabilise power sector,https://citinewsroom.com/2026/01/kwakye-ofosu-energy-levy-has-helped-stabilise-power-sector/
Awutu Senya East NDC Chairman sues executives over sustained criticisms,https://citinewsroom.com/2026/01/awutu-senya-east-ndc-chairman-sues-executives-over-sustained-criticisms/
"Urban transport challenges are district issues, not central gov’t failures – IMCC Secretary",https://citinewsroom.com/2026/01/transport-challenges-are-district-issues-not-central-govt-failures-imcc-secretary/
Bagbin congratulates UG VC on election as ACU Council chair,https://citinewsroom.com/2026/01/bagbin-congratulates-ug-vc-on-election-as-acu-council-chair/
Assibey-Yeboah: Some NPP MPs will lose if they run again,https://citinewsroom.com/2026/01/assibey-yeboah-some-npp-mps-will-lose-if-they-run-again/
Considering Ghana Gold Coin as an investment? How to get started safely,https://citinewsroom.com/2026/01/considering-ghana-gold-coin-as-an-investment-how-to-get-started-safely/
Robert Bennin’s four steps to building a successful business plan,https://citinewsroom.com/2026/01/robert-bennins-four-steps-to-building-a-successful-business-plan/
"Ghana’s economy expands 3.8% in October 2025, led by services sector",https://citinewsroom.com/2026/01/ghanas-economy-expands-3-8-in-october-2025-led-by-services-sector/
Is Ghana’s job market finally turning the tide?,https://citinewsroom.com/2026/01/is-ghanas-job-market-finally-turning-the-tide/
Global growth to ease to 2.6% in 2026 as challenges persist – World Bank,https://citinewsroom.com/2026/01/global-growth-to-ease-to-2-6-in-2026-as-challenges-persist-world-bank/
Health Minister orders audit of all health facilities in Oti Region,https://citinewsroom.com/2026/01/health-minister-orders-audit-of-all-health-facilities-in-oti-region/
"Ghana, Canada explore labour mobility MoU to address illegal migration",https://citinewsroom.com/2026/01/ghana-canada-explore-labour-mobility-mou-to-address-illegal-migration/
AMA opens applications for 200 revenue collector positions,https://citinewsroom.com/2026/01/ama-opens-applications-for-200-revenue-collector-positions/
NaCCA withdraws SHS Teacher manual over gender identity content,https://citinewsroom.com/2026/01/nacca-withdraws-shs-teacher-manual-over-gender-identity-content/
Jospong’s sustainability drive deserves more spotlight – Gloria Kusi,https://citinewsroom.com/2026/01/jospongs-sustainability-drive-deserves-more-spotlight-gloria-kusi/
Ghana debuts at International Francophonie Skate Youth Championship,https://citinewsroom.com/2026/01/ghana-debuts-at-international-francophonie-skate-youth-championship/
"My 9-year-old daughter asked, ‘Daddy, are you a thief?’ – Nyantakyi on ‘Number 12’ impact",https://citinewsroom.com/2026/01/my-9-year-old-daughter-asked-daddy-are-you-a-thief-nyantakyi-recounts-impact-of-number-12/
Kwesi Nyantakyi: I was close to being CAF President,https://citinewsroom.com/2026/01/kwesi-nyantakyi-i-was-close-to-being-caf-president/
Ghana’s Mohammed Salisu to miss 2026 World Cup after ACL injury,https://citinewsroom.com/2026/01/ghanas-mohammed-salisu-to-miss-2026-world-cup-after-acl-injury/
Man United coach Ruben Amorim sacked,https://citinewsroom.com/2026/01/man-united-coach-ruben-amorim-sacked/
Decision on Marine Drive expected soon – Dzifa Gomashie,https://citinewsroom.com/2026/01/decision-on-marine-drive-expected-soon-dzifa-gomashie/
Citi FM/Channel One TV’s Heritage Caravan 2026 sells out in record time,https://citinewsroom.com/2026/01/citi-fm-channel-one-tvs-heritage-caravan-2026-sells-out-in-record-time/
Joyce Agyei marks 25 years of preserving African rhythm on stage,https://citinewsroom.com/2026/01/joyce-agyei-marks-25-years-of-preserving-african-rhythm-on-stage/
‘100% it’s tough for me’ – Anthony Joshua on friends’ deaths,https://citinewsroom.com/2026/01/100-its-tough-for-me-anthony-joshua-on-friends-deaths/
I wear Caveman watches – President Mahama,https://citinewsroom.com/2026/01/i-wear-caveman-watches-president-mahama/
Gambia begins reparations for victims of Human Rights abuses,https://citinewsroom.com/2026/01/gambia-begins-reparations-for-victims-of-human-rights-abuses/
Ethiopia begins $12bn construction of ‘Africa’s biggest airport’,https://citinewsroom.com/2026/01/ethiopia-begins-12-5-billion-construction-of-africas-biggest-airport/
Most of Uganda’s population is under 17 – will they give an 81-year-old another term?,https://citinewsroom.com/2026/01/most-of-ugandas-population-is-under-17-will-they-give-an-81-year-old-another-term/
Malaysia and Indonesia block Musk’s Grok over sexually explicit deepfakes,https://citinewsroom.com/2026/01/malaysia-and-indonesia-block-musks-grok-over-sexually-explicit-deepfakes/
"He once criticised African leaders who cling to power, now he wants a seventh term",https://citinewsroom.com/2026/01/he-once-criticised-african-leaders-who-cling-to-power-now-he-wants-a-seventh-term/
‘Are you dead?’ Chinese app for single living goes viral,https://citinewsroom.com/2026/01/are-you-dead-chinese-app-for-single-living-goes-viral/
North Carolina student bridges digital divide with 3D printing initiative in Ghana,https://citinewsroom.com/2026/01/north-carolina-student-bridges-digital-divide-with-3d-printing-initiative-in-ghana/
Samsung unveils ‘world’s largest’ TV of its kind — a whopping 130 inches,https://citinewsroom.com/2026/01/samsung-unveils-worlds-largest-tv-of-its-kind-a-whopping-130-inches/
Samsung to double AI mobile devices to 800 million units this year,https://citinewsroom.com/2026/01/samsung-to-double-ai-mobile-devices-to-800-million-units-this-year/
Why IUX is one of the Best Forex Brokers for beginners in 2026,https://citinewsroom.com/2026/01/why-iux-is-one-of-the-best-forex-brokers-for-beginners-in-2026/
Health Minister orders audit of all health facilities in Oti Region,https://citinewsroom.com/2026/01/health-minister-orders-audit-of-all-health-facilities-in-oti-region/
"Health Minister convenes sector leaders for 2025 performance review, 2026 outlook",https://citinewsroom.com/2026/01/health-minister-convenes-sector-leaders-for-2025-performance-review-2026-outlook/
Mahama Cares must cover Parkinson’s – Franklin Cudjoe,https://citinewsroom.com/2026/01/mahama-cares-must-cover-parkinsons-franklin-cudjoe/
NACP: HIV remains a generalised epidemic in Ghana,https://citinewsroom.com/2026/01/nacp-hiv-remains-a-generalised-epidemic-in-ghana/
Ghanaian scientists launch AI telehealth to expand healthcare access,https://citinewsroom.com/2026/01/ghanaian-scientists-launch-ai-telehealth-to-expand-healthcare-access/
When driving becomes an act of survival – Bervelyn Longdon writes,https://citinewsroom.com/2026/01/when-driving-becomes-an-act-of-survival-bervelyn-longdon-writes/
How Ghana slid into energy sector debt and the lessons we must not ignore,https://citinewsroom.com/2026/01/how-ghana-slid-into-energy-sector-debt-and-the-lessons-we-must-not-ignore/
"Power, dust and the parable of Ken Ofori-Atta on ICE",https://citinewsroom.com/2026/01/power-dust-and-the-parable-of-ken-ofori-atta-on-ice/
A five-year presidential term won’t strengthen our democracy – Nelson Oppong writes,https://citinewsroom.com/2026/01/a-five-year-presidential-term-wont-strengthen-our-democracy-nelson-oppong-writes/
When Truth Hurts: Why the NDC Must Thank God for Fifi Kwetey,https://citinewsroom.com/2026/01/when-truth-hurts-why-the-ndc-must-thank-god-for-fifi-kwetey/
