Headline,Link
"Ato Forson, Armah-Kofi Buah to act as Defence, Environment Ministers",https://citinewsroom.com/2025/08/ato-forson-armah-buah-to-act-as-defence-environment-ministers/
Majority Caucus visits family of late Murtala Mohammed,https://citinewsroom.com/2025/08/majority-caucus-visits-family-of-late-murtala-mohammed/
VRA/NEDCo resume operations after security assurances from Jinapor,https://citinewsroom.com/2025/08/vra-nedco-resume-operations-after-security-assurances-from-jinapor/
Helicopter crash a “grievous blow” to Ghana – Acting Chief Justice,https://citinewsroom.com/2025/08/helicopter-crash-a-grievous-blow-to-ghana-acting-chief-justice/
20% Transport fare hike suspended,https://citinewsroom.com/2025/08/20-transport-fare-hike-suspended/
Helicopter Crash: Muslim burial suspended due to condition of remains – Suhuyini,https://citinewsroom.com/2025/08/helicopter-crash-muslim-burial-suspended-due-to-condition-of-remains-suhuyini/
Media must uphold dignity in reporting helicopter crash – Shamima Muslim,https://citinewsroom.com/2025/08/media-must-uphold-dignity-in-reporting-helicopter-crash-shamima-muslim/
Independent investigation needed into military helicopter crash – BPS,https://citinewsroom.com/2025/08/independent-investigation-needed-into-military-helicopter-crash-bps/
MultiChoice Ghana risks license suspension as price-cut deadline expires today,https://citinewsroom.com/2025/08/multichoice-ghana-risks-license-suspension-as-price-cut-deadline-expires-today/
Consumers to enjoy lower interest rates soon – Stanbic Bank Chief Executive,https://citinewsroom.com/2025/08/consumers-to-enjoy-lower-interest-rates-soon-stanbic-bank-chief-executive/
"Importers, Exporters call for urgent resolution of GRA–NIA standoff",https://citinewsroom.com/2025/08/importers-exporters-call-for-urgent-resolution-of-gra-nia-standoff/
Banking industry mourns victims of tragic helicopter crash,https://citinewsroom.com/2025/08/banking-industry-mourns-victims-of-tragic-helicopter-crash/
BoG postpones Cedi@60 launch over military helicopter tragedy,https://citinewsroom.com/2025/08/bog-postpones-cedi60-launch-over-military-helicopter-tragedy/
Helicopter makes emergency landing in Ajumako Kokoben amid bad weather,https://citinewsroom.com/2025/08/helicopter-makes-emergency-landing-in-ajumako-kokoben-amid-bad-weather/
"Kenya, Namibia mourn victims of Ghana Helicopter crash",https://citinewsroom.com/2025/08/kenya-namibia-mourn-victims-of-ghana-helicopter-crash/
AUDIO: Ramsar site developers petition Mahama over demolitions but do they really have a case? | #CitiCBS,https://citinewsroom.com/2025/08/audio-ramsar-site-developers-petition-mahama-over-demolitions-but-do-they-really-have-a-case-citicbs/
AUDIO: #TheLiteracyChallenge Top 50 announced. Hear who made the cut,https://citinewsroom.com/2025/08/theliteracychallenge-top-50-announced-hear-who-made-the-cut/
AUDIO: The HEATED DEBATE on the #CitiCBS over Sam George’s August 7 ultimatum to DSTV,https://citinewsroom.com/2025/08/audio-the-heated-debate-on-the-citicbs-over-sam-georges-august-7-ultimatum-to-dstv/
"AUDIO: Sports Panorama: Friday, 1st August, 2025 | #SportsPanorama",https://citinewsroom.com/2025/08/sports-panorama-friday-1st-august-2025-sportspanorama/
Kufuor mourns victims of military helicopter crash,https://citinewsroom.com/2025/08/kufuor-mourns-victims-of-military-helicopter-crash/
Abuakwa South MP mourns victims of August 6 helicopter crash,https://citinewsroom.com/2025/08/abuakwa-south-mp-mourns-victims-of-august-6-helicopter-crash/
Mahama declares three days of national mourning over helicopter crash,https://citinewsroom.com/2025/08/mahama-declares-three-days-of-national-mourning-over-helicopter-crash/
‘A devastating loss to Ghana’ — Majority caucus mourns Helicopter crash victims,https://citinewsroom.com/2025/08/a-devastating-loss-to-ghana-majority-caucus-mourns-helicopter-crash-victims/
"NDC mourns Omane Boamah, Murtala, others killed in helicopter crash",https://citinewsroom.com/2025/08/ndc-mourns-omane-boamah-murtala-others-killed-in-helicopter-crash/
Banking industry mourns victims of tragic helicopter crash,https://citinewsroom.com/2025/08/banking-industry-mourns-victims-of-tragic-helicopter-crash/
20% Transport fare hike suspended,https://citinewsroom.com/2025/08/20-transport-fare-hike-suspended/
BoG postpones Cedi@60 launch over military helicopter tragedy,https://citinewsroom.com/2025/08/bog-postpones-cedi60-launch-over-military-helicopter-tragedy/
MultiChoice Ghana risks license suspension as price-cut deadline expires today,https://citinewsroom.com/2025/08/multichoice-ghana-risks-license-suspension-as-price-cut-deadline-expires-today/
Consumers to enjoy lower interest rates soon – Stanbic Bank Chief Executive,https://citinewsroom.com/2025/08/consumers-to-enjoy-lower-interest-rates-soon-stanbic-bank-chief-executive/
"Helicopter crash: Show sensitivity, avoid graphic content – GPA, PAG urge media",https://citinewsroom.com/2025/08/helicopter-crash-show-sensitivity-avoid-graphic-content-gpa-pag-urge-media/
Sikaman chiefs to cleanse land following tragic military helicopter crash,https://citinewsroom.com/2025/08/sikaman-chiefs-to-cleanse-land-following-tragic-military-helicopter-crash/
Absa expands access to clean water in underserved communities across 11 regions,https://citinewsroom.com/2025/08/absa-expands-access-to-clean-water-in-underserved-communities-across-11-regions/
Africa Governance Centre pays tribute to eight fallen heroes in helicopter crash,https://citinewsroom.com/2025/08/africa-governance-centre-pays-tribute-to-eight-fallen-heroes-in-helicopter-crash/
"Catholic Bishops, GPCC mourn victims of helicopter crash, call for national prayer",https://citinewsroom.com/2025/08/catholic-bishops-gpcc-mourn-victims-of-helicopter-crash-call-for-national-prayer/
LCB Corporate games 2025 springs to life in Tema,https://citinewsroom.com/2025/08/lcb-corporate-games-2025-springs-to-life-in-tema/
Ayariga to captain Parliament in Democracy Cup game against Judiciary,https://citinewsroom.com/2025/08/ayariga-to-captain-parliament-in-democracy-cup-game-against-judiciary/
Ghana Sports Conference 2025 postponed to September,https://citinewsroom.com/2025/08/ghana-sports-conference-2025-postponed-to-september/
Tourism advocate treks from Bolga to Accra after losing sports bet,https://citinewsroom.com/2025/08/tourism-advocate-treks-from-bolga-to-accra-after-losing-stadium-bet/
Parliament congratulates Black Queens on WAFCON Bronze medal win,https://citinewsroom.com/2025/07/parliament-congratulates-black-queens-on-wafcon-bronze-medal-win/
EOCO seizes Lamborghini from Shatta Wale in joint operation with FBI,https://citinewsroom.com/2025/08/eoco-seizes-lamborghini-from-shatta-wale-in-joint-operation-with-fbi/
Richard Briandt installed as Asafoatse Dzahene IV of Osu,https://citinewsroom.com/2025/08/richard-briandt-installed-as-asafoatse-dzahene-iv-of-osu/
Daddy Lumba’s one-week observance scheduled for August 30,https://citinewsroom.com/2025/08/daddy-lumbas-one-week-observance-scheduled-for-august-30/
Shatta Wale accuses EOCO of invading his residence with guns,https://citinewsroom.com/2025/08/shatta-wale-accuses-eoco-of-invading-his-residence-with-guns/
Tourism Ministry swears in new NCC board,https://citinewsroom.com/2025/08/tourism-ministry-swears-in-new-ncc-board/
"Kenya, Namibia mourn victims of Ghana Helicopter crash",https://citinewsroom.com/2025/08/kenya-namibia-mourn-victims-of-ghana-helicopter-crash/
Rwanda agrees to take in up to 250 migrants deported from the US,https://citinewsroom.com/2025/08/rwanda-agrees-to-take-in-up-to-250-migrants-deported-from-the-us/
More than 65 refugees and migrants die in boat sinking off Yemeni coast,https://citinewsroom.com/2025/08/more-than-65-refugees-and-migrants-die-in-boat-sinking-off-yemeni-coast/
Tesla found partly to blame for fatal Autopilot crash,https://citinewsroom.com/2025/08/tesla-found-partly-to-blame-for-fatal-autopilot-crash/
Canada follows France and UK with plan to recognise Palestinian state,https://citinewsroom.com/2025/07/canada-follows-france-and-uk-with-plan-to-recognise-palestinian-state/
"Treepz launches in Canada, University of Toronto’s sponsored program is first corporate travel client in North America",https://citinewsroom.com/2025/07/treepz-launches-in-canada-university-of-torontos-sponsored-program-is-first-corporate-travel-client-in-north-america/
YouTube to be included in Australia’s teen social media ban,https://citinewsroom.com/2025/07/youtube-to-be-included-in-australias-teen-social-media-ban/
EdTech Mondays: Building Ghana’s Digital Education Infrastructure: From Policy to Practice,https://citinewsroom.com/2025/07/edtech-mondays-building-ghanas-digital-education-infrastructure-from-policy-to-practice/
Samsung Galaxy watch ultra now has one UI 8 watch,https://citinewsroom.com/2025/07/samsung-galaxy-watch-ultra-now-has-one-ui-8-watch/
"Galaxy Z Fold7: Powerful Versatility in the Thinnest, Lightest Z Fold Yet",https://citinewsroom.com/2025/07/galaxy-z-fold7-powerful-versatility-in-the-thinnest-lightest-z-fold-yet/
Korle Bu Teaching Hospital reports 700 cancer cases annually,https://citinewsroom.com/2025/07/korle-bu-teaching-hospital-reports-700-cancer-cases-annually/
Prioritise recruitment of doctors in next budget – Garu MP urges govt,https://citinewsroom.com/2025/07/prioritise-recruitment-of-doctors-in-next-budget-garu-mp-urges-govt/
UNICEF hails Ghana’s $24m vaccine payment to protect children’s health,https://citinewsroom.com/2025/07/unicef-hails-ghanas-24m-vaccine-payment-to-protect-childrens-health/
FDA approves commercial production of snake anti-venom – Akandoh,https://citinewsroom.com/2025/07/fda-approves-commercial-production-of-snake-anti-venom-akandoh/
"Govt working to clear backlog of 70,000 unemployed health workers – Akandoh",https://citinewsroom.com/2025/07/govt-working-to-clear-backlog-of-70000-unemployed-health-workers-akandoh/
Behind the scenes with a Delta Air Lines meteorologist,https://citinewsroom.com/2025/08/behind-the-scenes-with-a-delta-air-lines-meteorologist/
Appiah Adomako Writes: Why govt must take interest in who acquires Shoprite Stores in Ghana,https://citinewsroom.com/2025/08/appiah-adomako-writes-why-govt-must-take-interest-in-who-acquires-shoprite-stores-in-ghana/
When 87 MPs leave the room: The fading power of parliamentary walkouts – Sheba Araba Bennin writes,https://citinewsroom.com/2025/08/when-87-mps-leave-the-room-the-fading-power-of-parliamentary-walkouts-sheba-araba-bennin-writes/
Highlights of the Mid-Year Budget Review and CERPA’s view,https://citinewsroom.com/2025/08/highlights-of-the-mid-year-budget-review-and-cerpas-view/
“Putting the community first” – How Tullow is creating value in Ghana,https://citinewsroom.com/2025/08/putting-the-community-first-how-tullow-is-creating-value-in-ghana/
