Headline,Link
Otumfuo mediation will deliver lasting peace in Bawku – Mahama,https://citinewsroom.com/2025/04/otumfuo-mediation-will-deliver-lasting-peace-in-bawku-mahama/
Mahama pledges to complete Kumasi Military Hospital,https://citinewsroom.com/2025/04/mahama-pledges-to-complete-kumasi-military-hospital/
We’ll improve your conditions of service – Mahama assures GAF,https://citinewsroom.com/2025/04/well-improve-your-conditions-of-service-mahama-assures-gaf/
"GAF: Serve with integrity, courage and compassion – Mahama to newly commissioned officers",https://citinewsroom.com/2025/04/gaf-serve-with-integrity-courage-and-compassion-mahama-to-newly-commissioned-officers/
"Samsam residents lament deplorable roads, demand urgent fix",https://citinewsroom.com/2025/04/samsam-residents-lament-deplorable-roads-demand-urgent-fix/
"PURC’s tariff review meeting ends in deadlock, Set to reconvene at noon",https://citinewsroom.com/2025/04/purcs-tariff-review-meeting-ends-in-deadlock-set-to-reconvene-at-noon/
"Bawku: Ayariga condemns violence, backs Otumfuo’s peace efforts",https://citinewsroom.com/2025/04/bawku-ayariga-condemns-violence-backs-otumfuos-peace-efforts/
Restore discipline in Senior High Schools – Education Minister to GES,https://citinewsroom.com/2025/04/restore-discipline-in-senior-high-schools-education-minister-to-ges/
TUC to govt: Punish those behind ECG container scandal,https://citinewsroom.com/2025/04/tuc-to-govt-punish-those-behind-ecg-container-scandal/
ECG had zero investment during Akufo-Addo’s first term – Dubik Mahama,https://citinewsroom.com/2025/04/ecg-had-zero-investment-during-akufo-addos-first-term-dubik-mahama/
Mahama govt appears clueless in galamsey fight – A Rocha Ghana,https://citinewsroom.com/2025/04/mahama-govt-appears-clueless-in-galamsey-fight-a-rocha-ghana/
China raises tariffs on US goods to 125%,https://citinewsroom.com/2025/04/china-raises-tariffs-on-us-goods-to-125/
Accra Streetlights: N1 and Spintex roads still in darkness after 50-day ultimatum,https://citinewsroom.com/2025/04/accra-streetlights-n1-and-spintex-roads-still-in-darkness-after-50-day-ultimatum/
‘Help me save my daughter’s sight’ – Mother of 16-year-old girl hit by bullet cries for support,https://citinewsroom.com/2025/04/help-me-save-my-daughters-sight-mother-of-16-year-old-girl-hit-by-bullet-cries-for-support/
Galamsey: Foreigners must be punished before deportation – A Rocha Ghana,https://citinewsroom.com/2025/04/galamsey-foreigners-must-be-punished-before-deportation-a-rocha-ghana/
"Eyewitness News, Monday, 10th March, 2025",https://citinewsroom.com/2025/03/eyewitness-news-monday-10th-march-2025/
"Citi Breakfast Show, Monday, 10th March, 2025",https://citinewsroom.com/2025/03/citi-breakfast-show-monday-10th-march-2025/
Heritage on-Air Series | Celebrating Iconic Ghanaian Music | Ep5,https://citinewsroom.com/2025/03/heritage-on-air-series-the-story-of-ghanaian-music-through-the-years-ep5/
"FamLife | Ghanaian Marriage Paradigms | Saturday, 8th March, 2025",https://citinewsroom.com/2025/03/famlife-ghanaian-marriage-paradigms-saturday-8th-march-2025/
Mahama pledges to complete Kumasi Military Hospital,https://citinewsroom.com/2025/04/mahama-pledges-to-complete-kumasi-military-hospital/
We’ll improve your conditions of service – Mahama assures GAF,https://citinewsroom.com/2025/04/well-improve-your-conditions-of-service-mahama-assures-gaf/
"GAF: Serve with integrity, courage and compassion – Mahama to newly commissioned officers",https://citinewsroom.com/2025/04/gaf-serve-with-integrity-courage-and-compassion-mahama-to-newly-commissioned-officers/
Sekondi MP: Use Minority Leader to summon Ntim Fordjour,https://citinewsroom.com/2025/04/sekondi-mp-use-minority-leader-to-summon-ntim-fordjour/
Provide security for final EC declaration in Ablekuma North – NPP to IGP,https://citinewsroom.com/2025/04/provide-security-for-final-ec-declaration-in-ablekuma-north-npp-to-igp/
Set clear deadlines in galamsey fight – Energy stakeholders to govt,https://citinewsroom.com/2025/04/set-clear-deadlines-in-galamsey-fight-energy-stakeholders-to-govt/
GUTA happy with Trump’s tariff retreat,https://citinewsroom.com/2025/04/guta-happy-with-trumps-tariff-retreat/
10% Tariff won’t affect local cocoa industry – Ghana Cocoa Farmers,https://citinewsroom.com/2025/04/10-tariff-wont-affect-local-cocoa-industry-ghana-cocoa-farmers/
Kumasi Mayor orders traders off pavements ahead of decongestion exercise,https://citinewsroom.com/2025/04/kumasi-mayor-orders-traders-off-pavements-ahead-of-decongestion-exercise/
New cocoa producer price not yet out – COCOBOD,https://citinewsroom.com/2025/04/new-cocoa-producer-price-not-yet-out-cocobod/
Oti River Bridge part of $10bn Big Push Agenda – Oti Regional Minister,https://citinewsroom.com/2025/04/oti-river-bridge-part-of-10bn-big-push-agenda-oti-regional-minister/
Weija Ramsar site: Caitec defies Mahama’s order to reverse illegal landfilling,https://citinewsroom.com/2025/04/weija-ramsar-site-caitec-defies-mahamas-order-to-reverse-illegal-landfilling/
"Managing commodity price risk with OTC derivatives such as forwards, swaps, options and collars",https://citinewsroom.com/2025/04/managing-commodity-price-risk-with-otc-derivatives-such-as-forwards-swaps-options-and-collars/
Police arrest suspect seen in viral video attacking man with machete,https://citinewsroom.com/2025/04/police-arrest-suspect-seen-in-viral-video-attacking-man-with-machete/
"NE/R: 12 convicted over land dispute in Gbalo, fined GHc4,800 each by Nalerigu Court",https://citinewsroom.com/2025/04/ne-r-12-convicted-over-land-dispute-in-gbalo-fined-ghc4800-each-by-nalerigu-court/
Salah signs new two-year deal with Liverpool,https://citinewsroom.com/2025/04/salah-signs-new-two-year-deal-with-liverpool/
Bologna wonder goal stops Napoli closing gap on Inter,https://citinewsroom.com/2025/04/bologna-wonder-goal-stops-napoli-closing-gap-on-inter/
Paris Saint-Germain wins 13th French title,https://citinewsroom.com/2025/04/paris-saint-germain-wins-13th-french-title/
"Ghana Sports Conference set for July 31, puts spotlight on future of sports",https://citinewsroom.com/2025/04/ghana-sports-conference-set-for-july-31-puts-spotlight-on-future-of-sports/
Chelsea boost top-four hopes to pile pressure on Postecoglou,https://citinewsroom.com/2025/04/chelsea-boost-top-four-hopes-to-pile-pressure-on-postecoglou/
Wendy Shay to sponsor viral fan’s education from class 5 to university in heartfelt gesture,https://citinewsroom.com/2025/04/wendy-shay-to-sponsor-viral-fans-education-from-class-5-to-university-in-heartfelt-gesture/
Mayford Muzik drops debut song ‘Odo’,https://citinewsroom.com/2025/04/mayford-muzik-drops-debut-song-odo/
Alabaster Box threatens to sue Medikal over “Welcome to Africa” copyright,https://citinewsroom.com/2025/04/alabaster-box-threatens-to-sue-medikal-over-welcome-to-africa-copyright/
Ataman Nikita breaks down in new song ‘My Way’,https://citinewsroom.com/2025/04/ataman-nikita-breaks-down-in-new-song-my-way/
Yaw Darling nominated for Unsung Artiste of the Year at the 26th TGMAs,https://citinewsroom.com/2025/04/yaw-darling-nominated-for-unsung-artiste-of-the-year-at-the-26th-tgmas/
US Supreme Court orders return of migrant wrongly deported to El Salvador,https://citinewsroom.com/2025/04/us-supreme-court-orders-return-of-migrant-wrongly-deported-to-el-salvador/
China raises tariffs on US goods to 125%,https://citinewsroom.com/2025/04/china-raises-tariffs-on-us-goods-to-125/
Tanzania’s opposition leader charged with treason,https://citinewsroom.com/2025/04/tanzanias-opposition-leader-charged-with-treason/
Workers strike across Argentina in protest of Milei’s Austerity measures,https://citinewsroom.com/2025/04/workers-strike-across-argentina-in-protest-of-mileis-austerity-measures/
Trump recognises tariff ‘transition difficulty’ as US stock market falls again,https://citinewsroom.com/2025/04/trump-recognises-tariff-transition-difficulty-as-us-stock-market-falls-again/
"Intel CEO invested in hundreds of Chinese companies, some with military ties",https://citinewsroom.com/2025/04/intel-ceo-invested-in-hundreds-of-chinese-companies-some-with-military-ties/
Elon Musk’s X to clamp down on parody accounts,https://citinewsroom.com/2025/04/elon-musks-x-to-clamp-down-on-parody-accounts/
Tesla sales plunge after Elon Musk backlash,https://citinewsroom.com/2025/04/tesla-sales-plunge-after-elon-musk-backlash/
Women in tech advocate for greater investment in female education,https://citinewsroom.com/2025/03/women-in-tech-advocate-for-greater-investment-in-female-education/
Elon Musk sells X to his own xAI for $33 billion in all-stock deal,https://citinewsroom.com/2025/03/elon-musk-sells-x-to-his-own-xai-for-33-billion-in-all-stock-deal/
"Meningitis cases decline in Northern region, health officials urge vigilance",https://citinewsroom.com/2025/04/meningitis-cases-decline-in-northern-region-health-officials-urge-vigilance/
Private health facilities justify decision to suspend services over NHIS arrears,https://citinewsroom.com/2025/04/private-health-facilities-justify-decision-to-suspend-services-over-nhis-arrears/
Akandoh vows tighter port checks after GH₵20m opioid disposal,https://citinewsroom.com/2025/04/akandoh-vows-tighter-port-checks-after-gh%e2%82%b520m-opioid-disposal/
Environmental health officers demand urgent action over Cholera deaths,https://citinewsroom.com/2025/04/environmental-health-officers-demand-urgent-action-over-cholera-deaths/
Dr. Sodzi-Tettey leads charge for homegrown vaccine research and manufacturing,https://citinewsroom.com/2025/04/dr-sodzi-tettey-leads-charge-for-homegrown-vaccine-research-and-manufacturing/
"Monzo and MoMo: Two Fintechs, Two Worlds, One Truth About the Future of Money",https://citinewsroom.com/2025/04/monzo-and-momo-two-fintechs-two-worlds-one-truth-about-the-future-of-money/
"Remedies under Ghanaian company law: Addressing gap for aggrieved directors, shareholders, secretaries",https://citinewsroom.com/2025/04/remedies-under-ghanaian-company-law-addressing-gap-for-aggrieved-directors-shareholders-secretaries/
The 2025 Budget: Opportunities and threats for SMEs – An analysis by NKAKA & partners,https://citinewsroom.com/2025/04/the-2025-budget-opportunities-and-threats-for-smes-an-analysis-by-nkaka-partners/
Betting Tax in Ghana: Has it been properly abolished or a legislative drafting error?,https://citinewsroom.com/2025/04/betting-tax-in-ghana-has-it-been-properly-abolished-or-a-legislative-drafting-error/
"Ghana’s healthcare system is failing, except for the powerful – Naa Kwaamah Siaw-Marfo writes",https://citinewsroom.com/2025/04/ghanas-healthcare-system-is-failing-except-for-the-powerful-naa-kwaamah-siaw-marfo-writes/
