Headline,Link
GAF recruitment: One arrested at El Wak for forging documents,https://citinewsroom.com/2025/11/gaf-recruitment-one-arrested-at-el-wak-for-forging-documents/
"SML scandal: OSP to arraign Ofori-Atta, 7 others before court on Monday",https://citinewsroom.com/2025/11/sml-scandal-osp-to-arraign-ofori-atta-7-others-before-court-on-monday/
Galamsey: Mahama’s inaction costing lives — Prof Abavare on NAIMOS officer’ death,https://citinewsroom.com/2025/11/galamsey-mahamas-inaction-costing-lives-prof-abavare-on-naimos-officer-death/
"Tricycle operators stage protest over alleged harassment, extortion by KMA",https://citinewsroom.com/2025/11/tricycle-operators-stage-protest-over-alleged-harassment-extortion-by-kma/
Unemployed teachers reject 6100 recruitment plan,https://citinewsroom.com/2025/11/unemployed-teachers-reject-6100-recruitment-plan/
Parliamentary Defence Committee inspects GAF recruitment exercise at El Wak,https://citinewsroom.com/2025/11/parliamentary-defence-committee-inspects-gaf-recruitment-exercise-at-el-wak/
Kumasi: Islamic SHS Boys’ prefect dies after falling from storey building,https://citinewsroom.com/2025/11/kumasi-islamic-shs-boys-prefect-dies-after-falling-from-storey-building/
ECOWAS ruling won’t guarantee your return; move on — Ayeh-Paye to Torkornoo,https://citinewsroom.com/2025/11/ecowas-ruling-wont-guarantee-your-return-move-on-ayeh-paye-to-torkornoo/
Wife in viral assault video reveals chilling events that led to brutal attack,https://citinewsroom.com/2025/11/wife-in-viral-assault-video-reveals-chilling-events-that-led-to-brutal-attack/
NPP Primaries: Bryan Acheampong set for one-touch victory – Ayeh-Paye,https://citinewsroom.com/2025/11/npp-primaries-bryan-acheampong-set-for-one-touch-victory-ayeh-paye/
"NE/R: One dead, several injured as truck plunges into broken bridge",https://citinewsroom.com/2025/11/ne-r-one-dead-several-injured-as-truck-plunges-into-broken-bridge/
"Healthcare, Utilities, and Schools: The public institutions Ghanaians rely on — and where informal payments still flow",https://citinewsroom.com/2025/11/healthcare-utilities-and-schools-the-public-institutions-ghanaians-rely-on-and-where-informal-payments-still-flow/
Bribery is falling in Ghana — but ‘Appreciation Payments’ are quietly replacing it,https://citinewsroom.com/2025/11/bribery-is-falling-in-ghana-but-appreciation-payments-are-quietly-replacing-it/
Marburg virus forces Ras Mubarak to reroute Trans Africa road trip,https://citinewsroom.com/2025/11/marburg-virus-forces-ras-mubarak-to-reroute-trans-africa-road-trip/
Ghana Stock Exchange extends strong performance as 15 stocks gain in October,https://citinewsroom.com/2025/11/ghana-stock-exchange-extends-strong-performance-as-15-stocks-gain-in-october/
"AUDIO: Man burns wife, 5 kids over infidelity claims: Has society let down domestic abuse survivors? | #CitiCBS",https://citinewsroom.com/2025/11/audio-man-burns-wife-5-kids-over-infidelity-claims-has-society-let-down-domestic-abuse-survivors-citicbs/
AUDIO: Local rice is BETTER! The Citi Breakfast Show team explains why | #CitiCBS,https://citinewsroom.com/2025/11/audio-local-rice-is-better-the-citi-breakfast-show-team-explains-why-citicbs/
AUDIO: What’s Ghana’s best path to devt? Are MPs overburdened by constituents’ requests | #CitiCBS,https://citinewsroom.com/2025/11/audio-whats-ghanas-best-path-to-devt-are-mps-overburdened-by-constituents-requests-citicbs/
"AUDIO: Old machines, inadequate storage –  Felix Kamassah breaks down issues with rice sector | #CitiCBS",https://citinewsroom.com/2025/11/audio-old-machines-inadequate-storage-felix-kamassah-breaks-down-issues-with-rice-sector-citicbs/
ECOWAS ruling won’t guarantee your return; move on — Ayeh-Paye to Torkornoo,https://citinewsroom.com/2025/11/ecowas-ruling-wont-guarantee-your-return-move-on-ayeh-paye-to-torkornoo/
Ablakwa defends skipping Parliament on US deportee MoU,https://citinewsroom.com/2025/11/ablakwa-defends-skipping-parliament-on-us-deportee-mou/
Reliance on foreign aid must stop – Lord Boateng tells African leaders,https://citinewsroom.com/2025/11/reliance-on-foreign-aid-must-stop-lord-boateng-tells-african-leaders/
"Lord Paul Boateng: Africa needs job-creating, wealth-building policies",https://citinewsroom.com/2025/11/lord-paul-boateng-africa-needs-job-creating-wealth-building-policies/
2026 Budget: Oppong Nkrumah questions timing of jet purchase,https://citinewsroom.com/2025/11/2026-budget-oppong-nkrumah-questions-timing-of-jet-purchase/
Energy Minister charges new Nuclear Board to fast-track Ghana’s power agenda,https://citinewsroom.com/2025/11/energy-minister-charges-new-nuclear-board-to-fast-track-ghanas-power-agenda/
ACEP warns GNPC against commercially unjustifiable Springfield oil takeover,https://citinewsroom.com/2025/11/acep-warns-gnpc-against-commercially-unjustifiable-springfield-oil-takeover/
PwC urges govt to prioritise implementation of 2026 budget targets,https://citinewsroom.com/2025/11/pwc-urges-govt-to-prioritise-implementation-of-2026-budget-targets/
Ghana Stock Exchange extends strong performance as 15 stocks gain in October,https://citinewsroom.com/2025/11/ghana-stock-exchange-extends-strong-performance-as-15-stocks-gain-in-october/
"Restore road tolls, embrace PPPs to fund Accra–Kumasi Expressway – Prof. Quartey",https://citinewsroom.com/2025/11/restore-road-tolls-embrace-ppps-to-fund-accra-kumasi-expressway-prof-quartey/
Ho Zongo Youth reject Alhaji Muniru’s as Volta Chief Imam,https://citinewsroom.com/2025/11/ho-zongo-youth-reject-alhaji-munirus-as-volta-chief-imam/
"Prioritise jobs, wages in Oil Palm policy – Ghana Federation of Labour to govt",https://citinewsroom.com/2025/11/prioritise-jobs-wages-in-oil-palm-policy-ghana-federation-of-labour-to-govt/
Tamale: 16 suspects arrested in major crime crackdown,https://citinewsroom.com/2025/11/tamale-16-suspects-arrested-in-major-crime-crackdown/
Torkornoo: ECOWAS court dismissal was anticipated – Ayikoi Otoo,https://citinewsroom.com/2025/11/torkornoo-ecowas-court-dismissal-was-anticipated-ayikoi-otoo/
GAF recruitment exercise resumes today; numbers capped at 1200 daily,https://citinewsroom.com/2025/11/gaf-recruitment-exercise-resumes-today-numbers-capped-at-1200-daily/
2026 World Cup: US to prioritise visa interviews for ticket-holding fans,https://citinewsroom.com/2025/11/2026-world-cup-us-to-prioritise-visa-interviews-for-ticket-holding-fans/
DR Congo shatters Nigeria’s World Cup dream as Mbemba delivers penalty heartbreak,https://citinewsroom.com/2025/11/dr-congo-shatters-nigerias-world-cup-dream-as-mbemba-delivers-penalty-heartbreak/
Ghana’s Francis Abu successfully undergoes surgery – GFA,https://citinewsroom.com/2025/11/ghanas-francis-abu-successfully-undergoes-surgery-gfa/
2026 Budget: GH¢200m allocated for construction of mini stadiums – Ato Forson,https://citinewsroom.com/2025/11/2026-budget-gh%c2%a2200m-allocated-for-construction-of-mini-stadiums-ato-forson/
2026 Budget: GH¢150m allocated for Black Stars’ World Cup participation – Ato Forson,https://citinewsroom.com/2025/11/2026-budget-gh%c2%a2150m-allocated-for-black-stars-world-cup-participation-ato-forson/
"Channel One TV to premiere two new Ghanaian series, Junction 5 and SOSO",https://citinewsroom.com/2025/11/channel-one-tv-to-premiere-two-new-ghanaian-series-junction-5-and-soso/
"GTA CEO sets strict standards for a safer, bigger ‘Dec in GH’ 2025”",https://citinewsroom.com/2025/11/gta-ceo-sets-strict-standards-for-a-safer-bigger-dec-in-gh-2025/
‘Put Am God’ by AratheJay hits dual Apple Music “Best of 2025” playlists,https://citinewsroom.com/2025/11/put-am-god-by-arathejay-hits-dual-apple-music-best-of-2025-playlists/
Gyakie shines at Tidal Rave Wild Card event,https://citinewsroom.com/2025/11/gyakie-shines-at-tidal-rave-wild-card-event/
"‘I’m a sanguine, I can talk to ghosts’ – Diana Hamilton",https://citinewsroom.com/2025/11/i-can-talk-to-ghosts-diana-hamilton/
Trump signs bill ordering justice department to release Jeffrey Epstein files,https://citinewsroom.com/2025/11/trump-signs-bill-ordering-justice-department-to-release-jeffrey-epstein-files/
"INTERPOL Operation: 62 arrested, ammunition, 136 stolen vehicles seized in West Africa",https://citinewsroom.com/2025/11/interpol-operation-62-arrested-ammunition-stolen-vehicles-seized-in-west-africa/
At least 20 killed in one of Russia’s deadliest strikes on western Ukraine,https://citinewsroom.com/2025/11/at-least-20-killed-in-one-of-russias-deadliest-strikes-on-western-ukraine/
Epstein files bill to be sent to Trump after approval from Congress,https://citinewsroom.com/2025/11/epstein-files-bill-to-be-sent-to-trump-after-approval-from-congress/
Congress approves bill to release Epstein files that will head to Trump’s desk,https://citinewsroom.com/2025/11/congress-approves-bill-to-release-epstein-files-that-will-head-to-trumps-desk/
Yango Ride introduces new safety flow within its app in Ghana,https://citinewsroom.com/2025/11/yango-ride-introduces-new-safety-flow-within-its-app-in-ghana/
Cybastion introduces American Tech Hub at 20th Burkina Faso Digital Week,https://citinewsroom.com/2025/11/cybastion-introduces-american-tech-hub-at-20th-burkina-faso-digital-week/
Ghanaian Researcher Revolutionizes Antimicrobial Resistance Surveillance Globally,https://citinewsroom.com/2025/11/ghanaian-researcher-revolutionizes-antimicrobial-resistance-surveillance-globally/
Don’t blindly trust what AI tells you – Google’s Sundar Pichai,https://citinewsroom.com/2025/11/dont-blindly-trust-what-ai-tells-you-googles-sundar-pichai/
MEST Africa Opens Applications for Third Cohort of the Mastercard Foundation EdTech Fellowship in Ghana,https://citinewsroom.com/2025/11/mest-africa-opens-applications-for-third-cohort-of-the-mastercard-foundation-edtech-fellowship-in-ghana/
GMA condemns violence at Northern Regional Hospital,https://citinewsroom.com/2025/11/gma-condemns-violence-at-northern-regional-hospital/
"Rotation Nurses, Midwives threaten nationwide demonstration over delayed allowances",https://citinewsroom.com/2025/11/rotation-nurses-midwives-threaten-nationwide-demonstration-over-delayed-allowances/
Frankel foundation urges gov’t support diabetes fight,https://citinewsroom.com/2025/11/frankel-foundation-urges-govt-support-diabetes-fight/
"Radiographers push for six-year training to boost imaging quality, specialist skills",https://citinewsroom.com/2025/11/radiographers-push-for-six-year-training-to-boost-imaging-quality-specialist-skills/
FDA orders recall of Choice Irish Cream Flavoured Drink containing erectile dysfunction drug,https://citinewsroom.com/2025/11/fda-orders-recall-of-choice-irish-cream-flavoured-drink-containing-erectile-dysfunction-drug/
"Healthcare, Utilities, and Schools: The public institutions Ghanaians rely on — and where informal payments still flow",https://citinewsroom.com/2025/11/healthcare-utilities-and-schools-the-public-institutions-ghanaians-rely-on-and-where-informal-payments-still-flow/
Bribery is falling in Ghana — but ‘Appreciation Payments’ are quietly replacing it,https://citinewsroom.com/2025/11/bribery-is-falling-in-ghana-but-appreciation-payments-are-quietly-replacing-it/
From promise to paycheck: Will Ghana’s 2026 budget finally deliver jobs our youth can live on?,https://citinewsroom.com/2025/11/from-promise-to-paycheck-will-ghanas-2026-budget-finally-deliver-jobs-our-youth-can-live-on/
Reflections on building the Ghana we want together through the lens of the 2026 budget,https://citinewsroom.com/2025/11/reflections-on-building-the-ghana-we-want-together-through-the-lens-of-the-2026-budget/
Unauthorised representatives: Impacts on your Canadian Visa [Article],https://citinewsroom.com/2025/11/unauthorised-representatives-impacts-on-your-canadian-visa-article/
