Headline,Link
Another Helicopter makes emergency landing in Nkawkaw,https://citinewsroom.com/2025/08/another-helicopter-makes-emergency-landing-in-nkawkaw/
Prophecy review not to stifle worship – Afriyie Ankrah,https://citinewsroom.com/2025/08/prophecy-review-not-to-stifle-worship-afriyie-ankrah/
"IGP promotes two Officers for heroic rescue, arrest of robbery suspects",https://citinewsroom.com/2025/08/igp-promotes-two-officers-for-heroic-rescue-arrest-of-robbery-suspects/
Sanitise social media to curb fear from Prophecies – Palgrave,https://citinewsroom.com/2025/08/sanitise-social-media-to-curb-fear-from-prophecies-palgrave/
Prophecies on national security must be coordinated – Adawudu,https://citinewsroom.com/2025/08/prophecies-on-national-security-must-be-coordinated-adawudu/
‘You led with head and heart’ — Fisheries Minister’s emotional farewell to Murtala Mohammed,https://citinewsroom.com/2025/08/you-led-with-head-and-heart-fisheries-ministers-emotional-farewell-to-murtala-mohammed/
Credit enquiries soar 114% in 2024 as digital lending expands – BoG,https://citinewsroom.com/2025/08/credit-enquiries-soar-114-in-2024-as-digital-lending-expands-bog/
T-Bill auction sees 22% undersubscription amid falling yields,https://citinewsroom.com/2025/08/t-bill-auction-sees-22-undersubscription-amid-falling-yields/
GPCC: No official communication yet on national prophecies directive,https://citinewsroom.com/2025/08/gpcc-no-official-communication-yet-on-national-prophecies-directive/
"2026 Budget: Businesses pushing for lending rate cut, incentives to drive 24-hour economy",https://citinewsroom.com/2025/08/2026-budget-businesses-pushing-for-lending-rate-cut-incentives-to-drive-24-hour-economy/
"Ghana records 18 new Mpox cases, total now 346",https://citinewsroom.com/2025/08/ghana-records-18-new-mpox-cases-total-now-346/
"[PICTURES] Alhaji Muniru, Murtala Mohammed laid to rest",https://citinewsroom.com/2025/08/pictures-alhaji-muniru-murtala-mohammed-laid-to-rest/
My father died and we rejoiced – Umaru Sanda Amadu writes,https://citinewsroom.com/2025/08/my-father-died-and-we-rejoiced-umaru-sanda-amadu-writes/
"Justine Senuvie Memorial Foundation donates 100 desks, scholarships to Kpando SHS",https://citinewsroom.com/2025/08/justine-senuvie-memorial-foundation-donates-100-desks-scholarships-to-kpando-shs/
Troubled Skies: Spotlight on China’s Z-9 Helicopter after Ghana tragedy,https://citinewsroom.com/2025/08/troubled-skies-spotlight-on-chinas-z-9-helicopter-after-ghana-tragedy/
AUDIO: Ramsar site developers petition Mahama over demolitions but do they really have a case? | #CitiCBS,https://citinewsroom.com/2025/08/audio-ramsar-site-developers-petition-mahama-over-demolitions-but-do-they-really-have-a-case-citicbs/
AUDIO: #TheLiteracyChallenge Top 50 announced. Hear who made the cut,https://citinewsroom.com/2025/08/theliteracychallenge-top-50-announced-hear-who-made-the-cut/
AUDIO: The HEATED DEBATE on the #CitiCBS over Sam George’s August 7 ultimatum to DSTV,https://citinewsroom.com/2025/08/audio-the-heated-debate-on-the-citicbs-over-sam-georges-august-7-ultimatum-to-dstv/
"AUDIO: Sports Panorama: Friday, 1st August, 2025 | #SportsPanorama",https://citinewsroom.com/2025/08/sports-panorama-friday-1st-august-2025-sportspanorama/
Prophecy review not to stifle worship – Afriyie Ankrah,https://citinewsroom.com/2025/08/prophecy-review-not-to-stifle-worship-afriyie-ankrah/
Sanitise social media to curb fear from Prophecies – Palgrave,https://citinewsroom.com/2025/08/sanitise-social-media-to-curb-fear-from-prophecies-palgrave/
Prophecies on national security must be coordinated – Adawudu,https://citinewsroom.com/2025/08/prophecies-on-national-security-must-be-coordinated-adawudu/
"Helicopter Crash: Show love, tomorrow is not promised – Shamima Muslim",https://citinewsroom.com/2025/08/helicopter-crash-show-love-tomorrow-is-not-promised-shamima-muslim/
Presidential envoy directs Religious leaders to submit prophecies for review,https://citinewsroom.com/2025/08/presidential-envoy-directs-religious-leaders-to-submit-prophecies-for-review/
DVLA launches Lorry Terminal Project to bring services closer to drivers,https://citinewsroom.com/2025/08/dvla-launches-lorry-terminal-project-to-bring-services-closer-to-drivers/
Credit enquiries soar 114% in 2024 as digital lending expands – BoG,https://citinewsroom.com/2025/08/credit-enquiries-soar-114-in-2024-as-digital-lending-expands-bog/
Banks lead credit bureau activity as enquiries double in 2024 – BoG,https://citinewsroom.com/2025/08/banks-lead-credit-bureau-activity-as-enquiries-double-in-2024-bog/
T-Bill auction sees 22% undersubscription amid falling yields,https://citinewsroom.com/2025/08/t-bill-auction-sees-22-undersubscription-amid-falling-yields/
"2026 Budget: Businesses pushing for lending rate cut, incentives to drive 24-hour economy",https://citinewsroom.com/2025/08/2026-budget-businesses-pushing-for-lending-rate-cut-incentives-to-drive-24-hour-economy/
Screams & Skepticism: How Telecel 2Moorch Money promo winners react to GH20K wins,https://citinewsroom.com/2025/08/screams-skepticism-how-telecel-2moorch-money-promo-winners-react-to-gh20k-wins/
Telecel Ghana Hosts 100 Girls for 2025 National Girls in ICT Open Day,https://citinewsroom.com/2025/08/telecel-ghana-hosts-100-girls-for-2025-national-girls-in-ict-open-day/
‘Ghana has lost true patriots’ – Jospong Group mourns victims of helicopter crash,https://citinewsroom.com/2025/08/ghana-has-lost-true-patriots-jospong-group-mourns-victims-of-helicopter-crash/
DVLA launches Lorry Terminal Project to bring services closer to drivers,https://citinewsroom.com/2025/08/dvla-launches-lorry-terminal-project-to-bring-services-closer-to-drivers/
HR Connect Conference 2025 champions employee well-being and workplace excellence,https://citinewsroom.com/2025/08/hr-connect-conference-2025-champions-employee-well-being-and-workplace-excellence/
Crystal Palace stun Liverpool on penalties to win first community shield,https://citinewsroom.com/2025/08/crystal-palace-stun-liverpool-on-penalties-to-win-first-community-shield/
LCB Corporate games 2025 springs to life in Tema,https://citinewsroom.com/2025/08/lcb-corporate-games-2025-springs-to-life-in-tema/
Ayariga to captain Parliament in Democracy Cup game against Judiciary,https://citinewsroom.com/2025/08/ayariga-to-captain-parliament-in-democracy-cup-game-against-judiciary/
Ghana Sports Conference 2025 postponed to September,https://citinewsroom.com/2025/08/ghana-sports-conference-2025-postponed-to-september/
Tourism advocate treks from Bolga to Accra after losing sports bet,https://citinewsroom.com/2025/08/tourism-advocate-treks-from-bolga-to-accra-after-losing-stadium-bet/
EOCO seizes Lamborghini from Shatta Wale in joint operation with FBI,https://citinewsroom.com/2025/08/eoco-seizes-lamborghini-from-shatta-wale-in-joint-operation-with-fbi/
Richard Briandt installed as Asafoatse Dzahene IV of Osu,https://citinewsroom.com/2025/08/richard-briandt-installed-as-asafoatse-dzahene-iv-of-osu/
Daddy Lumba’s one-week observance scheduled for August 30,https://citinewsroom.com/2025/08/daddy-lumbas-one-week-observance-scheduled-for-august-30/
Shatta Wale accuses EOCO of invading his residence with guns,https://citinewsroom.com/2025/08/shatta-wale-accuses-eoco-of-invading-his-residence-with-guns/
Tourism Ministry swears in new NCC board,https://citinewsroom.com/2025/08/tourism-ministry-swears-in-new-ncc-board/
Australia to recognise Palestinian state in September,https://citinewsroom.com/2025/08/australia-to-recognise-palestinian-state-in-september/
Hostage families call for nationwide strike as Israel prepares to escalate war,https://citinewsroom.com/2025/08/hostage-families-call-for-nationwide-strike-as-israel-prepares-to-escalate-war/
Trump says Qatari jet could be ready for use as Air Force One in 6 months,https://citinewsroom.com/2025/08/trump-says-qatari-jet-could-be-ready-for-use-as-air-force-one-in-6-months/
US offers $50m reward for arrest of Venezuelan leader Nicolás Maduro,https://citinewsroom.com/2025/08/us-offers-50m-reward-for-arrest-of-venezuelan-leader-nicolas-maduro/
Trump demands ‘highly conflicted’ Intel CEO resign over China ties,https://citinewsroom.com/2025/08/trump-demands-highly-conflicted-intel-ceo-resign-over-china-ties/
"It shocked the market, but has China’s DeepSeek changed AI?",https://citinewsroom.com/2025/08/it-shocked-the-market-but-has-chinas-deepseek-changed-ai/
"Treepz launches in Canada, University of Toronto’s sponsored program is first corporate travel client in North America",https://citinewsroom.com/2025/07/treepz-launches-in-canada-university-of-torontos-sponsored-program-is-first-corporate-travel-client-in-north-america/
YouTube to be included in Australia’s teen social media ban,https://citinewsroom.com/2025/07/youtube-to-be-included-in-australias-teen-social-media-ban/
EdTech Mondays: Building Ghana’s Digital Education Infrastructure: From Policy to Practice,https://citinewsroom.com/2025/07/edtech-mondays-building-ghanas-digital-education-infrastructure-from-policy-to-practice/
Samsung Galaxy watch ultra now has one UI 8 watch,https://citinewsroom.com/2025/07/samsung-galaxy-watch-ultra-now-has-one-ui-8-watch/
"Ghana records 18 new Mpox cases, total now 346",https://citinewsroom.com/2025/08/ghana-records-18-new-mpox-cases-total-now-346/
Korle Bu Teaching Hospital reports 700 cancer cases annually,https://citinewsroom.com/2025/07/korle-bu-teaching-hospital-reports-700-cancer-cases-annually/
Prioritise recruitment of doctors in next budget – Garu MP urges govt,https://citinewsroom.com/2025/07/prioritise-recruitment-of-doctors-in-next-budget-garu-mp-urges-govt/
UNICEF hails Ghana’s $24m vaccine payment to protect children’s health,https://citinewsroom.com/2025/07/unicef-hails-ghanas-24m-vaccine-payment-to-protect-childrens-health/
FDA approves commercial production of snake anti-venom – Akandoh,https://citinewsroom.com/2025/07/fda-approves-commercial-production-of-snake-anti-venom-akandoh/
My father died and we rejoiced – Umaru Sanda Amadu writes,https://citinewsroom.com/2025/08/my-father-died-and-we-rejoiced-umaru-sanda-amadu-writes/
"National loss, personal pain: The families we must not forget – Seidu Agongo writes",https://citinewsroom.com/2025/08/national-loss-personal-pain-the-families-we-must-not-forget-seidu-agongo-writes/
Troubled Skies: Spotlight on China’s Z-9 Helicopter after Ghana tragedy,https://citinewsroom.com/2025/08/troubled-skies-spotlight-on-chinas-z-9-helicopter-after-ghana-tragedy/
A Tribute to Dr Omane Boamah – Dr. Sodzi Sodzi-Tettey writes,https://citinewsroom.com/2025/08/a-tribute-to-dr-omane-boamah-dr-sodzi-sodzi-tettey-writes/
"Politicisation of Ghana’s cocoa sector, the sad reality",https://citinewsroom.com/2025/08/politicisation-of-ghanas-cocoa-sector-the-sad-reality/
