Headline,Link
Most Ghanaians report better living standards than last year – Global InfoAnalytics,https://citinewsroom.com/2025/12/most-ghanaians-report-better-living-standards-than-last-year-global-infoanalytics/
ECG resolves technical challenge affecting MMS-Compliant meters,https://citinewsroom.com/2025/12/ecg-resolves-technical-challenge-affecting-mms-compliant-meters/
Mahama ends 2025 with 67% approval as economic optimism rises for 2026 – Report,https://citinewsroom.com/2025/12/mahama-ends-2025-with-67-approval-as-economic-optimism-rises-for-2026-report/
Majority of voters support extension of presidential term to 5 years – Poll,https://citinewsroom.com/2025/12/majority-of-voters-support-extension-of-presidential-term-to-5-years-poll/
"DVLA plate suspension raises insurance, public safety concerns — Abuakwa South MP",https://citinewsroom.com/2025/12/dvla-plate-suspension-raises-insurance-public-safety-concerns-abuakwa-south-mp/
Ghana is on the right path under Mahama — Global InfoAnalytics Poll,https://citinewsroom.com/2025/12/ghana-is-on-the-right-path-under-mahama-global-infoanalytics-poll/
NACOC: Raids on drug dens to be sustained nationwide,https://citinewsroom.com/2025/12/nacoc-raids-on-drug-dens-to-be-sustained-nationwide/
"Mahama Ayariga, Northern MPs meet Bawku Naba to forge lasting peace",https://citinewsroom.com/2025/12/mahama-ayariga-northern-mps-meet-bawku-naba-to-forge-lasting-peace/
"NACOC raids drug dens in Eastern and Greater Accra regions, 72 arrested",https://citinewsroom.com/2025/12/nacoc-raids-drug-dens-in-eastern-and-greater-accra-regions-72-arrested/
Family of late Ghanaian student who died in Latvia welcomes Ablakwa’s intervention,https://citinewsroom.com/2025/12/family-of-late-ghanaian-student-who-died-in-latvia-welcomes-ablakwas-intervention/
"AFCON Day 7: Cameroon, Ivory Coast in stalemate as Algeria reach last 16",https://citinewsroom.com/2025/12/afcon-day-7-cameroon-ivory-coast-in-stalemate-as-algeria-reach-last-16/
Two more Mpox deaths recorded; cases rise to 947,https://citinewsroom.com/2025/12/two-more-mpox-deaths-recorded-cases-rise-to-947/
Mr. Eazi calls on GTA to back $2m project,https://citinewsroom.com/2025/12/mr-eazi-calls-on-gta-to-back-2m-project/
Trump says progress made in Ukraine talks but ‘thorny issues’ remain,https://citinewsroom.com/2025/12/trump-says-progress-made-in-ukraine-talks-but-thorny-issues-remain/
AUDIO: Gov’t deploys buses to ease transport concerns – Are we only papering over the massive cracks? | #CitiCBS,https://citinewsroom.com/2025/12/audio-govt-deploys-buses-to-ease-transport-concerns-are-we-only-papering-over-the-massive-cracks-citicbs/
AUDIO: The party to end ALL parties! Here’s why you can’t miss #Citiuation2025 on Christmas Eve | #CitiCBS,https://citinewsroom.com/2025/12/audio-the-party-to-end-all-parties-heres-why-you-cant-miss-citiuation2025-on-christmas-eve-citicbs/
AUDIO: Channel One Community Legends: Here’s your chance to celebrate local heroes who are changing lives! | #CitiCBS,https://citinewsroom.com/2025/12/audio-channel-one-community-legends-heres-your-chance-to-celebrate-local-heroes-who-are-changing-lives-citicbs/
AUDIO: Failed Benin coup: Assessing the insecurity in the sub region and how Ghana can stave off chaos | #CitiCBS,https://citinewsroom.com/2025/12/audio-failed-benin-coup-assessing-the-insecurity-in-the-sub-region-and-how-ghana-can-stave-off-chaos-citicbs/
Mahama ends 2025 with 67% approval as economic optimism rises for 2026 – Report,https://citinewsroom.com/2025/12/mahama-ends-2025-with-67-approval-as-economic-optimism-rises-for-2026-report/
Majority of voters support extension of presidential term to 5 years – Poll,https://citinewsroom.com/2025/12/majority-of-voters-support-extension-of-presidential-term-to-5-years-poll/
“We are here to win” – ACUP targets 2028 elections,https://citinewsroom.com/2025/12/we-are-here-to-win-acup-targets-2028-elections/
Mahama steering Ghana in the right direction – Dormaahene,https://citinewsroom.com/2025/12/mahama-steering-ghana-in-the-right-direction-dormaahene/
"Nyaho-Tamakloe: Maintain current presidential term limits, extension unnecessary",https://citinewsroom.com/2025/12/nyaho-tamakloe-maintain-current-presidential-term-limits-extension-unnecessary/
Treasury bills oversubscribed by 18.5% as investor demand remains strong,https://citinewsroom.com/2025/12/treasury-bills-oversubscribed-by-18-5-as-investor-demand-remains-strong/
Most Ghanaians report better living standards than last year – Global InfoAnalytics,https://citinewsroom.com/2025/12/most-ghanaians-report-better-living-standards-than-last-year-global-infoanalytics/
Prof. Asuming calls for transparency in GoldBod accounts,https://citinewsroom.com/2025/12/prof-asuming-calls-for-transparency-in-goldbod-accounts/
Sustained funding key to TOR’s long-term operations – COPEC,https://citinewsroom.com/2025/12/sustained-funding-key-to-tors-long-term-operations-copec/
"Don’t help foreigners acquire Ghana Cards, passports – Sam George warns",https://citinewsroom.com/2025/12/dont-help-foreigners-acquire-ghana-cards-passports-sam-george-warns/
Akrofu bridges to open January 2026 – Ho Central MP,https://citinewsroom.com/2025/12/akrofu-bridges-to-open-january-2026-ho-central-mp/
"Ellembelle: Lands Minister donates logistics, orders tighter controls to fight galamsey",https://citinewsroom.com/2025/12/ellembelle-lands-minister-donates-logistics-orders-tighter-controls-to-fight-galamsey/
Sekondi: Alleged commercial sex worker beaten by client,https://citinewsroom.com/2025/12/sekondi-alleged-commercial-sex-worker-beaten-by-client/
Ibrahim Mahama supports disability groups with Christmas donation,https://citinewsroom.com/2025/12/ibrahim-mahama-supports-disability-groups-with-christmas-donation/
Illegal miner jailed for violent attack on student in Bompieso,https://citinewsroom.com/2025/12/illegal-miner-jailed-for-violent-attack-on-student-in-bompieso/
"AFCON Day 7: Cameroon, Ivory Coast in stalemate as Algeria reach last 16",https://citinewsroom.com/2025/12/afcon-day-7-cameroon-ivory-coast-in-stalemate-as-algeria-reach-last-16/
2026 African Athletics Championships: Local Organising Committee inaugurated,https://citinewsroom.com/2025/12/2026-african-athletics-championships-local-organising-committee-inaugurated/
2025 AFCON: Salah scores late winner goal as Egypt come from behind to beat Zimbabwe,https://citinewsroom.com/2025/12/2025-afcon-salah-scores-late-winner-goal-as-egypt-come-from-behind-to-beat-zimbabwe/
2025 AFCON officially kicks off today in Morocco,https://citinewsroom.com/2025/12/2025-afcon-officially-kicks-off-today-in-morocco/
Morocco set for colourful opening ceremony as AFCON 2025 kicks off,https://citinewsroom.com/2025/12/morocco-set-for-colourful-opening-ceremony-as-afcon-2025-kicks-off/
Mr. Eazi calls on GTA to back $2m project,https://citinewsroom.com/2025/12/mr-eazi-calls-on-gta-to-back-2m-project/
The Chat: Artistes must prioritise local market alongside int’l tours – Robert Klah,https://citinewsroom.com/2025/12/the-chat-artistes-must-prioritise-local-market-alongside-intl-tours-robert-klah/
KiDi lines up top music stars at ‘Likor On The Beach’ 2025,https://citinewsroom.com/2025/12/kidi-lines-up-top-music-stars-at-likor-on-the-beach-2025/
2025 Citiuation All White Party in pictures,https://citinewsroom.com/2025/12/2025-citiuation-all-white-party-in-pictures/
From Worship to wild cheers: Citiuation All White Party thrills Accra,https://citinewsroom.com/2025/12/from-worship-to-wild-cheers-citiuation-all-white-party-thrills-accra/
Trump says progress made in Ukraine talks but ‘thorny issues’ remain,https://citinewsroom.com/2025/12/trump-says-progress-made-in-ukraine-talks-but-thorny-issues-remain/
A new ‘DNA’ law hits US airports-here’s everything you need to know,https://citinewsroom.com/2025/12/a-new-dna-law-hits-us-airports-heres-everything-you-need-to-know/
War-torn Myanmar voting in widely criticised ‘sham’ election,https://citinewsroom.com/2025/12/war-torn-myanmar-voting-in-widely-criticised-sham-election/
"One general, one mathematician: The men competing for power in two African elections",https://citinewsroom.com/2025/12/one-general-one-mathematician-the-men-competing-for-power-in-two-african-elections/
Nvidia to license Groq technology,https://citinewsroom.com/2025/12/nvidia-to-license-groq-technology/
China issues draft rules to regulate AI with human-like interaction,https://citinewsroom.com/2025/12/china-issues-draft-rules-to-regulate-ai-with-human-like-interaction/
Virtual Assets Bill 2025:  What Its Passage Means for Ghana’s Digital Economy,https://citinewsroom.com/2025/12/virtual-assets-bill-2025-what-its-passage-means-for-ghanas-digital-economy/
"Ghana targets 30,000 AI professionals through Japan partnership",https://citinewsroom.com/2025/12/ghana-targets-30000-ai-professionals-through-japan-partnership/
"With freebies, OpenAI, Google vie for Indian users and training data",https://citinewsroom.com/2025/12/with-freebies-openai-google-vie-for-indian-users-and-training-data/
"Smartphone prices to rise 7% in 2026 due to AI-fueled chip shortage, new data shows",https://citinewsroom.com/2025/12/smartphone-prices-to-rise-7-in-2026-due-to-ai-fueled-chip-shortage-new-data-shows/
NACOC: Raids on drug dens to be sustained nationwide,https://citinewsroom.com/2025/12/nacoc-raids-on-drug-dens-to-be-sustained-nationwide/
Stigmatisation discourages people from HIV testing – Gold Fields Ghana,https://citinewsroom.com/2025/12/stigmatisation-discourages-people-from-hiv-testing-gold-fields-ghana/
"Akandoh praises doctors, nurses, frontline staff for sustaining healthcare delivery",https://citinewsroom.com/2025/12/akandoh-praises-doctors-nurses-frontline-staff-for-sustaining-healthcare-delivery/
Korle-Bu to conduct mass burial of 320 unclaimed bodies,https://citinewsroom.com/2025/12/korle-bu-to-conduct-mass-burial-of-320-unclaimed-bodies/
KATH calls for urgent completion of Heal Komfo Anokye project,https://citinewsroom.com/2025/12/kath-calls-for-urgent-completion-of-heal-komfo-anokye-project/
Part two: Key observations on the Constitutional Review Committee report submitted to President Mahama – Alex Boateng writes,https://citinewsroom.com/2025/12/part-two-key-observations-on-the-constitutional-review-committee-report-submitted-to-president-mahama-alex-boateng-writes/
"Beyond the losses: Rethinking Goldbod as policy, not Profit",https://citinewsroom.com/2025/12/beyond-the-losses-rethinking-goldbod-as-policy-not-profit/
Religious bias is a wrong battle against Non-Interest Banking rollout [Opinion],https://citinewsroom.com/2025/12/religious-bias-is-a-wrong-battle-against-non-interest-banking-rollout-opinion/
"Does Goldbod owe BoG $214m, or has BoG lost $214m?",https://citinewsroom.com/2025/12/does-goldbod-owe-bog-214m-or-has-bog-lost-214m/
Beyond the repeal: Can revoking L.I. 2462 curb galamsey? – Bervelyn Longdon asks,https://citinewsroom.com/2025/12/beyond-the-repeal-can-revoking-l-i-2462-curb-galamsey/
