Headline,Link
"AG to prosecute Wontumi Farms, directors over GHS24m EXIM Bank fraud",https://citinewsroom.com/2025/12/ag-to-prosecute-wontumi-farms-directors-over-ghs24m-exim-bank-fraud/
Wontumi submitted forged receipt to secure GHS4m loan – Ayine,https://citinewsroom.com/2025/12/wontumi-submitted-forged-receipt-to-secure-ghs4m-loan-ayine/
Mahama to receive final constitutional review committee report today,https://citinewsroom.com/2025/12/constitutional-review-committee-to-present-final-report-to-mahama-today/
DVLA warns public over fake Facebook account impersonating CEO,https://citinewsroom.com/2025/12/dvla-warns-public-over-fake-facebook-account-impersonating-ceo/
Mediation experts needed to solve conflicts – Elikem Kotoko,https://citinewsroom.com/2025/12/mediation-experts-needed-to-solve-conflicts-elikem-kotoko/
Haruna Iddrisu: Hands-on skills must be central in technical universities,https://citinewsroom.com/2025/12/haruna-iddrisu-hands-on-skills-must-be-central-in-technical-universities/
Political interference worsening Bawku crisis – Ibrahim Adjei,https://citinewsroom.com/2025/12/political-interference-worsening-bawku-crisis-ibrahim-adjei/
Kumasi: Temporary outages expected as GRIDCo connects new Anwomaso plant,https://citinewsroom.com/2025/12/kumasi-temporary-outages-expected-as-gridco-connects-new-anwomaso-plant/
"Baby, five others die in late-night fire at Abuakwa Manhyia",https://citinewsroom.com/2025/12/baby-five-others-die-in-late-night-fire-at-abuakwa-manhyia/
Legislative reforms will prevent return to 2022 financial crisis – BoG Governor,https://citinewsroom.com/2025/12/legislative-reforms-will-prevent-return-to-2022-financial-crisis-bog-governor/
Festive power demand hits record high; Energy Minister assures of stable supply,https://citinewsroom.com/2025/12/festive-power-demand-hits-record-high-energy-minister-assures-of-stable-supply/
"Hotels, guesthouses record high occupancy ahead of Christmas",https://citinewsroom.com/2025/12/hotels-guesthouses-record-high-occupancy-ahead-of-christmas/
"Bright Davies opens up on faith, music, purpose",https://citinewsroom.com/2025/12/bright-davies-opens-up-on-faith-music-purpose/
New Bakpa traders urge govt to fix roads to new market,https://citinewsroom.com/2025/12/new-bakpa-traders-urge-govt-to-fix-roads-to-new-market/
AUDIO: Gov’t deploys buses to ease transport concerns – Are we only papering over the massive cracks? | #CitiCBS,https://citinewsroom.com/2025/12/audio-govt-deploys-buses-to-ease-transport-concerns-are-we-only-papering-over-the-massive-cracks-citicbs/
AUDIO: The party to end ALL parties! Here’s why you can’t miss #Citiuation2025 on Christmas Eve | #CitiCBS,https://citinewsroom.com/2025/12/audio-the-party-to-end-all-parties-heres-why-you-cant-miss-citiuation2025-on-christmas-eve-citicbs/
AUDIO: Channel One Community Legends: Here’s your chance to celebrate local heroes who are changing lives! | #CitiCBS,https://citinewsroom.com/2025/12/audio-channel-one-community-legends-heres-your-chance-to-celebrate-local-heroes-who-are-changing-lives-citicbs/
AUDIO: Failed Benin coup: Assessing the insecurity in the sub region and how Ghana can stave off chaos | #CitiCBS,https://citinewsroom.com/2025/12/audio-failed-benin-coup-assessing-the-insecurity-in-the-sub-region-and-how-ghana-can-stave-off-chaos-citicbs/
Wontumi submitted forged receipt to secure GHS4m loan – Ayine,https://citinewsroom.com/2025/12/wontumi-submitted-forged-receipt-to-secure-ghs4m-loan-ayine/
Mahama to receive final constitutional review committee report today,https://citinewsroom.com/2025/12/constitutional-review-committee-to-present-final-report-to-mahama-today/
Mediation experts needed to solve conflicts – Elikem Kotoko,https://citinewsroom.com/2025/12/mediation-experts-needed-to-solve-conflicts-elikem-kotoko/
Political interference worsening Bawku crisis – Ibrahim Adjei,https://citinewsroom.com/2025/12/political-interference-worsening-bawku-crisis-ibrahim-adjei/
"Manasseh Azure: Use diplomacy, public pressure to extradite Ofori-Atta",https://citinewsroom.com/2025/12/manasseh-azure-use-diplomacy-public-pressure-to-extradite-ofori-atta/
"AG to prosecute Wontumi Farms, directors over GHS24m EXIM Bank fraud",https://citinewsroom.com/2025/12/ag-to-prosecute-wontumi-farms-directors-over-ghs24m-exim-bank-fraud/
Festive power demand hits record high; Energy Minister assures of stable supply,https://citinewsroom.com/2025/12/festive-power-demand-hits-record-high-energy-minister-assures-of-stable-supply/
"Hotels, guesthouses record high occupancy ahead of Christmas",https://citinewsroom.com/2025/12/hotels-guesthouses-record-high-occupancy-ahead-of-christmas/
Legislative reforms will prevent return to 2022 financial crisis – BoG Governor,https://citinewsroom.com/2025/12/legislative-reforms-will-prevent-return-to-2022-financial-crisis-bog-governor/
COCOBOD warns cocoa value slump could hit next year’s FOB price,https://citinewsroom.com/2025/12/cocobod-warns-cocoa-value-slump-could-hit-next-years-fob-price/
Police raid Tamale in anti-narcotics operation,https://citinewsroom.com/2025/12/police-raid-tamale-in-anti-narcotics-operation/
Tamale: Police probe baby theft at One Heart Hospital; two nurses picked up,https://citinewsroom.com/2025/12/tamale-police-investigates-baby-theft-at-one-heart-hospital-two-nurses-picked-up/
Canadian police bust global auto theft ring; Ghanaian among 20 arrested,https://citinewsroom.com/2025/12/canadian-police-bust-global-auto-theft-ring-ghanaian-among-20-arrested/
Lands Minister commissions 636 Blue Water Guards to intensify galamsey fight,https://citinewsroom.com/2025/12/lands-minister-commissions-636-blue-water-guards-to-intensify-galamsey-fight/
Working Capital Management: Dos and don’ts to consider for 2026,https://citinewsroom.com/2025/12/working-capital-management-dos-and-donts-to-consider-for-2026/
2025 AFCON officially kicks off today in Morocco,https://citinewsroom.com/2025/12/2025-afcon-officially-kicks-off-today-in-morocco/
Morocco set for colourful opening ceremony as AFCON 2025 kicks off,https://citinewsroom.com/2025/12/morocco-set-for-colourful-opening-ceremony-as-afcon-2025-kicks-off/
77 hearing-impaired students compete in Chung Do Kwan championship,https://citinewsroom.com/2025/12/77-hearing-impaired-students-compete-in-chung-do-kwan-championship/
Vanderpuye calls for independent body to oversee Sports fund,https://citinewsroom.com/2025/12/vanderpuye-calls-for-independent-body-to-oversee-sports-fund/
Can Salah finally lift AFCON trophy as Morocco eye home glory?,https://citinewsroom.com/2025/12/can-salah-finally-lift-afcon-trophy-as-morocco-eye-home-glory/
Funding key to Ghana music’s global success- Afronation,https://citinewsroom.com/2025/12/funding-key-to-ghana-musics-global-success-afronation/
[Watch] Gambo stuns U.S. viewers on BET’s Love & Hip Hop Miami,https://citinewsroom.com/2025/12/watch-gambo-stuns-u-s-viewers-on-bets-love-hip-hop-miami/
"Bright Davies opens up on faith, music, purpose",https://citinewsroom.com/2025/12/bright-davies-opens-up-on-faith-music-purpose/
Upper West: Sing Traditional Area marks decade of youngest paramount queenmother,https://citinewsroom.com/2025/12/upper-west-sing-traditional-area-marks-decade-of-youngest-paramount-queenmother/
Noyam African Dance Institute makes history with Goli stage production,https://citinewsroom.com/2025/12/noyam-african-dance-institute-makes-history-with-goli-stage-production/
Australia launches intelligence review following Bondi Beach terror attack,https://citinewsroom.com/2025/12/australia-launches-intelligence-review-following-bondi-beach-terror-attack/
Benjamin Crump hails Mahama’s leadership on reparative Justice,https://citinewsroom.com/2025/12/benjamin-crump-hails-mahamas-leadership-on-reparative-justice/
EU secures funding deal for Kyiv as Putin offers no compromise in Ukraine war,https://citinewsroom.com/2025/12/eu-secures-funding-deal-for-kyiv-as-putin-offers-no-compromise-in-ukraine-war/
Gnassingbé: Reparatory justice crucial for Africa’s dev’t and global equity,https://citinewsroom.com/2025/12/gnassingbe-reparatory-justice-crucial-for-africas-devt-and-global-equity/
US suspends Green Card Lottery after Brown University shooting,https://citinewsroom.com/2025/12/us-suspends-green-card-lottery-after-brown-university-shooting/
"With freebies, OpenAI, Google vie for Indian users and training data",https://citinewsroom.com/2025/12/with-freebies-openai-google-vie-for-indian-users-and-training-data/
"Smartphone prices to rise 7% in 2026 due to AI-fueled chip shortage, new data shows",https://citinewsroom.com/2025/12/smartphone-prices-to-rise-7-in-2026-due-to-ai-fueled-chip-shortage-new-data-shows/
Russian ban on Roblox gaming platform sparks rare protest,https://citinewsroom.com/2025/12/russian-ban-on-roblox-gaming-platform-sparks-rare-protest/
Resilio Africa: Google.org backs 3-year cybersecurity project,https://citinewsroom.com/2025/12/resilio-africa-google-org-backs-3-year-cybersecurity-project/
CHRAJ calls for stronger protection of Children’s digital rights,https://citinewsroom.com/2025/12/chraj-calls-for-stronger-protection-of-childrens-digital-rights/
Tamale: Police probe baby theft at One Heart Hospital; two nurses picked up,https://citinewsroom.com/2025/12/tamale-police-investigates-baby-theft-at-one-heart-hospital-two-nurses-picked-up/
Abena Osei Asare calls for separate funding for health infrastructure,https://citinewsroom.com/2025/12/abena-osei-asare-calls-for-separate-funding-for-health-infrastructure/
MoH rolls out new framework to guide health funding priorities,https://citinewsroom.com/2025/12/moh-rolls-out-new-framework-to-guide-health-funding-priorities/
Africa is falling behind on HIV treatment coverage – UNAIDS,https://citinewsroom.com/2025/12/africa-is-falling-behind-on-hiv-treatment-coverage-unaids/
Traditional medicine key to UHC in Africa – WHO,https://citinewsroom.com/2025/12/traditional-medicine-key-to-uhc-in-africa-who/
Toward a national agenda for real financial inclusion [Article],https://citinewsroom.com/2025/12/toward-a-national-agenda-for-real-financial-inclusion-article/
Did Bright Simons overstretch his take on BoG’s exposure draft on non-interest banking?,https://citinewsroom.com/2025/12/did-bright-simons-overstretch-his-take-on-bogs-exposure-draft-on-non-interest-banking/
"6.6m Journeys, GHS1.83bn Spent: The hidden power of Ghana’s same-day travel",https://citinewsroom.com/2025/12/6-6m-journeys-ghs1-83bn-spent-the-hidden-power-of-ghanas-same-day-travel/
The Call for Mahama’s Third Term: Will Ghana’s Constitution survive?,https://citinewsroom.com/2025/12/the-call-for-mahamas-third-term-will-ghanas-constitution-survive/
"Ghana anti-corruption strike: Extradition hunt for Ken Ofori-Atta, $15m crypto bust and record corruption crackdowns -Samuel Ackom writes",https://citinewsroom.com/2025/12/ghana-anti-corruption-strike-extradition-hunt-for-ken-ofori-atta-15m-crypto-bust-and-record-corruption-crackdowns-samuel-ackom-writes/
