Headline,Link
"NPP, other political parties to protest CJ’s suspension on May 5",https://citinewsroom.com/2025/04/npp-other-political-parties-to-protest-cjs-suspension-on-may-5/
Dagbon Overlord intervenes in TTH doctors’ strike,https://citinewsroom.com/2025/04/dagbon-overlord-intervenes-in-tth-doctors-strike/
GAF denies attack on Chief of Army Staff in Bawku,https://citinewsroom.com/2025/04/gaf-denies-attack-on-chief-of-army-staff-in-bawku/
PFJ was built on fraud – Peasant Farmers Association,https://citinewsroom.com/2025/04/pfj-was-built-on-fraud-peasant-farmers-association/
TTH Strike: Minority backs doctors but calls for return to work,https://citinewsroom.com/2025/04/tth-strike-minority-backs-doctors-but-calls-for-return-to-work/
Education Minister inaugurates UG Governing Council,https://citinewsroom.com/2025/04/education-minister-inaugurates-ug-governing-council/
UE/R: Toobu warns of looming water crisis from galamsey activities,https://citinewsroom.com/2025/04/ue-r-toobu-warns-of-looming-water-crisis-from-galamsey-activities/
Feed Ghana Programme is a Game-Changer for Agriculture – GAPFA,https://citinewsroom.com/2025/04/feed-ghana-programme-is-a-game-changer-for-agriculture-gapfa/
More Nigerians will become poor by 2027 — World Bank,https://citinewsroom.com/2025/04/more-nigerians-will-become-poor-by-2027-world-bank/
Mahama directs GES to promote all eligible deputy directors,https://citinewsroom.com/2025/04/mahama-directs-ges-to-promote-all-eligible-deputy-directors/
World Bank cuts Ghana’s 2025 growth forecast to 3.9%,https://citinewsroom.com/2025/04/world-bank-cuts-ghanas-2025-growth-forecast-to-3-9/
GRA targets digital economy to boost tax revenue,https://citinewsroom.com/2025/04/gra-targets-digital-economy-to-boost-tax-revenue/
TTH Doctors deserve an apology – Akim Oda MP tells Akandoh,https://citinewsroom.com/2025/04/tth-doctors-deserve-an-apology-akim-oda-mp-tells-akandoh/
Mahama: Vice President Opoku-Agyemang recovering well,https://citinewsroom.com/2025/04/mahama-vice-president-opoku-agyemang-recovering-well/
Offinso: Trotro mate killed in armed robbery attack,https://citinewsroom.com/2025/04/offinso-trotro-mate-killed-in-armed-robbery-attack/
"Eyewitness News, Monday, 10th March, 2025",https://citinewsroom.com/2025/03/eyewitness-news-monday-10th-march-2025/
"Citi Breakfast Show, Monday, 10th March, 2025",https://citinewsroom.com/2025/03/citi-breakfast-show-monday-10th-march-2025/
Heritage on-Air Series | Celebrating Iconic Ghanaian Music | Ep5,https://citinewsroom.com/2025/03/heritage-on-air-series-the-story-of-ghanaian-music-through-the-years-ep5/
"FamLife | Ghanaian Marriage Paradigms | Saturday, 8th March, 2025",https://citinewsroom.com/2025/03/famlife-ghanaian-marriage-paradigms-saturday-8th-march-2025/
"NPP, other political parties to protest CJ’s suspension on May 5",https://citinewsroom.com/2025/04/npp-other-political-parties-to-protest-cjs-suspension-on-may-5/
Ex-Signals Bureau Boss and wife sue Attorney General for defamation,https://citinewsroom.com/2025/04/ex-signals-bureau-boss-and-wife-sue-attorney-general-for-defamation/
NACOC intercepts 73 slabs of suspected cocaine at Swiss Port; 4 arrested,https://citinewsroom.com/2025/04/nacoc-intercepts-73-slabs-of-suspected-cocaine-at-swiss-port-4-arrested/
Old Tafo MP files suit to overturn Mahama’s suspension of Chief Justice,https://citinewsroom.com/2025/04/old-tafo-mp-files-suit-to-overturn-mahamas-suspension-of-chief-justice/
‘I appointed you to solve problems; deliver or step aside’ – Mahama to Ministers,https://citinewsroom.com/2025/04/i-appointed-you-to-solve-problems-deliver-or-step-aside-mahama-to-ministers/
PFJ was built on fraud – Peasant Farmers Association,https://citinewsroom.com/2025/04/pfj-was-built-on-fraud-peasant-farmers-association/
Societe Generale Ghana rewards 40 customers in first mini draw of deposit and drive campaign,https://citinewsroom.com/2025/04/societe-generale-ghana-rewards-40-customers-in-first-mini-draw-of-deposit-and-drive-campaign/
Feed Ghana Programme is a Game-Changer for Agriculture – GAPFA,https://citinewsroom.com/2025/04/feed-ghana-programme-is-a-game-changer-for-agriculture-gapfa/
PFAG warns against political interference in Feed Ghana Initiative,https://citinewsroom.com/2025/04/pfag-warns-against-political-interference-in-feed-ghana-initiative/
World Bank cuts Ghana’s 2025 growth forecast to 3.9%,https://citinewsroom.com/2025/04/world-bank-cuts-ghanas-2025-growth-forecast-to-3-9/
Nyinahin: Police probe tragic shooting incident,https://citinewsroom.com/2025/04/nyinahin-police-probe-tragic-shooting-incident/
Improve working conditions to curb brain drain – TUC tells govt,https://citinewsroom.com/2025/04/improve-working-conditions-to-curb-brain-drain-tuc-tells-govt/
$2bn of World Bank-funded projects driving harmful energy investments in Ghana – Report,https://citinewsroom.com/2025/04/2bn-of-world-bank-funded-projects-driving-harmful-energy-investments-in-ghana-report-2/
Don’t terminate Zoomlion’s contract – Parliamentary Select Committee on Sanitation to YEA,https://citinewsroom.com/2025/04/dont-terminate-zoomlions-contract-parliamentary-select-committee-on-sanitation-to-yea/
Nyinahin community in darkness after shooting incident,https://citinewsroom.com/2025/04/nyinahin-community-in-darkness-after-shooting-incident/
Ahmed Shaib represents Ghana at African weightlifting congress in Mauritius,https://citinewsroom.com/2025/04/ahmed-shaib-represents-ghana-at-african-weightlifting-congress-in-mauritius/
Hohoe Utd demand replacement of referee over potential bias ahead of crucial DOL match,https://citinewsroom.com/2025/04/hohoe-utd-demand-replacement-of-referee-over-potential-bias-ahead-of-crucial-dol-match/
Remontada! – Bellingham reveals the word fueling Real Madrid’s belief ahead of Arsenal clash,https://citinewsroom.com/2025/04/remontada-bellingham-reveals-the-word-fueling-real-madrids-belief-ahead-of-arsenal-clash/
Accept criticisms in good faith – Kofi Adams advises Black Stars,https://citinewsroom.com/2025/04/accept-criticisms-in-good-faith-kofi-adams-advises-black-stars/
No need to release Black Stars budget now – Kofi Adams,https://citinewsroom.com/2025/04/no-need-to-release-black-stars-budget-now-kofi-adams/
"Telecel ignites TGMA fever with Special Data Bundles, shout-outs & rewards",https://citinewsroom.com/2025/04/telecel-ignites-tgma-fever-with-special-data-bundles-shout-outs-rewards/
"Abankese Festival 2024 Sparks Cultural Pride, Eyes Bigger 2025 Edition",https://citinewsroom.com/2025/04/abankese-festival-2024-sparks-cultural-pride-eyes-bigger-2025-edition/
Highlife star Kofi Eiphos stars in Jesus Christ’s crucifixion play in Germany,https://citinewsroom.com/2025/04/highlife-star-kofi-eiphos-stars-in-jesus-christs-crucifixion-play-in-germany/
“I find peace in Ghana” – Co-founder of Tribe Meets shares deep cultural connection,https://citinewsroom.com/2025/04/__trashed-4/
AratheJay Joins M.anifest for Spotify Africa’s “Jollof & Jama” Campaign,https://citinewsroom.com/2025/04/arathejay-joins-m-anifest-for-spotify-africas-jollof-jama-campaign/
More Nigerians will become poor by 2027 — World Bank,https://citinewsroom.com/2025/04/more-nigerians-will-become-poor-by-2027-world-bank/
Ukraine may have to give up land for peace – Kyiv Mayor Klitschko,https://citinewsroom.com/2025/04/ukraine-may-have-to-give-up-land-for-peace-kyiv-mayor-klitschko/
Four years not enough to deliver dev’t – Goodluck Jonathan,https://citinewsroom.com/2025/04/four-years-not-enough-to-deliver-devt-goodluck-jonathan/
China sends Boeing planes back to US over tariffs,https://citinewsroom.com/2025/04/china-sends-boeing-planes-back-to-us-over-tariffs/
Judge halts Trump’s shutdown of Voice of America,https://citinewsroom.com/2025/04/judge-halts-trumps-shutdown-of-voice-of-america/
Real QLED TV from Samsung: Mirroring real life,https://citinewsroom.com/2025/04/real-qled-tv-from-samsung-mirroring-real-life/
Empowering Ghana’s creative arts sector through technology,https://citinewsroom.com/2025/04/empowering-ghanas-creative-arts-sector-through-technology/
"Saying please, other polite words to ChatGPT costs millions of dollars – CEO",https://citinewsroom.com/2025/04/saying-please-to-chatgpt-other-polite-words-costs-millions-of-dollars-ceo/
What is the Signal messaging app and how secure is it?,https://citinewsroom.com/2025/04/what-is-the-signal-messaging-app-and-how-secure-is-it-2/
"US excludes smartphones, computers from Trump’s reciprocal tariffs",https://citinewsroom.com/2025/04/us-excludes-smartphones-computers-from-trumps-reciprocal-tariffs/
Dagbon Overlord intervenes in TTH doctors’ strike,https://citinewsroom.com/2025/04/dagbon-overlord-intervenes-in-tth-doctors-strike/
Mahama to complete stalled regional hospital — Thomas Anaba,https://citinewsroom.com/2025/04/mahama-to-complete-stalled-regional-hospital-thomas-anaba/
TTH Doctors deserve an apology – Akim Oda MP tells Akandoh,https://citinewsroom.com/2025/04/tth-doctors-deserve-an-apology-akim-oda-mp-tells-akandoh/
Seth Acheampong appeals to TTH doctors to call off strike,https://citinewsroom.com/2025/04/seth-acheampong-appeals-to-tth-doctors-to-call-off-strike/
"I’ll take care of you, call off the strike – Health Minister to TTH doctors",https://citinewsroom.com/2025/04/ill-take-care-of-you-call-off-the-strike-health-minister-to-tth-doctors/
Finding the sweet spot – why banks need a smart approach to lending,https://citinewsroom.com/2025/04/finding-the-sweet-spot-why-banks-need-a-smart-approach-to-lending/
Ghana Emerges as a Regional Fintech Bellwether in Africa’s $1.1 Trillion Mobile Money Market,https://citinewsroom.com/2025/04/ghana-emerges-as-a-regional-fintech-bellwether-in-africas-1-1-trillion-mobile-money-market/
"Building a culture of excellent customer service – a saleswoman’s perspective, Nana Akua writes",https://citinewsroom.com/2025/04/building-a-culture-of-excellent-customer-service-a-saleswomans-perspective-nana-akua-writes/
Articles 296 and 146 at a Crossroads: Strengthening the Chief Justice’s Security of Tenure,https://citinewsroom.com/2025/04/articles-296-and-146-at-a-crossroads-strengthening-the-chief-justices-security-of-tenure/
Avoiding the 19th IMF Bailout: Ghana’s Sector-by-Sector Blueprint for Sustainable Economic Independence,https://citinewsroom.com/2025/04/avoiding-the-19th-imf-bailout-ghanas-sector-by-sector-blueprint-for-sustainable-economic-independence/
