Headline,Link
Galamsey a “humongous” problem for Ghana – Outgoing Danish Ambassador,https://citinewsroom.com/2025/07/galamsey-a-humongous-problem-for-ghana-outgoing-danish-ambassador/
A/R: Over 400 persons displaced in slum fire outbreak,https://citinewsroom.com/2025/07/a-r-over-400-persons-displaced-in-slum-fire-outbreak/
Ghana eyes partnership with Portugal for national airline,https://citinewsroom.com/2025/07/ghana-eyes-partnership-with-portugal-for-national-airline/
Asokore Mampong security uncovers illegal abortion clinic in slum raid,https://citinewsroom.com/2025/07/asokore-mampong-security-uncovers-illegal-abortion-clinic-in-slum-raid/
"Blue Water Guards destroy 8 Changfan, confiscate pumps near Ankobra River",https://citinewsroom.com/2025/07/blue-water-guards-destroy-8-changfan-confiscate-pumps-near-ankobra-river/
"EC lacks spine, reinforcing claims it’s unfit for purpose – Seth Acheampong",https://citinewsroom.com/2025/07/ec-lacks-spine-reinforcing-claims-its-unfit-for-purpose-seth-acheampong/
CitiVerify: Free SHS Policy has not been cancelled,https://citinewsroom.com/2025/07/citiverify-free-shs-policy-has-not-been-cancelled/
$367m IMF disbursement hits Bank of Ghana account,https://citinewsroom.com/2025/07/367m-imf-disbursement-hits-bank-of-ghana-account/
Four arrested over Cape Coast Cocaine bust – Interior Minister,https://citinewsroom.com/2025/07/four-arrested-over-cape-coast-cocaine-bust-interior-minister/
ADB set for recapitalization in 2026 – Ato Forson,https://citinewsroom.com/2025/07/adb-set-for-recapitalization-in-2026-ato-forson/
No nationwide blackout on July 13 – Energy Ministry clarifies,https://citinewsroom.com/2025/07/no-nationwide-blackout-on-july-13-energy-ministry-clarifies/
Bawumia hails Kudus’ £55m move to Tottenham Hotspur,https://citinewsroom.com/2025/07/bawumia-hails-kudus-55m-move-to-tottenham-hotspur/
New 10 member GIPC Board inaugurated to bolster Ghana’s foreign investment drive,https://citinewsroom.com/2025/07/new-10-member-gipc-board-inaugurated-to-bolster-ghanas-foreign-investment-drive/
Hudu Mogtari chairs governing board of Ghana Standards Authority,https://citinewsroom.com/2025/07/hudu-mogtari-chairs-governing-board-of-ghana-standards-authority/
Interior Minister inaugurates 13-member Prisons Service Council,https://citinewsroom.com/2025/07/interior-minister-inaugurates-13-member-prisons-service-council/
‘How Fintech is changing the Business Landscape’ with Martin Kwame Awagah | Citi Business Festival On-Air Series,https://citinewsroom.com/2025/06/how-fintech-is-changing-the-business-landscape-with-martin-kwame-awagah-citi-business-festival-on-air-series/
‘Understanding The Digital Economy’ with Anthony Fesu | Citi Business Festival On-Air Series,https://citinewsroom.com/2025/06/understanding-the-digital-economy-with-anthony-fesu-citi-business-festival-on-air-series/
‘Basic Legal Education for SMEs’ with Jonathan Amable | Citi Business Festival On-Air Series Ep9,https://citinewsroom.com/2025/06/basic-legal-education-for-smes-with-jonathan-amable-citi-business-festival-on-air-series-ep9/
‘Understanding The Seed And Agri-Input Economy’ with Dr. Amos Rutherford Azinu | CBF On-Air Series,https://citinewsroom.com/2025/06/understanding-the-seed-and-agri-input-economy-with-dr-amos-rutherford-azinu-cbf-on-air-series/
A/R: Over 400 persons displaced in slum fire outbreak,https://citinewsroom.com/2025/07/a-r-over-400-persons-displaced-in-slum-fire-outbreak/
"EC lacks spine, reinforcing claims it’s unfit for purpose – Seth Acheampong",https://citinewsroom.com/2025/07/ec-lacks-spine-reinforcing-claims-its-unfit-for-purpose-seth-acheampong/
Bright Simons accuses E&P of misleading public over Black Volta Gold deal,https://citinewsroom.com/2025/07/bright-simons-accuses-ep-of-misleading-public-over-black-volta-gold-deal/
Ablekuma North: We won’t contest an election we’ve already won – NPP insists,https://citinewsroom.com/2025/07/ablekuma-north-we-wont-contest-an-election-weve-already-won-npp-insists/
Ablekuma North rerun will be fair and peaceful – NDC assures,https://citinewsroom.com/2025/07/ablekuma-north-rerun-will-be-fair-and-peaceful-ndc-assures/
Implement research findings to drive agricultural growth – John Dumelo urges,https://citinewsroom.com/2025/07/implement-research-findings-to-drive-agricultural-growth-john-dumelo-urges/
Deposit confidence rises as Savings and Loans sector records 30.6% growth in total assets,https://citinewsroom.com/2025/07/deposit-confidence-rises-as-savings-and-loans-sector-records-30-6-growth-in-total-assets/
New EXIM Bank board inaugurated to drive Ghana’s export economy,https://citinewsroom.com/2025/07/new-exim-bank-board-inaugurated-to-drive-ghanas-export-economy/
$367m IMF disbursement hits Bank of Ghana account,https://citinewsroom.com/2025/07/367m-imf-disbursement-hits-bank-of-ghana-account/
Former CalBank MD Frank Adu Jnr appointed Board Chair of NIB,https://citinewsroom.com/2025/07/former-calbank-md-frank-adu-jnr-appointed-board-chair-of-nib/
CBG nurturing future leaders with a flagship literacy initiative,https://citinewsroom.com/2025/07/cbg-nurturing-future-leaders-with-a-flagship-literacy-initiative/
GUSA to represent Ghana at 2025 FISU Games in Germany,https://citinewsroom.com/2025/07/gusa-to-represent-ghana-at-2025-fisu-games-in-germany/
"Over 200 gather in Accra as Bybit, Tether, and Crypto Ghana advance crypto education",https://citinewsroom.com/2025/07/over-200-gather-in-accra-as-bybit-tether-and-crypto-ghana-advance-crypto-education/
Ngleshie Amanfro: Suspected robbers kill 21-year-old MoMo vendor,https://citinewsroom.com/2025/07/ngleshie-amanfro-suspected-robbers-kill-21-year-old-momo-vendor/
Accra Mayor praises vendors for red line compliance,https://citinewsroom.com/2025/07/accra-mayor-praises-vendors-for-red-line-compliance/
GUSA to represent Ghana at 2025 FISU Games in Germany,https://citinewsroom.com/2025/07/gusa-to-represent-ghana-at-2025-fisu-games-in-germany/
Bawumia hails Kudus’ £55m move to Tottenham Hotspur,https://citinewsroom.com/2025/07/bawumia-hails-kudus-55m-move-to-tottenham-hotspur/
Channel One TV and Citi FM partner Absa for Absa Black Star Marathon,https://citinewsroom.com/2025/07/channel-one-tv-citi-fm-partners-absa-for-upcoming-black-star-marathon/
"I went to Saudi for trophies, not money – Mendy",https://citinewsroom.com/2025/06/i-went-to-saudi-for-trophies-not-money-mendy/
OKC Thunder defeat Indina Pacers in Game 7 to clinch first NBA title since 2008 relocation,https://citinewsroom.com/2025/06/okc-thunder-defeat-indina-pacers-in-game-7-to-clinch-first-nba-title-since-2008-relocation/
DopeNation drops third studio album GhanaPiano – The Album,https://citinewsroom.com/2025/07/dopenation-drops-third-studio-album-ghanapiano-the-album/
Addiself shines in Canada,https://citinewsroom.com/2025/07/addiself-shines-in-canada/
Meet BLR Boys: The collective redefining brotherhood through music,https://citinewsroom.com/2025/07/meet-blr-boys-the-collective-redefining-brotherhood-through-music/
"Sean ‘Diddy’ Combs convicted on prostitution counts, but cleared of more serious charges",https://citinewsroom.com/2025/07/sean-diddy-combs-convicted-on-prostitution-counts-but-cleared-of-more-serious-charges/
AbrahamTheLion & The MCD Crew release ‘Ghana mmo’ for National Day of Prayer and Thanksgiving,https://citinewsroom.com/2025/07/abrahamthelion-the-mcd-crew-release-ghana-mmo-for-national-day-of-prayer-and-thanksgiving/
"Trump praises ‘good English’ of Liberian president, prompting criticism across Africa",https://citinewsroom.com/2025/07/trump-praises-good-english-of-liberian-president-prompting-criticism-across-africa/
"Kenya’s president defiant, backs security forces after deadly protests",https://citinewsroom.com/2025/07/kenyas-president-defiant-backs-security-forces-after-deadly-protests/
Deadly new Russian drone attack hits Kyiv,https://citinewsroom.com/2025/07/deadly-new-russian-drone-attack-hits-kyiv/
"Ex-Bangladesh leader authorised deadly crackdown, leaked audio suggests",https://citinewsroom.com/2025/07/ex-bangladesh-leader-authorised-deadly-crackdown-leaked-audio-suggests/
Mahama extends condolences to Trump over deadly Texas floods,https://citinewsroom.com/2025/07/mahama-extends-condolences-to-trump-over-deadly-texas-floods/
China sidesteps question on TikTok after Trump says close to deal,https://citinewsroom.com/2025/07/china-sidesteps-question-on-tiktok-after-trump-says-close-to-deal/
Cybervergent selected as World Economic Forum’s 2025 technology pioneer company,https://citinewsroom.com/2025/07/cybervergent-selected-as-world-economic-forums-2025-technology-pioneer-company/
Samsung rolls out AI-centric security upgrades,https://citinewsroom.com/2025/07/samsung-rolls-out-ai-centric-security-upgrades/
Google expands Gemini AI for classrooms. But is Africa in the room?,https://citinewsroom.com/2025/06/google-expands-gemini-ai-tools-for-classrooms-bringing-new-features-for-educators-but-is-africa-in-the-room/
Real Quantum Dot Technology in Samsung QLED TVs: Delivering Exceptional Picture Quality,https://citinewsroom.com/2025/06/real-quantum-dot-technology-in-samsung-qled-tvs-delivering-exceptional-picture-quality/
Ghana Chamber of Health pledges support to operationalize Agenda 111,https://citinewsroom.com/2025/07/__trashed-24/
HIV surge signals failure in education and support systems – Mahama,https://citinewsroom.com/2025/07/hiv-surge-signals-failure-in-education-and-support-systems-mahama/
NHIA pays additional GH¢267m to hospitals,https://citinewsroom.com/2025/07/nhia-pays-additional-gh%c2%a2267m-to-hospitals/
Health Ministry pledges Catheterisation Lab for KATH following Doctor’s death,https://citinewsroom.com/2025/07/health-ministry-pledges-catheterisation-lab-for-kath-following-doctors-death/
Health Minister to address Parliament on Ghana’s COVID-19 surge today,https://citinewsroom.com/2025/07/health-minister-to-address-parliament-on-ghanas-covid-19-surge-today/
Keeping it agile in Ghana: How top tech is transforming modern work,https://citinewsroom.com/2025/07/keeping-it-agile-in-ghana-how-top-tech-is-transforming-modern-work-olayiwola-writes/
How scammers hack phones with links and images vrs How to outsmart them -Samuel Ackom writes,https://citinewsroom.com/2025/07/how-scammers-hack-phones-with-links-and-images-vrs-how-to-outsmart-them-samuel-ackom-writes/
Beyond Jubilee: Lessons from Ghana’s Oil and Gas Journey and Promise of Eban-Akoma Discovery -Ananpansah Bartholomew Abraham writes,https://citinewsroom.com/2025/07/beyond-jubilee-lessons-from-ghanas-oil-and-gas-journey-and-promise-of-eban-akoma-discovery-ananpansah-bartholomew-abraham-writes/
Beyond PPA Renegotiations and Tariff Tweaks: A review of the minority’s D-levy alternatives,https://citinewsroom.com/2025/07/beyond-ppa-renegotiations-and-tariff-tweaks-a-review-of-the-minoritys-d-levy-alternatives/
Walking Dead: More than just a hit TV series – Dr Kelvin Owusu writes,https://citinewsroom.com/2025/07/walking-dead-more-than-just-a-hit-tv-series-dr-kelvin-owusu-writes/
