Headline,Link
Mahama: GNFS officers involved in Class Journalist assault interdicted,https://citinewsroom.com/2026/01/mahama-gnfs-officers-involved-in-class-journalist-assault-interdicted/
118 NPP parliamentary candidates declare support for Bawumia,https://citinewsroom.com/2026/01/118-npp-parliamentary-candidates-declare-support-for-bawumia/
US pulls out of dozens of Global and UN Bodies in Trump directive,https://citinewsroom.com/2026/01/us-pulls-out-of-dozens-of-global-and-un-bodies-in-trump-directive/
Defeating NPP saved Ghana from becoming a laughing stock – Rashid Tanko,https://citinewsroom.com/2026/01/defeating-npp-saved-ghana-from-becoming-a-laughing-stock-rashid-tanko/
Ablakwa: Ghana’s exemption from U.S. Visa sanctions reflects strong diplomacy,https://citinewsroom.com/2026/01/ablakwa-ghanas-exemption-from-u-s-visa-sanctions-reflects-strong-diplomacy/
"One Million Coders hits 150,000 participants – Rashid Tanko",https://citinewsroom.com/2026/01/one-million-coders-hits-150000-participants-rashid-tanko/
Agogo Assembly Member dies in suspected suicide case,https://citinewsroom.com/2026/01/agogo-assembly-member-dies-in-suspected-suicide-case/
ICAG loses GTEC recognition after CEO defies order to drop “Dr” title,https://citinewsroom.com/2026/01/icag-loses-gtec-recognition-after-ceo-defies-order-to-drop-dr-title/
Prof Gordon: Wasteful water use worsening Accra shortages,https://citinewsroom.com/2026/01/prof-gordon-wasteful-water-use-worsening-accra-shortages/
Inside the Virginia Detention Centre holding Ofori-Atta,https://citinewsroom.com/2026/01/inside-the-virginia-detention-centre-holding-ofori-atta/
"GWL releases water rationing timetable for Teshie, Nungua and surrounding areas",https://citinewsroom.com/2026/01/gwl-releases-water-rationing-timetable-for-teshie-nungua-and-surrounding-areas/
Man murders girlfriend at Yamoah Nkwanta for denying him sex,https://citinewsroom.com/2026/01/man-murders-girlfriend-at-yamoah-nkwanta-for-denying-him-sex/
Kwasi Prempeh: Having too many ministers makes no sense,https://citinewsroom.com/2026/01/kwasi-prempeh-having-too-many-ministers-makes-no-sense/
GACL Board advances plans for Upper East Airport in Bolga,https://citinewsroom.com/2026/01/gacl-board-advances-plans-for-upper-east-airport-in-bolga/
AUDIO: Time and self-management | /w Maame Ekua Gaisey | #EffectiveLivingSeries Ep4,https://citinewsroom.com/2026/01/audio-time-and-self-management-w-maame-ekua-gaisey-effectivelivingseries-ep4/
AUDIO: What is your purpose? Here’s how to discover it | w/ Patrick Otieku-Boadu | #EffectiveLivingSeries,https://citinewsroom.com/2026/01/audio-what-is-your-purpose-heres-how-to-discover-it-w-patrick-otieku-boadu-effectivelivingseries/
AUDIO: Are we too Accra-focused? Are rural areas not getting the attention they deserve? | #CitiCBS,https://citinewsroom.com/2026/01/audio-are-we-too-accra-focused-are-rural-areas-not-getting-the-attention-they-deserve-citicbs/
AUDIO: Setting personal goals for 2026 w/ Michael Ohene-Effah | #EffectiveLiving Series Ep 2,https://citinewsroom.com/2026/01/audio-setting-personal-goals-for-2026-w-michael-ohene-effah-effectiveliving-series-ep-2/
118 NPP parliamentary candidates declare support for Bawumia,https://citinewsroom.com/2026/01/118-npp-parliamentary-candidates-declare-support-for-bawumia/
Mahama: GNFS officers involved in Class Journalist assault interdicted,https://citinewsroom.com/2026/01/mahama-gnfs-officers-involved-in-class-journalist-assault-interdicted/
Defeating NPP saved Ghana from becoming a laughing stock – Rashid Tanko,https://citinewsroom.com/2026/01/defeating-npp-saved-ghana-from-becoming-a-laughing-stock-rashid-tanko/
MPs should not be appointed ministers – Nii Moi Thompson backs CRC proposal,https://citinewsroom.com/2026/01/mps-should-not-be-appointed-ministers-nii-moi-thompson-backs-crc-proposal/
Barker-Vormawor: Five-year presidential term must be decided by referendum,https://citinewsroom.com/2026/01/barker-vormawor-five-year-presidential-term-should-go-to-referendum/
Domestic investment cannot thrive under high interest rates – Asantehene,https://citinewsroom.com/2026/01/domestic-investment-cannot-thrive-under-high-interest-rates-asantehene/
From Plantain to Tomatoes: How food prices drove Ghana’s 12-month inflation decline,https://citinewsroom.com/2026/01/from-plantain-to-tomatoes-how-food-prices-drove-ghanas-12-month-inflation-decline/
"Tree Crop Authority to tighten regulation, boost production in 2026",https://citinewsroom.com/2026/01/tree-crop-authority-to-tighten-regulation-boost-production-in-2026/
Lower fuel prices not enough for fare reduction yet – GPRTU,https://citinewsroom.com/2026/01/lower-fuel-prices-not-enough-for-fare-reduction-yet-gprtu/
GACL Board advances plans for Upper East Airport in Bolga,https://citinewsroom.com/2026/01/gacl-board-advances-plans-for-upper-east-airport-in-bolga/
Toobu supports Wa West District Assembly with road infrastructure funding,https://citinewsroom.com/2026/01/toobu-supports-wa-west-district-assembly-with-road-infrastructure-funding/
"Cargo truck overturns at Circle Interchange, causes traffic disruption",https://citinewsroom.com/2026/01/cargo-truck-overturns-at-circle-interchange-causes-traffic-disruption/
Failure to implement constitutional reforms weakening democracy – IDEG,https://citinewsroom.com/2026/01/failure-to-implement-constitutional-reforms-weakening-democracy-ideg/
"Savelugu-bound bus intercepted with over 1,000 rounds of ammunition",https://citinewsroom.com/2026/01/savelugu-bound-bus-intercepted-with-over-1000-rounds-of-ammunition/
Nii Moi Thompson: Set threshold for NDPC reforms to avoid disruption,https://citinewsroom.com/2026/01/nii-moi-thompson-set-threshold-for-ndpc-reforms-to-avoid-disruption/
"My 9-year-old daughter asked, ‘Daddy, are you a thief?’ – Nyantakyi on ‘Number 12’ impact",https://citinewsroom.com/2026/01/my-9-year-old-daughter-asked-daddy-are-you-a-thief-nyantakyi-recounts-impact-of-number-12/
Kwesi Nyantakyi: I was close to being CAF President,https://citinewsroom.com/2026/01/kwesi-nyantakyi-i-was-close-to-being-caf-president/
Ghana’s Mohammed Salisu to miss 2026 World Cup after ACL injury,https://citinewsroom.com/2026/01/ghanas-mohammed-salisu-to-miss-2026-world-cup-after-acl-injury/
Man United coach Ruben Amorim sacked,https://citinewsroom.com/2026/01/man-united-coach-ruben-amorim-sacked/
"AFCON Day 7: Cameroon, Ivory Coast in stalemate as Algeria reach last 16",https://citinewsroom.com/2025/12/afcon-day-7-cameroon-ivory-coast-in-stalemate-as-algeria-reach-last-16/
Ghanaian film producer urges diaspora to invest in Africa’s creative economy,https://citinewsroom.com/2026/01/ghanaian-film-producer-urges-diaspora-to-invest-in-africas-creative-economy/
‘Wealth is built between 7pm to 8am’ – Mike Ohene-Effah on goal setting,https://citinewsroom.com/2026/01/wealth-is-built-between-7pm-to-8am-mike-ohene-effah-on-goal-setting/
Savannah Foto Festival puts Northern Ghana in global spotlight,https://citinewsroom.com/2026/01/savannah-foto-festival-puts-northern-ghana-in-global-spotlight/
Sarkodie: I knew Ebo Noah was creating content from day one,https://citinewsroom.com/2026/01/sarkodie-i-knew-ebo-noah-was-creating-content-from-day-one/
Nkyinkyim Band set to rekindle Ghana’s Hi-life spirit at Old Skool Night,https://citinewsroom.com/2026/01/nkyinkyim-band-set-to-rekindle-ghanas-hi-life-spirit-at-old-skool-night/
Venezuela’s interim leader sacks general in charge of Maduro’s guard,https://citinewsroom.com/2026/01/venezuelas-interim-leader-sacks-general-in-charge-of-maduros-guard/
US pulls out of dozens of Global and UN Bodies in Trump directive,https://citinewsroom.com/2026/01/us-pulls-out-of-dozens-of-global-and-un-bodies-in-trump-directive/
"Plot to kill Burkina Faso leader foiled, says junta",https://citinewsroom.com/2026/01/plot-to-kill-burkina-faso-leader-foiled-says-junta/
"US imposes $15000 visa bonds on Nigerians, others applying for business, tourist visas",https://citinewsroom.com/2026/01/us-imposes-15000-visa-bonds-on-nigerians-others-applying-for-business-tourist-visas/
"Trump is discussing options to acquire Greenland, including use of military – White House",https://citinewsroom.com/2026/01/trump-is-discussing-options-to-acquire-greenland-including-use-of-military-white-house/
Samsung unveils ‘world’s largest’ TV of its kind — a whopping 130 inches,https://citinewsroom.com/2026/01/samsung-unveils-worlds-largest-tv-of-its-kind-a-whopping-130-inches/
Samsung to double AI mobile devices to 800 million units this year,https://citinewsroom.com/2026/01/samsung-to-double-ai-mobile-devices-to-800-million-units-this-year/
Why IUX is one of the Best Forex Brokers for beginners in 2026,https://citinewsroom.com/2026/01/why-iux-is-one-of-the-best-forex-brokers-for-beginners-in-2026/
Ghanaian girls excel at Wuzhen AI competition,https://citinewsroom.com/2026/01/ghanaian-girls-excel-at-wuzhen-ai-competition/
China issues draft rules to regulate AI with human-like interaction,https://citinewsroom.com/2025/12/china-issues-draft-rules-to-regulate-ai-with-human-like-interaction/
Ashanti Region: Health officials alarmed by rising HIV infections,https://citinewsroom.com/2026/01/ashanti-region-health-officials-alarmed-by-rising-hiv-infections/
Ashanti Health Directorate strengthens measures against maternal deaths,https://citinewsroom.com/2026/01/ashanti-health-directorate-strengthens-measures-against-maternal-deaths/
NACOC: Raids on drug dens to be sustained nationwide,https://citinewsroom.com/2025/12/nacoc-raids-on-drug-dens-to-be-sustained-nationwide/
Stigmatisation discourages people from HIV testing – Gold Fields Ghana,https://citinewsroom.com/2025/12/stigmatisation-discourages-people-from-hiv-testing-gold-fields-ghana/
"Akandoh praises doctors, nurses, frontline staff for sustaining healthcare delivery",https://citinewsroom.com/2025/12/akandoh-praises-doctors-nurses-frontline-staff-for-sustaining-healthcare-delivery/
We need to be protected: A journalist’s cry against the normalisation of assaults in Ghana,https://citinewsroom.com/2026/01/we-need-to-be-protected-a-journalists-cry-against-the-normalisation-of-assaults-in-ghana/
When Bretton Woods meets novelty: Why GoldBod disturbs orthodoxy – and why Ghana must run it impeccably,https://citinewsroom.com/2026/01/when-bretton-woods-meets-novelty-why-goldbod-disturbs-orthodoxy-and-why-ghana-must-run-it-impeccably/
"Being a former executive is like death, everyone will taste it -Godwin Ako Gunn writes",https://citinewsroom.com/2026/01/being-a-former-executive-is-like-death-everyone-will-taste-it-godwin-ako-gunn-writes/
From Inauguration to Reality: Mahama’s First 365 Days – Akosua Otchere writes,https://citinewsroom.com/2026/01/from-inauguration-to-reality-mahamas-first-365-days-akosua-otchere-writes/
"Status of commission, committee reports under resetting era – Naa Kwaamah Siaw-Marfo writes",https://citinewsroom.com/2026/01/status-of-commission-committee-reports-under-resetting-era-naa-kwaamah-siaw-marfo-writes/
