Headline,Link
Chief Justice Gertrude Torkornoo hit with two more removal petitions,https://citinewsroom.com/2025/04/chief-justice-gertrude-torkornoo-hit-with-two-more-removal-petitions/
NDC’s reset agenda is a “bloodless coup” – Akosua Manu,https://citinewsroom.com/2025/04/ndcs-reset-agenda-is-a-bloodless-coup-akosua-manu/
TTH Doctors defend colleague after clash with Akandoh,https://citinewsroom.com/2025/04/tth-doctors-defend-colleague-after-clash-with-akandoh/
Minority condemns “unlawful” dismissal of Tamale Teaching Hospital CEO,https://citinewsroom.com/2025/04/minority-condemns-unlawful-dismissal-of-tamale-teaching-hospital-ceo/
Secrecy in judicial removal process protects dignity — Deputy AG,https://citinewsroom.com/2025/04/secrecy-in-judicial-removal-process-protects-dignity-deputy-ag/
CJ’s suspension part of a plan to capture judiciary – Akosua Manu,https://citinewsroom.com/2025/04/cjs-suspension-part-of-a-plan-to-capture-judiciary-akosua-manu/
"CJ suspension not unconstitutional, no court order blocks it – Srem-Sai",https://citinewsroom.com/2025/04/cj-suspension-not-unconstitutional-no-court-order-blocks-it-srem-sai/
Energy Sector is Ghana’s biggest economic risk – Ato Forson,https://citinewsroom.com/2025/04/energy-sector-is-ghanas-biggest-economic-risk-ato-forson/
Galamsey: Forestry Commission vows to sanction staff aiding illegal miners,https://citinewsroom.com/2025/04/galamsey-forestry-commission-vows-to-sanction-staff-aiding-illegal-miners/
Make CJ removal findings public – CDD Boss demands,https://citinewsroom.com/2025/04/make-cj-removal-findings-public-cdd-boss-demands/
Judicial system won’t collapse over CJ’s suspension – Prof. Appiagyei-Atua,https://citinewsroom.com/2025/04/judicial-system-wont-collapse-over-cjs-suspension-prof-appiagyei-atua/
Govt’s petroleum revenue likely to take a hit amidst oil price plunge,https://citinewsroom.com/2025/04/govts-petroleum-revenue-likely-to-take-a-hit-amidst-oil-price-plunge/
CJ’s suspension a threat to justice – Sammi Awuku,https://citinewsroom.com/2025/04/cjs-suspension-a-threat-to-justice-sammi-awuku/
Tetteh Chaie appointed Deputy CEO of Public Procurement Authority,https://citinewsroom.com/2025/04/tetteh-chaie-appointed-deputy-ceo-of-public-procurement-authority/
Amanase accident: Pregnant victim loses baby,https://citinewsroom.com/2025/04/amanase-accident-pregnant-victim-loses-baby/
"Eyewitness News, Monday, 10th March, 2025",https://citinewsroom.com/2025/03/eyewitness-news-monday-10th-march-2025/
"Citi Breakfast Show, Monday, 10th March, 2025",https://citinewsroom.com/2025/03/citi-breakfast-show-monday-10th-march-2025/
Heritage on-Air Series | Celebrating Iconic Ghanaian Music | Ep5,https://citinewsroom.com/2025/03/heritage-on-air-series-the-story-of-ghanaian-music-through-the-years-ep5/
"FamLife | Ghanaian Marriage Paradigms | Saturday, 8th March, 2025",https://citinewsroom.com/2025/03/famlife-ghanaian-marriage-paradigms-saturday-8th-march-2025/
NDC’s reset agenda is a “bloodless coup” – Akosua Manu,https://citinewsroom.com/2025/04/ndcs-reset-agenda-is-a-bloodless-coup-akosua-manu/
CJ’s suspension part of a plan to capture judiciary – Akosua Manu,https://citinewsroom.com/2025/04/cjs-suspension-part-of-a-plan-to-capture-judiciary-akosua-manu/
"CJ suspension not unconstitutional, no court order blocks it – Srem-Sai",https://citinewsroom.com/2025/04/cj-suspension-not-unconstitutional-no-court-order-blocks-it-srem-sai/
Make CJ removal findings public – CDD Boss demands,https://citinewsroom.com/2025/04/make-cj-removal-findings-public-cdd-boss-demands/
CJ’s suspension a threat to justice – Sammi Awuku,https://citinewsroom.com/2025/04/cjs-suspension-a-threat-to-justice-sammi-awuku/
Govt urged to boost agriculture amid global trade uncertainties,https://citinewsroom.com/2025/04/govt-urged-to-boost-agriculture-amid-global-trade-uncertainties/
Govt’s petroleum revenue likely to take a hit amidst oil price plunge,https://citinewsroom.com/2025/04/govts-petroleum-revenue-likely-to-take-a-hit-amidst-oil-price-plunge/
Energy Sector is Ghana’s biggest economic risk – Ato Forson,https://citinewsroom.com/2025/04/energy-sector-is-ghanas-biggest-economic-risk-ato-forson/
Kwahu Business Forum: DBG reaffirms support for private sector,https://citinewsroom.com/2025/04/kwahu-business-forum-dbg-reaffirms-support-for-private-sector/
IMF urges tough reforms for countries facing debt distress,https://citinewsroom.com/2025/04/imf-urges-tough-reforms-for-countries-facing-debt-distress/
"Absa Bank empowers Apirede students with tools, financial literacy training",https://citinewsroom.com/2025/04/absa-bank-empowers-apirede-students-with-tools-financial-literacy-training/
Justice Baffoe-Bonnie to act as CJ following Torkornoo’s suspension,https://citinewsroom.com/2025/04/justice-baffoe-bonnie-to-act-as-cj-following-torkornoos-suspension/
Generational Rights Protection Society to protest on April 28 over galamsey,https://citinewsroom.com/2025/04/generational-rights-protection-society-to-protest-on-april-28-over-galamsey/
"Mahama: Ghana to offer 1,000 ECOWAS scholarships",https://citinewsroom.com/2025/04/mahama-ghana-to-offer-1000-ecowas-scholarships/
The Frema foundation spends Easter with “assurance of hope for the needy” orphanage,https://citinewsroom.com/2025/04/the-frema-foundation-spends-easter-with-assurance-of-hope-for-the-needy-orphanage/
Ahmed Shaib represents Ghana at African weightlifting congress in Mauritius,https://citinewsroom.com/2025/04/ahmed-shaib-represents-ghana-at-african-weightlifting-congress-in-mauritius/
Hohoe Utd demand replacement of referee over potential bias ahead of crucial DOL match,https://citinewsroom.com/2025/04/hohoe-utd-demand-replacement-of-referee-over-potential-bias-ahead-of-crucial-dol-match/
Remontada! – Bellingham reveals the word fueling Real Madrid’s belief ahead of Arsenal clash,https://citinewsroom.com/2025/04/remontada-bellingham-reveals-the-word-fueling-real-madrids-belief-ahead-of-arsenal-clash/
Accept criticisms in good faith – Kofi Adams advises Black Stars,https://citinewsroom.com/2025/04/accept-criticisms-in-good-faith-kofi-adams-advises-black-stars/
No need to release Black Stars budget now – Kofi Adams,https://citinewsroom.com/2025/04/no-need-to-release-black-stars-budget-now-kofi-adams/
Highlife star Kofi Eiphos stars in Jesus Christ’s crucifixion play in Germany,https://citinewsroom.com/2025/04/highlife-star-kofi-eiphos-stars-in-jesus-christs-crucifixion-play-in-germany/
“I find peace in Ghana” – Co-founder of Tribe Meets shares deep cultural connection,https://citinewsroom.com/2025/04/__trashed-4/
AratheJay Joins M.anifest for Spotify Africa’s “Jollof & Jama” Campaign,https://citinewsroom.com/2025/04/arathejay-joins-m-anifest-for-spotify-africas-jollof-jama-campaign/
Joseph Matthew performs ‘Love In You’ with wife at expensive traditional wedding,https://citinewsroom.com/2025/04/joseph-matthew-performs-love-in-you-with-wife-at-expensive-traditional-wedding/
The Ultimate Easter in Ghana 2025 event Lineup – Powered by Akwaaba UK,https://citinewsroom.com/2025/04/the-ultimate-easter-in-ghana-2025-event-lineup-powered-by-akwaaba-uk/
Trump says he has ‘no intention of firing’ Fed boss,https://citinewsroom.com/2025/04/trump-says-he-has-no-intention-of-firing-fed-boss/
Musk to reduce DOGE role after Tesla profits plunge,https://citinewsroom.com/2025/04/musk-to-reduce-doge-role-after-tesla-profits-plunge/
Pope Francis’s funeral scheduled for April 26,https://citinewsroom.com/2025/04/pope-franciss-funeral-scheduled-for-april-26/
Trump backs Hegseth after reports of second Signal chat on Yemen strikes,https://citinewsroom.com/2025/04/trump-backs-hegseth-after-reports-of-second-signal-chat-on-yemen-strikes/
Tributes pour in from world leaders after Pope Francis’ death,https://citinewsroom.com/2025/04/tributes-pour-in-from-world-leaders-after-pope-francis-death/
"Saying please, other polite words to ChatGPT costs millions of dollars – CEO",https://citinewsroom.com/2025/04/saying-please-to-chatgpt-other-polite-words-costs-millions-of-dollars-ceo/
What is the Signal messaging app and how secure is it?,https://citinewsroom.com/2025/04/what-is-the-signal-messaging-app-and-how-secure-is-it-2/
"US excludes smartphones, computers from Trump’s reciprocal tariffs",https://citinewsroom.com/2025/04/us-excludes-smartphones-computers-from-trumps-reciprocal-tariffs/
"Intel CEO invested in hundreds of Chinese companies, some with military ties",https://citinewsroom.com/2025/04/intel-ceo-invested-in-hundreds-of-chinese-companies-some-with-military-ties/
Elon Musk’s X to clamp down on parody accounts,https://citinewsroom.com/2025/04/elon-musks-x-to-clamp-down-on-parody-accounts/
TTH Doctors defend colleague after clash with Akandoh,https://citinewsroom.com/2025/04/tth-doctors-defend-colleague-after-clash-with-akandoh/
Minority condemns “unlawful” dismissal of Tamale Teaching Hospital CEO,https://citinewsroom.com/2025/04/minority-condemns-unlawful-dismissal-of-tamale-teaching-hospital-ceo/
‘Mahama Cares’ can be best solution to Ghana’s dialysis crisis – Seidu Agongo,https://citinewsroom.com/2025/04/mahama-cares-can-be-best-solution-to-ghanas-dialysis-crisis-seidu-agongo/
Akandoh makes surprise visit to TTH over negligence claims,https://citinewsroom.com/2025/04/akandoh-makes-surprise-visit-to-tth-over-negligence-claims/
Women and Girls Bleed Too: Shining light on haemophilia and bleeding disorders in women and girls,https://citinewsroom.com/2025/04/women-and-girls-bleed-too-shining-light-on-haemophilia-and-bleeding-disorders-in-women-and-girls/
A Mountain Moment to Remember: Mahama and Akufo-Addo’s historic Easter handshake that inspires a nation,https://citinewsroom.com/2025/04/a-mountain-moment-to-remember-mahama-and-akufo-addos-historic-easter-handshake-that-inspires-a-nation/
Is the Vatican ready for an African Pope? Ghana’s Turkson among leading contenders,https://citinewsroom.com/2025/04/is-the-vatican-ready-for-an-african-pope-ghanas-turkson-among-leading-contenders/
Bank of Ghana’s recapitalisation and why government must tread cautiously – Nii Larte Lartey writes,https://citinewsroom.com/2025/04/bank-of-ghanas-recapitalisation-and-why-government-must-tread-cautiously-nii-larte-lartey-writes/
"The Legacy, Popularity, and Future of Pope Francis: A Global Perspective",https://citinewsroom.com/2025/04/the-legacy-popularity-and-future-of-pope-francis-a-global-perspective/
Pope Francis: Why his papacy mattered for Africa – and for the world’s poor and marginalised,https://citinewsroom.com/2025/04/pope-francis-why-his-papacy-mattered-for-africa-and-for-the-worlds-poor-and-marginalised/
