Headline,Link
Gyakye Quayson acquitted and discharged by High Court,https://citinewsroom.com/2025/04/gyakye-quayson-acquitted-and-discharged-by-high-court/
Businesses largely not interested in consumer protection – CUTS Int’l,https://citinewsroom.com/2025/04/businesses-largely-not-interested-in-consumer-protection-cuts-intl/
"Post-retirement extensions breed political loyalty, stagnation — Amadu Sorogho",https://citinewsroom.com/2025/04/post-retirement-extensions-breed-political-loyalty-stagnation-amadu-sorogho/
No contract approvals without commencement authorisation – Ato Forson,https://citinewsroom.com/2025/04/no-contract-approvals-without-commencement-authorisation-ato-forson/
Suspicious flights: Kwakye Ofosu told barefaced lies – Akosua Manu,https://citinewsroom.com/2025/04/suspicious-flights-kwakye-ofosu-told-barefaced-lies-akosua-manu/
Only 37% of Ghanaian businesses use digital payments – Report,https://citinewsroom.com/2025/04/only-37-of-ghanaian-businesses-use-digital-payments-report/
SIM Card re-registration goes digital in June to eliminate queues – Sam George,https://citinewsroom.com/2025/04/sim-card-re-registration-goes-digital-in-june-to-eliminate-queues-sam-george/
"Galamsey fight is a lifelong battle, timelines unnecessary – Kwakye Ofosu",https://citinewsroom.com/2025/04/galamsey-fight-is-a-lifelong-battle-timelines-unnecessary-kwakye-ofosu/
Auditor General embarks on nationwide payroll audit,https://citinewsroom.com/2025/04/auditor-general-embarks-on-nationwide-payroll-audit/
NIB awaiting Bagbin’s approval to interrogate Ntim Fordjour – Kwakye Ofosu,https://citinewsroom.com/2025/04/nib-awaiting-bagbins-approval-to-interrogate-ntim-fordjour-kwakye-ofosu/
Tread cautiously – Organized Labour warns govt on post-retirement contract ban,https://citinewsroom.com/2025/04/tread-cautiously-organized-labour-warns-govt-on-post-retirement-contract-ban/
Gov’t will not fund National Cathedral – Kwakye Ofosu,https://citinewsroom.com/2025/04/govt-will-not-fund-national-cathedral-kwakye-ofosu/
"GRA surpasses Q1 tax revenue target, collects GH₵41bn",https://citinewsroom.com/2025/04/gra-surpasses-q1-tax-revenue-target-collects-gh%e2%82%b541bn/
Adabraka Robbery: Residents welcome increased Police presence,https://citinewsroom.com/2025/04/adabraka-robbery-residents-welcome-increased-police-presence/
"GACL threatens to sue media, individuals over ‘false’ drug claims",https://citinewsroom.com/2025/04/gacl-threatens-to-sue-media-individuals-over-false-drug-claims/
"Eyewitness News, Monday, 10th March, 2025",https://citinewsroom.com/2025/03/eyewitness-news-monday-10th-march-2025/
"Citi Breakfast Show, Monday, 10th March, 2025",https://citinewsroom.com/2025/03/citi-breakfast-show-monday-10th-march-2025/
Heritage on-Air Series | Celebrating Iconic Ghanaian Music | Ep5,https://citinewsroom.com/2025/03/heritage-on-air-series-the-story-of-ghanaian-music-through-the-years-ep5/
"FamLife | Ghanaian Marriage Paradigms | Saturday, 8th March, 2025",https://citinewsroom.com/2025/03/famlife-ghanaian-marriage-paradigms-saturday-8th-march-2025/
"Post-retirement extensions breed political loyalty, stagnation — Amadu Sorogho",https://citinewsroom.com/2025/04/post-retirement-extensions-breed-political-loyalty-stagnation-amadu-sorogho/
Suspicious flights: Kwakye Ofosu told barefaced lies – Akosua Manu,https://citinewsroom.com/2025/04/suspicious-flights-kwakye-ofosu-told-barefaced-lies-akosua-manu/
"Galamsey fight is a lifelong battle, timelines unnecessary – Kwakye Ofosu",https://citinewsroom.com/2025/04/galamsey-fight-is-a-lifelong-battle-timelines-unnecessary-kwakye-ofosu/
Gov’t will not fund National Cathedral – Kwakye Ofosu,https://citinewsroom.com/2025/04/govt-will-not-fund-national-cathedral-kwakye-ofosu/
Auditor General embarks on nationwide payroll audit,https://citinewsroom.com/2025/04/auditor-general-embarks-on-nationwide-payroll-audit/
Businesses largely not interested in consumer protection – CUTS Int’l,https://citinewsroom.com/2025/04/businesses-largely-not-interested-in-consumer-protection-cuts-intl/
No contract approvals without commencement authorisation – Ato Forson,https://citinewsroom.com/2025/04/no-contract-approvals-without-commencement-authorisation-ato-forson/
Ghana risks losing $500m in revenue from domestic lithium refining – NRGI warns,https://citinewsroom.com/2025/04/ghana-risks-losing-500m-in-revenue-from-domestic-lithium-refining-nrgi-warns/
Only 37% of Ghanaian businesses use digital payments – Report,https://citinewsroom.com/2025/04/only-37-of-ghanaian-businesses-use-digital-payments-report/
SIM Card re-registration goes digital in June to eliminate queues – Sam George,https://citinewsroom.com/2025/04/sim-card-re-registration-goes-digital-in-june-to-eliminate-queues-sam-george/
We don’t engage services of languards – Zoomlion Ghana Ltd,https://citinewsroom.com/2025/04/we-dont-engage-services-of-languards-zoomlion-ghana-ltd/
AFAG calls for bipartisan parliamentary probe into drug trafficking claims,https://citinewsroom.com/2025/04/afag-calls-for-bipartisan-parliamentary-probe-into-drug-trafficking-claims/
Govt holds key to lasting peace in Bawku – Ex-EPA Boss,https://citinewsroom.com/2025/04/govt-holds-key-to-lasting-peace-in-bawku-ex-epa-boss/
EU pledges support to tackle water scarcity in Northern Region,https://citinewsroom.com/2025/04/eu-pledges-support-to-tackle-water-scarcity-in-northern-region/
UE/R: Police hunt suspect in GH¢2.8m job scam,https://citinewsroom.com/2025/04/ue-r-police-hunt-suspect-in-gh%c2%a22-8m-job-scam/
Bologna wonder goal stops Napoli closing gap on Inter,https://citinewsroom.com/2025/04/bologna-wonder-goal-stops-napoli-closing-gap-on-inter/
Paris Saint-Germain wins 13th French title,https://citinewsroom.com/2025/04/paris-saint-germain-wins-13th-french-title/
"Ghana Sports Conference set for July 31, puts spotlight on future of sports",https://citinewsroom.com/2025/04/ghana-sports-conference-set-for-july-31-puts-spotlight-on-future-of-sports/
Chelsea boost top-four hopes to pile pressure on Postecoglou,https://citinewsroom.com/2025/04/chelsea-boost-top-four-hopes-to-pile-pressure-on-postecoglou/
Mourinho accused of ‘physically attacking’ Galatasaray boss,https://citinewsroom.com/2025/04/mourinho-accused-of-physically-attacking-galatasaray-boss/
Yaw Darling nominated for Unsung Artiste of the Year at the 26th TGMAs,https://citinewsroom.com/2025/04/yaw-darling-nominated-for-unsung-artiste-of-the-year-at-the-26th-tgmas/
King Paluta can’t win Artiste of the Year – Ricky Tenneson,https://citinewsroom.com/2025/04/king-paluta-cant-win-artiste-of-the-year-ricky-tenneson/
Music pundit criticises Black Sherif’s ‘Iron Boy’ for failing to honour Amakye Dede,https://citinewsroom.com/2025/04/music-pundit-criticises-black-sherifs-iron-boy-for-failing-to-honour-amakye-dede/
Max TV apologises to Cina Soul over harsh remarks,https://citinewsroom.com/2025/04/max-tv-apologises-to-cina-soul-over-harsh-remarks/
Black Sherif releases highly anticipated sophomore album ‘Iron Boy’,https://citinewsroom.com/2025/04/black-sherif-releases-highly-anticipated-sophomore-album-iron-boy/
South Sudan to admit man deported by US after blanket visa ban,https://citinewsroom.com/2025/04/south-sudan-to-admit-man-deported-by-us-after-blanket-visa-ban/
Dominican Republic nightclub collapse kills 98,https://citinewsroom.com/2025/04/dominican-republic-nightclub-collapse-kills-98/
Algeria closes airspace to Mali aircraft as drone row escalates,https://citinewsroom.com/2025/04/algeria-closes-airspace-to-mali-aircraft-as-drone-row-escalates/
Trump threatens new 50% tariffs on China,https://citinewsroom.com/2025/04/trump-threatens-new-50-tariffs-on-china/
Ayorkor Botchwey urges Commonwealth unity over tariff disruptions,https://citinewsroom.com/2025/04/ayorkor-botchwey-urges-commonwealth-unity-over-tariff-disruptions/
Elon Musk’s X to clamp down on parody accounts,https://citinewsroom.com/2025/04/elon-musks-x-to-clamp-down-on-parody-accounts/
Tesla sales plunge after Elon Musk backlash,https://citinewsroom.com/2025/04/tesla-sales-plunge-after-elon-musk-backlash/
Women in tech advocate for greater investment in female education,https://citinewsroom.com/2025/03/women-in-tech-advocate-for-greater-investment-in-female-education/
Elon Musk sells X to his own xAI for $33 billion in all-stock deal,https://citinewsroom.com/2025/03/elon-musk-sells-x-to-his-own-xai-for-33-billion-in-all-stock-deal/
"Cannes Lions’ ‘See It, Be It’ Debuts in Ghana: A New Chapter for Women in Creativity",https://citinewsroom.com/2025/03/cannes-lions-see-it-be-it-debuts-in-ghana-a-new-chapter-for-women-in-creativity/
Private health facilities justify decision to suspend services over NHIS arrears,https://citinewsroom.com/2025/04/private-health-facilities-justify-decision-to-suspend-services-over-nhis-arrears/
Akandoh vows tighter port checks after GH₵20m opioid disposal,https://citinewsroom.com/2025/04/akandoh-vows-tighter-port-checks-after-gh%e2%82%b520m-opioid-disposal/
Environmental health officers demand urgent action over Cholera deaths,https://citinewsroom.com/2025/04/environmental-health-officers-demand-urgent-action-over-cholera-deaths/
Dr. Sodzi-Tettey leads charge for homegrown vaccine research and manufacturing,https://citinewsroom.com/2025/04/dr-sodzi-tettey-leads-charge-for-homegrown-vaccine-research-and-manufacturing/
Pharmaceutical Society calls for strict monitoring to curb opioids abuse,https://citinewsroom.com/2025/03/pharmaceutical-society-calls-for-strict-monitoring-to-curb-opioids-abuse/
Betting Tax in Ghana: Has it been properly abolished or a legislative drafting error?,https://citinewsroom.com/2025/04/betting-tax-in-ghana-has-it-been-properly-abolished-or-a-legislative-drafting-error/
"Ghana’s healthcare system is failing, except for the powerful – Naa Kwaamah Siaw-Marfo writes",https://citinewsroom.com/2025/04/ghanas-healthcare-system-is-failing-except-for-the-powerful-naa-kwaamah-siaw-marfo-writes/
Ghana’s Sustainable Future Demands Revocation of LI 2462 not an amendment,https://citinewsroom.com/2025/04/ghanas-sustainable-future-demands-revocation-of-li-2462-not-an-amendment/
Ghana’s e-levy: 3 lessons from the abolished mobile money tax,https://citinewsroom.com/2025/04/ghanas-e-levy-3-lessons-from-the-abolished-mobile-money-tax/
Flooding in Ghana: A call for action amid political promises and environmental challenges – Samuel Ackom writes,https://citinewsroom.com/2025/04/flooding-in-ghana-a-call-for-action-amid-political-promises-and-environmental-challenges-samuel-ackom-writes/
