Headline,Link
Aggrieved teachers suspend picketing after GES pledges salary payment,https://citinewsroom.com/2025/06/aggrieved-teachers-suspend-picketing-after-ges-pledges-salary-payment/
US Embassy tightens student visa checks with enhanced social media vetting,https://citinewsroom.com/2025/06/us-embassy-tightens-student-visa-checks-with-enhanced-social-media-vetting/
"Central Region: Three students, taxi driver die in Winneba crash",https://citinewsroom.com/2025/06/central-region-three-students-taxi-driver-die-in-winneba-crash/
"Party structure is key, not ego-driven endorsements – Afadjato South MP",https://citinewsroom.com/2025/06/party-structure-is-key-not-ego-driven-endorsements-afadjato-south-mp/
Bawumia’s endorsement by former MMDCEs doesn’t guarantee votes – Adomako Kissi,https://citinewsroom.com/2025/06/bawumias-endorsement-by-former-mmdces-doesnt-guarantee-votes-adomako-kissi/
Women’s Development Bank critical to closing credit gap for female-led businesses – BoG,https://citinewsroom.com/2025/06/womens-development-bank-critical-to-closing-credit-gap-for-female-led-businesses-bog/
GES seeks clearance extension to pay picketing teachers,https://citinewsroom.com/2025/06/ges-seeks-clearance-extension-to-pay-picketing-teachers/
"ActionAid Ghana urges tighter controls on illicit financial flows, better use of external loans",https://citinewsroom.com/2025/06/actionaid-ghana-urges-tighter-controls-on-illicit-financial-flows-better-use-of-external-loans/
Exim Bank in talks with Citi FM and Channel One TV to partner agro-processing fair,https://citinewsroom.com/2025/06/exim-bank-to-partner-citi-fm-and-channel-one-tv-for-agro-processing-fair/
GJA election will be credible and fair – Committee Chair assures,https://citinewsroom.com/2025/06/gja-election-will-be-credible-and-fair-committee-chair-assures/
NPP leadership not behind Bawumia endorsements – Haruna Mohammed,https://citinewsroom.com/2025/06/npp-leadership-not-behind-bawumia-endorsements-haruna-mohammed/
Private interests undermining redevelopment of Tema Children’s Park – Former Mayor,https://citinewsroom.com/2025/06/private-interests-undermining-redevelopment-of-tema-childrens-park-former-mayor/
John Jinapor inaugurates Governing Board of VRA,https://citinewsroom.com/2025/06/john-jinapor-inaugurates-governing-board-of-vra/
Iran signals readiness for ceasefire as Trump announces agreement,https://citinewsroom.com/2025/06/iran-signals-readiness-for-ceasefire-as-trump-announces-agreement/
Be careful what you say – Patrick Boamah cautions NPP members,https://citinewsroom.com/2025/06/be-careful-what-you-say-patrick-boamah-cautions-npp-members/
‘Basic Legal Education for SMEs’ with Jonathan Amable | Citi Business Festival On-Air Series Ep9,https://citinewsroom.com/2025/06/basic-legal-education-for-smes-with-jonathan-amable-citi-business-festival-on-air-series-ep9/
‘Understanding The Seed And Agri-Input Economy’ with Dr. Amos Rutherford Azinu | CBF On-Air Series,https://citinewsroom.com/2025/06/understanding-the-seed-and-agri-input-economy-with-dr-amos-rutherford-azinu-cbf-on-air-series/
Citi Breakfast Show: GPRTU suspends planned strike over GHȼ1 fuel levy rollout,https://citinewsroom.com/2025/06/citi-breakfast-show-gprtu-suspends-planned-strike-over-gh%c8%bc1-fuel-levy-rollout/
Citi Breakfast Show: Nurses intensify strike! How is healthcare being affected? | 10/06/25,https://citinewsroom.com/2025/06/citi-breakfast-show-nurses-intensify-strike-how-is-healthcare-being-affected-10-06-25/
"Party structure is key, not ego-driven endorsements – Afadjato South MP",https://citinewsroom.com/2025/06/party-structure-is-key-not-ego-driven-endorsements-afadjato-south-mp/
Bawumia’s endorsement by former MMDCEs doesn’t guarantee votes – Adomako Kissi,https://citinewsroom.com/2025/06/bawumias-endorsement-by-former-mmdces-doesnt-guarantee-votes-adomako-kissi/
GJA election will be credible and fair – Committee Chair assures,https://citinewsroom.com/2025/06/gja-election-will-be-credible-and-fair-committee-chair-assures/
NPP leadership not behind Bawumia endorsements – Haruna Mohammed,https://citinewsroom.com/2025/06/npp-leadership-not-behind-bawumia-endorsements-haruna-mohammed/
Be careful what you say – Patrick Boamah cautions NPP members,https://citinewsroom.com/2025/06/be-careful-what-you-say-patrick-boamah-cautions-npp-members/
2025 CBF: Fintech unlocks business growth – SMEs told,https://citinewsroom.com/2025/06/2025-cbf-fintech-unlocks-business-growth-smes-told/
Women’s Development Bank critical to closing credit gap for female-led businesses – BoG,https://citinewsroom.com/2025/06/womens-development-bank-critical-to-closing-credit-gap-for-female-led-businesses-bog/
"ActionAid Ghana urges tighter controls on illicit financial flows, better use of external loans",https://citinewsroom.com/2025/06/actionaid-ghana-urges-tighter-controls-on-illicit-financial-flows-better-use-of-external-loans/
Exim Bank in talks with Citi FM and Channel One TV to partner agro-processing fair,https://citinewsroom.com/2025/06/exim-bank-to-partner-citi-fm-and-channel-one-tv-for-agro-processing-fair/
"Digital integration key to market access, finance – Absa Bank Ghana",https://citinewsroom.com/2025/06/digital-integration-key-to-market-access-finance-absa-bank-ghana/
Prioritise teacher development in STEM – Expert urges govt,https://citinewsroom.com/2025/06/prioritise-teacher-development-in-stem-expert-urges-govt/
Inside the quiet meetings steering Ghana’s governance transformation,https://citinewsroom.com/2025/06/inside-the-quiet-meetings-steering-ghanas-governance-transformation/
PMI Crowned Champions of the 2025 GMA Group CEO’s Cup,https://citinewsroom.com/2025/06/pmi-crowned-champions-of-the-2025-gma-group-ceos-cup/
Osu Mantse supports 2025 Absa Black Star marathon,https://citinewsroom.com/2025/06/osu-mantse-supports-2025-absa-black-star-marathon/
2025 Bankers Football League launched to foster unity and wellbeing in the banking sector,https://citinewsroom.com/2025/06/2025-bankers-football-league-launched-to-foster-unity-and-wellbeing-in-the-banking-sector/
OKC Thunder defeat Indina Pacers in Game 7 to clinch first NBA title since 2008 relocation,https://citinewsroom.com/2025/06/okc-thunder-defeat-indina-pacers-in-game-7-to-clinch-first-nba-title-since-2008-relocation/
NBPA x UM6P One Court Africa Event kicks off in Marrakech,https://citinewsroom.com/2025/06/nbpa-x-um6p-one-court-africa-event-kicks-off-in-marrakech/
Liverpool host Bournemouth to open Premier League season,https://citinewsroom.com/2025/06/liverpool-host-bournemouth-to-open-premier-league-season/
"TECNO, Becomes Official Global Partner For TotalEnergies CAF AFCON 2025 & 2027",https://citinewsroom.com/2025/06/tecno-becomes-official-global-partner-for-totalenergies-caf-afcon-2025-2027/
Tottenham return is unrealistic – Pochettino,https://citinewsroom.com/2025/06/tottenham-return-is-unrealistic-pochettino/
Sparqlyn wins 2025 APLA African Best Ghanaian Musician Award,https://citinewsroom.com/2025/06/sparqlyn-wins-2025-apla-african-best-ghanaian-musician-award/
Juneteenth parade in Ghana unites African diaspora and locals in celebration of freedom,https://citinewsroom.com/2025/06/juneteenth-parade-in-ghana-unites-african-diaspora-and-locals-in-celebration-of-freedom/
"GTA, AAAG deepen diaspora ties through Juneteenth and Panafest collaborations",https://citinewsroom.com/2025/06/gta-aaag-deepen-diaspora-ties-through-juneteenth-and-panafest-collaborations/
Singer Chris Brown pleads not guilty in London assault case,https://citinewsroom.com/2025/06/singer-chris-brown-pleads-not-guilty-in-london-assault-case/
Let’s support rapper V12 Origenator – Code Micky urges Ghanaians,https://citinewsroom.com/2025/06/lets-support-rapper-v12-origenator-code-micky-urges-ghanaians/
Iran signals readiness for ceasefire as Trump announces agreement,https://citinewsroom.com/2025/06/iran-signals-readiness-for-ceasefire-as-trump-announces-agreement/
Violating U.S. laws risks deportation and future bans – U.S. Embassy warns Visa holders,https://citinewsroom.com/2025/06/violating-u-s-laws-risks-deportation-and-future-bans-u-s-embassy-warns-visa-holders/
Sierra Leone’s Maada Bio takes over from Tinubu as ECOWAS Chair,https://citinewsroom.com/2025/06/sierra-leones-maada-bio-takes-over-from-tinubu-as-ecowas-chair/
Mahama to host King Mswati III of Eswatini for State visit,https://citinewsroom.com/2025/06/mahama-to-host-king-mswati-iii-of-eswatini-for-state-visit/
Open AI CEO says Meta is offering $100 million to poach his employees,https://citinewsroom.com/2025/06/open-ai-ceo-says-meta-is-offering-100-million-to-poach-his-employees/
Your AI use could have a hidden environmental cost,https://citinewsroom.com/2025/06/your-ai-use-could-have-a-hidden-environmental-cost/
Teachers in the Tech Era: Training Educators for Digital Success,https://citinewsroom.com/2025/06/teachers-in-the-tech-era-training-educators-for-digital-success/
"Thin, Light and Built to Last: New Era of Galaxy Z Series",https://citinewsroom.com/2025/06/thin-light-and-built-to-last-new-era-of-galaxy-z-series/
OpenAI’s ChatGPT Reports Major Outage as Users See Error Messages,https://citinewsroom.com/2025/06/openais-chatgpt-reports-major-outage-as-users-see-error-messages/
"iPhone could triple in price to $3,500 if they’re made in the US, analyst warns",https://citinewsroom.com/2025/06/iphone-could-triple-in-price-to-3500-if-theyre-made-in-the-us-analyst-warns/
"HASAG threatens strike, demands FWSC meeting on June 23",https://citinewsroom.com/2025/06/hasag-threatens-strike-demands-fwsc-meeting-on-june-23/
"Ghana records 7 new Mpox cases, total infections rise to 98 – GHS",https://citinewsroom.com/2025/06/ghana-records-7-new-mpox-cases-total-infections-rise-to-98-ghs/
Standard Chartered empowers next generation of girls to embrace their periods proudly,https://citinewsroom.com/2025/06/standard-chartered-empowers-next-generation-of-girls-to-embrace-their-periods-proudly/
"Ghana records 6 new Mpox cases, total rises to 91",https://citinewsroom.com/2025/06/ghana-records-6-new-mpox-cases-total-rises-to-91/
Treat patients with empathy and dignity – Health Minister to GHS,https://citinewsroom.com/2025/06/treat-patients-with-empathy-and-dignity-health-minister-to-ghs/
"Lawful, but is it helpful? A Biblical lens on NPP’s early presidential primaries – Fred Djabanor writes",https://citinewsroom.com/2025/06/lawful-but-is-it-helpful-a-biblical-lens-on-npps-early-presidential-primaries/
Four Imperatives to Help Demystify AI Use Cases: An African and Ghanaian Perspective,https://citinewsroom.com/2025/06/four-imperatives-to-help-demystify-ai-use-cases-an-african-and-ghanaian-perspective/
"Towards a fully operational 24/7 port system in Ghana: Infrastructure, Coordination and Policy Imperatives",https://citinewsroom.com/2025/06/towards-a-fully-operational-24-7-port-system-in-ghana-infrastructure-coordination-and-policy-imperatives/
Agriculture in Focus: A call for sector-wide revitalisation – IMANI,https://citinewsroom.com/2025/06/agriculture-in-focus-a-call-for-sector-wide-revitalisation-imani/
Message in a Mine: How storytelling can curb galamsey in Ghana,https://citinewsroom.com/2025/06/message-in-a-mine-how-storytelling-can-curb-galamsey-in-ghana/
