Headline,Link
Channel One TV’s AgriFair in full swing at Efua Sutherland Children’s Park [Pictures],https://citinewsroom.com/2025/06/channel-one-tvs-agrifair-in-full-swing-at-efua-sutherland-childrens-park-pictures/
GH₵120k saved monthly after scrapping Jubilee House TV Subscriptions – Ofosu Kwakye,https://citinewsroom.com/2025/06/gh%e2%82%b5120k-saved-monthly-after-scrapping-jubilee-house-tv-subscriptions-ofosu-kwakye/
We need strong party to produce president – Patrick Boamah to NPP,https://citinewsroom.com/2025/06/we-need-strong-party-to-produce-president-patrick-boamah-to-npp/
From Newsroom to Farmland: Araba Koomson shares her journey from Broadcast Journalist to Agripreneur,https://citinewsroom.com/2025/06/from-newsroom-to-farmland-araba-koomson-shares-her-journey-from-broadcast-journalist-to-agripreneur/
"Desmond Paitoo: I’ve done nothing wrong, my ‘Dr’ title is honorary",https://citinewsroom.com/2025/06/desmond-paitoo-ive-done-nothing-wrong-my-dr-title-is-honorary/
"One dead, another injured in shooting incident at naming ceremony in Gbawe",https://citinewsroom.com/2025/06/one-dead-another-injured-in-shooting-incident-at-naming-ceremony-in-gbawe/
First batch of Ghanaians successfully evacuated from Iran to Turkey – Ablakwa,https://citinewsroom.com/2025/06/first-batch-of-ghanaians-successfully-evacuated-from-iran-to-turkey-ablakwa/
Bawumia is NPP’s best hope for 2028 – Sammi Awuku,https://citinewsroom.com/2025/06/bawumia-is-npps-best-hope-for-2028-sammi-awuku/
No official notice from U.S. on travel ban – Ablakwa assures Ghanaians,https://citinewsroom.com/2025/06/no-official-notice-from-u-s-on-travel-ban-ablakwa-assures-ghanaians/
Appointments Committee to vet Justice Ackaah-Boafo today after petition delay,https://citinewsroom.com/2025/06/appointments-committee-to-vet-justice-ackaah-boafo-today-after-petition-delay/
Channel One TV’s maiden three-day AgriFair opens today,https://citinewsroom.com/2025/06/channel-one-tvs-maiden-three-day-agrifair-opens-today/
"HASAG threatens strike, demands FWSC meeting on June 23",https://citinewsroom.com/2025/06/hasag-threatens-strike-demands-fwsc-meeting-on-june-23/
Popular Accra lounge ‘Garage’ announces closure June 29 after 5-year run,https://citinewsroom.com/2025/06/popular-accra-nightclub-garage-announces-closure-june-29-after-5-year-run/
Upper Manya Krobo: Midwife’s timely intervention saves mother and baby on farm,https://citinewsroom.com/2025/06/upper-manya-krobo-midwifes-timely-intervention-saves-mother-and-baby-on-farm/
Citi Business Forum timely and crucial for Agric growth – Dumelo,https://citinewsroom.com/2025/06/citi-business-forum-timely-and-crucial-for-agric-growth-dumelo/
‘Basic Legal Education for SMEs’ with Jonathan Amable | Citi Business Festival On-Air Series Ep9,https://citinewsroom.com/2025/06/basic-legal-education-for-smes-with-jonathan-amable-citi-business-festival-on-air-series-ep9/
‘Understanding The Seed And Agri-Input Economy’ with Dr. Amos Rutherford Azinu | CBF On-Air Series,https://citinewsroom.com/2025/06/understanding-the-seed-and-agri-input-economy-with-dr-amos-rutherford-azinu-cbf-on-air-series/
Citi Breakfast Show: GPRTU suspends planned strike over GHȼ1 fuel levy rollout,https://citinewsroom.com/2025/06/citi-breakfast-show-gprtu-suspends-planned-strike-over-gh%c8%bc1-fuel-levy-rollout/
Citi Breakfast Show: Nurses intensify strike! How is healthcare being affected? | 10/06/25,https://citinewsroom.com/2025/06/citi-breakfast-show-nurses-intensify-strike-how-is-healthcare-being-affected-10-06-25/
GH₵120k saved monthly after scrapping Jubilee House TV Subscriptions – Ofosu Kwakye,https://citinewsroom.com/2025/06/gh%e2%82%b5120k-saved-monthly-after-scrapping-jubilee-house-tv-subscriptions-ofosu-kwakye/
We need strong party to produce president – Patrick Boamah to NPP,https://citinewsroom.com/2025/06/we-need-strong-party-to-produce-president-patrick-boamah-to-npp/
"Desmond Paitoo: I’ve done nothing wrong, my ‘Dr’ title is honorary",https://citinewsroom.com/2025/06/desmond-paitoo-ive-done-nothing-wrong-my-dr-title-is-honorary/
Bawumia is NPP’s best hope for 2028 – Sammi Awuku,https://citinewsroom.com/2025/06/bawumia-is-npps-best-hope-for-2028-sammi-awuku/
No official notice from U.S. on travel ban – Ablakwa assures Ghanaians,https://citinewsroom.com/2025/06/no-official-notice-from-u-s-on-travel-ban-ablakwa-assures-ghanaians/
Channel One TV’s AgriFair in full swing at Efua Sutherland Children’s Park [Pictures],https://citinewsroom.com/2025/06/channel-one-tvs-agrifair-in-full-swing-at-efua-sutherland-childrens-park-pictures/
BoG to overhaul ‘Ghana Reference Rate’ in push for 10% lending target,https://citinewsroom.com/2025/06/bog-to-overhaul-ghana-reference-rate-in-push-for-10-lending-target/
OmniBSIC Bank gears up for 8th Health Walk and Business networking,https://citinewsroom.com/2025/06/omnibsic-bank-gears-up-for-8th-health-walk-and-business-networking/
Central banks in Africa must lead on Customer Service standards – Prof. Hinson urges,https://citinewsroom.com/2025/06/central-banks-in-africa-must-lead-on-customer-service-standards-prof-hinson-urges/
Channel One TV’s maiden three-day AgriFair opens today,https://citinewsroom.com/2025/06/channel-one-tvs-maiden-three-day-agrifair-opens-today/
First Lady praises Merck Foundation for training Ghanaian doctors,https://citinewsroom.com/2025/06/first-lady-praises-merck-foundation-for-training-ghanaian-doctors/
UG begins construction of $10m Korean-funded ICT Centre,https://citinewsroom.com/2025/06/ug-begins-construction-of-10m-korean-funded-ict-centre/
"Olam Agri surpasses target with over 8,000 bakers screened in 2025 health initiative",https://citinewsroom.com/2025/06/olam-agri-surpasses-target-with-over-8000-bakers-screened-in-2025-health-initiative/
Over 100 structures destroyed by fire at Tema Heavy Industrial Area,https://citinewsroom.com/2025/06/over-100-structures-destroyed-by-fire-at-tema-heavy-industrial-area/
Maiden Ghana Herbal Conference slated for November 2025,https://citinewsroom.com/2025/06/maiden-ghana-herbal-conference-slated-for-november-2025/
NBPA x UM6P One Court Africa Event kicks off in Marrakech,https://citinewsroom.com/2025/06/nbpa-x-um6p-one-court-africa-event-kicks-off-in-marrakech/
Liverpool host Bournemouth to open Premier League season,https://citinewsroom.com/2025/06/liverpool-host-bournemouth-to-open-premier-league-season/
"TECNO, Becomes Official Global Partner For TotalEnergies CAF AFCON 2025 & 2027",https://citinewsroom.com/2025/06/tecno-becomes-official-global-partner-for-totalenergies-caf-afcon-2025-2027/
Tottenham return is unrealistic – Pochettino,https://citinewsroom.com/2025/06/tottenham-return-is-unrealistic-pochettino/
New-look PSG make history on emotional night for Luis Enrique,https://citinewsroom.com/2025/06/new-look-psg-make-history-on-emotional-night-for-luis-enrique/
Singer Chris Brown pleads not guilty in London assault case,https://citinewsroom.com/2025/06/singer-chris-brown-pleads-not-guilty-in-london-assault-case/
Let’s support rapper V12 Origenator – Code Micky urges Ghanaians,https://citinewsroom.com/2025/06/lets-support-rapper-v12-origenator-code-micky-urges-ghanaians/
Bro Philemon hints at comeback to Ghana’s gospel music scene,https://citinewsroom.com/2025/06/bro-philemon-hints-at-comeback-to-ghanas-gospel-music-scene/
"Ibrahim Mahama gifts Azumah Nelson Toyota Fortuner, cash to honour boxing legacy",https://citinewsroom.com/2025/06/ibrahim-mahama-gifts-azumah-nelson-toyota-fortuner-cash-to-honour-boxing-legacy/
Blackstar Festival launched in Accra,https://citinewsroom.com/2025/06/blackstar-festival-launched-in-accra/
Mahama to host King Mswati III of Eswatini for State visit,https://citinewsroom.com/2025/06/mahama-to-host-king-mswati-iii-of-eswatini-for-state-visit/
Open AI CEO says Meta is offering $100 million to poach his employees,https://citinewsroom.com/2025/06/open-ai-ceo-says-meta-is-offering-100-million-to-poach-his-employees/
"‘No-bra, no-exam’ rule at Nigerian university sparks outrage",https://citinewsroom.com/2025/06/no-bra-no-exam-rule-at-nigerian-university-sparks-outrage/
Clashes injure 11 as Kenyans protest death of blogger in police custody,https://citinewsroom.com/2025/06/clashes-injure-11-as-kenyans-protest-death-of-blogger-in-police-custody/
G7 leaders call for ‘de-escalation’ in the Middle East,https://citinewsroom.com/2025/06/g7-leaders-call-for-de-escalation-in-the-middle-east/
"Thin, Light and Built to Last: New Era of Galaxy Z Series",https://citinewsroom.com/2025/06/thin-light-and-built-to-last-new-era-of-galaxy-z-series/
OpenAI’s ChatGPT Reports Major Outage as Users See Error Messages,https://citinewsroom.com/2025/06/openais-chatgpt-reports-major-outage-as-users-see-error-messages/
"iPhone could triple in price to $3,500 if they’re made in the US, analyst warns",https://citinewsroom.com/2025/06/iphone-could-triple-in-price-to-3500-if-theyre-made-in-the-us-analyst-warns/
Huawei and TD Africa launch eKit to empower SMEs in Ghana,https://citinewsroom.com/2025/06/huawei-and-td-africa-launch-ekit-to-empower-smes-in-ghana/
SAP CEO says AI will eliminate routine tasks but not German jobs,https://citinewsroom.com/2025/06/sap-ceo-says-ai-will-eliminate-routine-tasks-but-not-german-jobs/
"HASAG threatens strike, demands FWSC meeting on June 23",https://citinewsroom.com/2025/06/hasag-threatens-strike-demands-fwsc-meeting-on-june-23/
"Ghana records 7 new Mpox cases, total infections rise to 98 – GHS",https://citinewsroom.com/2025/06/ghana-records-7-new-mpox-cases-total-infections-rise-to-98-ghs/
Standard Chartered empowers next generation of girls to embrace their periods proudly,https://citinewsroom.com/2025/06/standard-chartered-empowers-next-generation-of-girls-to-embrace-their-periods-proudly/
"Ghana records 6 new Mpox cases, total rises to 91",https://citinewsroom.com/2025/06/ghana-records-6-new-mpox-cases-total-rises-to-91/
Treat patients with empathy and dignity – Health Minister to GHS,https://citinewsroom.com/2025/06/treat-patients-with-empathy-and-dignity-health-minister-to-ghs/
Choosing the right IT management partner and maximising the relationship (Part 2),https://citinewsroom.com/2025/06/choosing-the-right-it-management-partner-and-maximising-the-relationship-part-2/
Ghana’s Fintech boom can’t run on hype alone,https://citinewsroom.com/2025/06/ghanas-fintech-boom-cant-run-on-hype-alone/
Surviving the Storm: Building Resilient Community Banks for Financial Inclusion in West Africa – Victor Agbeve writes,https://citinewsroom.com/2025/06/surviving-the-storm-building-resilient-community-banks-for-financial-inclusion-in-west-africa-victor-agbeve-writes/
Israel-Iran Conflict: Geopolitical implications and what it means for Ghana -Scott Edward Agyemang writes,https://citinewsroom.com/2025/06/israel-iran-conflict-geopolitical-implications-and-what-it-means-for-ghana-scott-edward-agyemang-writes/
China’s 100% tariff removal a golden opportunity for Africa’s industrial rise –  Amb. Edward Boateng writes,https://citinewsroom.com/2025/06/chinas-100-tariff-removal-a-golden-opportunity-for-africas-industrial-rise-amb-edward-boateng-writes/
