Headline,Link
BoG: Over-the-Counter Dollar withdrawals still permitted,https://citinewsroom.com/2025/05/bog-no-ban-on-over-the-counter-dollar-withdrawals/
Energy Ministry seeks GH₵1bn with 2.6 days of fuel left,https://citinewsroom.com/2025/05/energy-ministry-seeks-gh%e2%82%b51bn-with-2-6-days-of-fuel-left/
NRSA to meet new IGP over street hawking and roadside trading,https://citinewsroom.com/2025/05/nrsa-to-meet-new-igp-over-street-hawking-and-roadside-trading/
Group files suit at Supreme Court to halt removal of suspended CJ,https://citinewsroom.com/2025/05/group-files-suit-at-supreme-court-to-halt-removal-of-suspended-cj/
"High Court convicts six in GES payroll fraud case, over GHc106k recovered",https://citinewsroom.com/2025/05/high-court-convicts-six-in-ges-payroll-fraud-case-over-ghc106k-recovered/
No ban on over-the-counter dollar withdrawals – John Awuah,https://citinewsroom.com/2025/05/no-ban-on-over-the-counter-dollar-withdrawals-bankers-association/
“Let the matter die” – Tanko Computer backs Mahama’s stance on dollar gift,https://citinewsroom.com/2025/05/let-the-matter-die-tanko-computer-backs-mahamas-stance-on-dollar-gift/
BoG to tighten over-the-counter dollar withdrawals – Adongo,https://citinewsroom.com/2025/05/bog-to-tighten-dollar-withdrawals-as-cedi-strengthens/
Dollar gift: Mahama lacks courage to sanction Sammy Gyamfi – Dr. Zaato,https://citinewsroom.com/2025/05/dollar-gift-mahama-lacks-courage-to-sanction-sammy-gyamfi-dr-zaato/
Ministry of Health begins recruitment for Medical Officers on May 16,https://citinewsroom.com/2025/05/ministry-of-health-begins-recruitment-for-medical-officers-on-may-16/
Assault on firefighters will lead to prosecution – Muntaka warns,https://citinewsroom.com/2025/05/assault-on-firefighters-will-lead-to-prosecution-muntaka-warns/
Rashid Pelpuo appointed Co-Chair of high-level ILO Conference in Geneva,https://citinewsroom.com/2025/05/rashid-pelpuo-appointed-co-chair-of-high-level-ilo-conference-in-geneva/
Do Afrikaners want to take Trump up on his South African refugee offer?,https://citinewsroom.com/2025/05/do-afrikaners-want-to-take-trump-up-on-his-south-african-refugee-offer/
Sustained cedi stability crucial for economic growth – Dr. Atuahene,https://citinewsroom.com/2025/05/sustained-cedi-stability-crucial-for-economic-growth-dr-atuahene/
Register your excavator in two weeks or lose it – DVLA warns,https://citinewsroom.com/2025/05/register-your-excavator-in-two-weeks-or-lose-it-dvla-warns/
"Eyewitness News, Monday, 10th March, 2025",https://citinewsroom.com/2025/03/eyewitness-news-monday-10th-march-2025/
"Citi Breakfast Show, Monday, 10th March, 2025",https://citinewsroom.com/2025/03/citi-breakfast-show-monday-10th-march-2025/
Heritage on-Air Series | Celebrating Iconic Ghanaian Music | Ep5,https://citinewsroom.com/2025/03/heritage-on-air-series-the-story-of-ghanaian-music-through-the-years-ep5/
"FamLife | Ghanaian Marriage Paradigms | Saturday, 8th March, 2025",https://citinewsroom.com/2025/03/famlife-ghanaian-marriage-paradigms-saturday-8th-march-2025/
Energy Ministry seeks GH₵1bn with 2.6 days of fuel left,https://citinewsroom.com/2025/05/energy-ministry-seeks-gh%e2%82%b51bn-with-2-6-days-of-fuel-left/
Group files suit at Supreme Court to halt removal of suspended CJ,https://citinewsroom.com/2025/05/group-files-suit-at-supreme-court-to-halt-removal-of-suspended-cj/
“Let the matter die” – Tanko Computer backs Mahama’s stance on dollar gift,https://citinewsroom.com/2025/05/let-the-matter-die-tanko-computer-backs-mahamas-stance-on-dollar-gift/
Dollar gift: Mahama lacks courage to sanction Sammy Gyamfi – Dr. Zaato,https://citinewsroom.com/2025/05/dollar-gift-mahama-lacks-courage-to-sanction-sammy-gyamfi-dr-zaato/
NPP warns members against early internal campaigning,https://citinewsroom.com/2025/05/npp-warns-members-against-early-internal-campaigning/
BoG: Over-the-Counter Dollar withdrawals still permitted,https://citinewsroom.com/2025/05/bog-no-ban-on-over-the-counter-dollar-withdrawals/
No ban on over-the-counter dollar withdrawals – John Awuah,https://citinewsroom.com/2025/05/no-ban-on-over-the-counter-dollar-withdrawals-bankers-association/
BoG to tighten over-the-counter dollar withdrawals – Adongo,https://citinewsroom.com/2025/05/bog-to-tighten-dollar-withdrawals-as-cedi-strengthens/
GUTA President calls for urgent VAT reform to reduce business costs,https://citinewsroom.com/2025/05/guta-president-calls-for-urgent-vat-reform-to-reduce-business-costs/
ActionAid Ghana calls for policy reforms to clampdown on illicit financial flows,https://citinewsroom.com/2025/05/actionaid-ghana-calls-for-policy-reforms-to-clampdown-on-illicit-financial-flows/
Defence and Interior Committee seeks partnership with DCAF on security governance,https://citinewsroom.com/2025/05/defence-and-interior-committee-seeks-partnership-with-dcaf-on-security-governance/
Committee probing petitions against suspended CJ begins hearings today,https://citinewsroom.com/2025/05/committee-probing-petitions-against-suspended-cj-begins-hearings-today/
Proposed U.S. remittance tax could impact Ghanaian families and economy,https://citinewsroom.com/2025/05/proposed-u-s-remittance-tax-could-impact-ghanaian-families-and-economy/
"Galaxy Tab S10 FE Series brings on premium, intelligent mobile AI experience",https://citinewsroom.com/2025/05/galaxy-tab-s10-fe-series-brings-on-premium-intelligent-mobile-ai-experience/
What you should know about credit scores,https://citinewsroom.com/2025/05/what-you-should-know-about-credit-scores/
Weija-Gbawe MP re-elected President of Ghana Weightlifting Federation,https://citinewsroom.com/2025/05/weija-gbawe-mp-re-elected-president-of-ghana-weightlifting-federation/
Trump administration warns World Cup visitors against overstaying visas,https://citinewsroom.com/2025/05/trump-administration-warns-world-cup-visitors-against-overstaying-visas/
‘Clock ticking on Arteta to prove he can be a winner’,https://citinewsroom.com/2025/05/clock-ticking-on-arteta-to-prove-he-can-be-a-winner/
Inter Milan defeat Barcelona by equalling Champions League semifinal record,https://citinewsroom.com/2025/05/inter-milan-defeat-barcelona-by-equalling-champions-league-semifinal-record/
Curry helps Warriors claim decider against Rockets,https://citinewsroom.com/2025/05/curry-helps-warriors-claim-decider-against-rockets/
Dr. Kingsley Agyemang partners with US creatives to build Africa’s largest film academy in Abuakwa South,https://citinewsroom.com/2025/05/dr-kingsley-agyemang-partners-with-us-creatives-to-build-africas-largest-film-academy-in-abuakwa-south/
Koo Fori pleads not guilty to $50K fraud; granted ₵320K bail,https://citinewsroom.com/2025/05/koo-fori-pleads-not-guilty-to-50k-fraud-granted-%e2%82%b5320k-bail/
Yaw Darling secures Unsung Artiste of the Year at TGMA 26,https://citinewsroom.com/2025/05/yaw-darling-secures-unsung-artiste-of-the-year-at-tgma-26/
Full list of 2025 Telecel Ghana Music Awards winners,https://citinewsroom.com/2025/05/full-list-of-2025-telecel-ghana-music-awards-winners/
Chairman K fuses culture and class at TGMA days after studio showdown,https://citinewsroom.com/2025/05/chairman-k-fuses-culture-and-class-at-tgma-days-after-studio-showdown/
Drone attacks raise stakes in new phase of Sudan’s civil war,https://citinewsroom.com/2025/05/drone-attacks-raise-stakes-in-new-phase-of-sudans-civil-war/
Do Afrikaners want to take Trump up on his South African refugee offer?,https://citinewsroom.com/2025/05/do-afrikaners-want-to-take-trump-up-on-his-south-african-refugee-offer/
Mali dissolves all political parties after opposition figures ‘arrested’,https://citinewsroom.com/2025/05/mali-dissolves-all-political-parties-after-opposition-figures-arrested/
India reopens 32 airports after ceasefire with Pakistan,https://citinewsroom.com/2025/05/india-reopens-32-airports-after-ceasefire-with-pakistan/
Pope Leo appeals for no more war in first Sunday address,https://citinewsroom.com/2025/05/pope-leo-appeals-for-no-more-war-in-first-sunday-address/
"‘China-based’ hack targets UK companies in ‘critical national security threat’, says analyst",https://citinewsroom.com/2025/05/china-based-hack-targets-uk-companies-in-critical-national-security-threat-says-analyst/
VFS Global leverages SAP Software to power digital cross-border mobility,https://citinewsroom.com/2025/05/vfs-global-leverages-sap-software-to-power-digital-cross-border-mobility/
"Govt committed to rescuing troubled AT, protecting 500 jobs – Sam George",https://citinewsroom.com/2025/05/govt-committed-to-rescuing-troubled-at-protecting-500-jobs-sam-george/
VIA to commission AI-driven security operations and forensic center,https://citinewsroom.com/2025/05/via-to-commission-ai-driven-security-operations-and-forensic-center/
"Communications Minister visits ShaQ Express, commends local innovation",https://citinewsroom.com/2025/05/communications-minister-visits-shaq-express-commends-local-innovation/
Ministry of Health begins recruitment for Medical Officers on May 16,https://citinewsroom.com/2025/05/ministry-of-health-begins-recruitment-for-medical-officers-on-may-16/
Bagbin urges NHIS reform to ease burden on lupus patients,https://citinewsroom.com/2025/05/bagbin-urges-nhis-reform-to-ease-burden-on-lupus-patients/
Health Minister reaffirms healthcare reform agenda at Family Health University Ceremony,https://citinewsroom.com/2025/05/health-minister-reaffirms-healthcare-reform-agenda-at-family-health-university-ceremony/
Pharmacy Council pushes telemedicine to bridge healthcare access gaps,https://citinewsroom.com/2025/05/pharmacy-council-pushes-telemedicine-to-bridge-healthcare-access-gaps/
Enterprise Group supports establishment of Dialysis Centre at Tetteh Quarshie Memorial Hospital,https://citinewsroom.com/2025/05/enterprise-group-supports-the-establishment-of-dialysis-centre-at-tetteh-quarshie-memorial-hospital/
What you should know about credit scores,https://citinewsroom.com/2025/05/what-you-should-know-about-credit-scores/
Treasurers are evolving – Their banks must too,https://citinewsroom.com/2025/05/treasurers-are-evolving-their-banks-must-too/
Philanthropy has an expiry date: What Gates’ exit and Trump’s aid cuts teach us about the future of Impact & Innovation,https://citinewsroom.com/2025/05/1181843/
Ukrainian grain—Cheap or Compromised? A Call for Ghana to seek alternatives,https://citinewsroom.com/2025/05/ukrainian-grain-cheap-or-compromised-a-call-for-ghana-to-seek-alternatives/
Ghana’s National Security and the crisis of accountability: A case for urgent reform,https://citinewsroom.com/2025/05/ghanas-national-security-and-the-crisis-of-accountability-a-case-for-urgent-reform/
