Headline,Link
Citi FM/Channel One TV’s Food Festival underway [Photos],https://citinewsroom.com/2025/03/citi-fm-channel-one-tvs-food-festival-underway-photos/
There’s no political agenda to oust Chief Justice – Inusah Fuseini,https://citinewsroom.com/2025/03/theres-no-political-agenda-to-oust-chief-justice-inusah-fuseini/
Plot to oust CJ part of a scheme to remove EC Chairperson – Ahiagbah,https://citinewsroom.com/2025/03/plot-to-oust-cj-part-of-a-scheme-to-remove-ec-chairperson-ahiagbah/
Abandoned baby found behind Shops at Zebilla market,https://citinewsroom.com/2025/03/abandoned-baby-found-behind-shops-at-zebilla-market/
Make a difference in society – Justice Owusu-Dapaa,https://citinewsroom.com/2025/03/make-a-difference-in-society-justice-owusu-dapaa/
Forgiveness must not come at the expense of accountability – Justice Owusu-Dapaa,https://citinewsroom.com/2025/03/forgiveness-must-not-come-at-the-expense-of-accountability-justice-owusu-dapaa/
"Food, Music, and Culture: Back to Your Village Food Festival kicks off today",https://citinewsroom.com/2025/03/food-music-and-culture-back-to-your-village-food-festival-kicks-off-today/
Parliament passes Ghana Gold Board Bill 2025,https://citinewsroom.com/2025/03/parliament-passes-ghana-gold-board-bill-2025/
Parliament passes 2025 Appropriation Bill,https://citinewsroom.com/2025/03/parliament-passes-2025-appropriation-bill/
Missing ECG containers: Assets of suspects to be sold to recover losses – Jinapor,https://citinewsroom.com/2025/03/missing-ecg-containers-assets-of-suspects-to-be-sold-to-recover-losses-jinapor/
Bedzrah calls for apolitical handling of ECG containers scandal,https://citinewsroom.com/2025/03/bedzrah-calls-for-apolitical-handling-of-ecg-containers-scandal/
Religious tolerance essential for progress – Justice Yaw Oppong,https://citinewsroom.com/2025/03/religious-tolerance-essential-for-progress-justice-yaw-oppong/
Sheikh Aremeyaw calls on Muslims to embody Ramadan virtues,https://citinewsroom.com/2025/03/sheikh-aremeyaw-calls-on-muslims-to-embody-ramadan-virtues/
Citi Verify explainer: Did GRA freeze Richard Armah Quaye’s bank accounts?,https://citinewsroom.com/2025/03/citi-verify-explainer-did-gra-freeze-richard-armah-quayes-bank-accounts/
“All that glitters is not gold” – initial comments on Ghana’s Gold Board,https://citinewsroom.com/2025/03/all-that-glitters-is-not-gold-initial-comments-on-ghanas-gold-board/
"Eyewitness News, Monday, 10th March, 2025",https://citinewsroom.com/2025/03/eyewitness-news-monday-10th-march-2025/
"Citi Breakfast Show, Monday, 10th March, 2025",https://citinewsroom.com/2025/03/citi-breakfast-show-monday-10th-march-2025/
Heritage on-Air Series | Celebrating Iconic Ghanaian Music | Ep5,https://citinewsroom.com/2025/03/heritage-on-air-series-the-story-of-ghanaian-music-through-the-years-ep5/
"FamLife | Ghanaian Marriage Paradigms | Saturday, 8th March, 2025",https://citinewsroom.com/2025/03/famlife-ghanaian-marriage-paradigms-saturday-8th-march-2025/
There’s no political agenda to oust Chief Justice – Inusah Fuseini,https://citinewsroom.com/2025/03/theres-no-political-agenda-to-oust-chief-justice-inusah-fuseini/
Plot to oust CJ part of a scheme to remove EC Chairperson – Ahiagbah,https://citinewsroom.com/2025/03/plot-to-oust-cj-part-of-a-scheme-to-remove-ec-chairperson-ahiagbah/
Make a difference in society – Justice Owusu-Dapaa,https://citinewsroom.com/2025/03/make-a-difference-in-society-justice-owusu-dapaa/
Forgiveness must not come at the expense of accountability – Justice Owusu-Dapaa,https://citinewsroom.com/2025/03/forgiveness-must-not-come-at-the-expense-of-accountability-justice-owusu-dapaa/
Religious tolerance essential for progress – Justice Yaw Oppong,https://citinewsroom.com/2025/03/religious-tolerance-essential-for-progress-justice-yaw-oppong/
Citi FM/Channel One TV’s Food Festival underway [Photos],https://citinewsroom.com/2025/03/citi-fm-channel-one-tvs-food-festival-underway-photos/
"Food, Music, and Culture: Back to Your Village Food Festival kicks off today",https://citinewsroom.com/2025/03/food-music-and-culture-back-to-your-village-food-festival-kicks-off-today/
Parliament passes Ghana Gold Board Bill 2025,https://citinewsroom.com/2025/03/parliament-passes-ghana-gold-board-bill-2025/
Parliament passes 2025 Appropriation Bill,https://citinewsroom.com/2025/03/parliament-passes-2025-appropriation-bill/
Missing ECG containers: Assets of suspects to be sold to recover losses – Jinapor,https://citinewsroom.com/2025/03/missing-ecg-containers-assets-of-suspects-to-be-sold-to-recover-losses-jinapor/
NRSA cautions road users ahead of Eid ul-Fitr celebrations,https://citinewsroom.com/2025/03/nrsa-cautions-road-users-ahead-of-eid-ul-fitr-celebrations/
Mustapha Hamid pushes for Islamic law tutoring at Ghana School of Law,https://citinewsroom.com/2025/03/mustapha-hamid-pushes-for-islamic-law-tutoring-at-ghana-school-of-law/
Society for AIDS in Africa urges action on domestic health funding,https://citinewsroom.com/2025/03/society-for-aids-in-africa-urges-action-on-domestic-health-funding/
Marina Mall celebrates Eid in Style,https://citinewsroom.com/2025/03/marina-mall-celebrates-eid-in-style/
Ghana’s Carbon Market to generate over $1bn by 2030,https://citinewsroom.com/2025/03/ghanas-carbon-market-to-generate-over-1bn-by-2030/
‘Embarrassing’ Brazil thrashed by Argentina in World Cup qualifying,https://citinewsroom.com/2025/03/embarrassing-brazil-thrashed-by-argentina-in-world-cup-qualifying/
Pitch invader at Ghana-Chad match jailed for 100 days,https://citinewsroom.com/2025/03/pitch-invader-at-ghana-chad-match-jailed-for-100-days/
"Lakers lose to Magic despite combined 56 points from LeBron, Doncic",https://citinewsroom.com/2025/03/lakers-lose-to-magic-despite-combined-56-points-from-lebron-doncic/
Black Stars triumph over Madagascar in World Cup Qualifiers,https://citinewsroom.com/2025/03/black-stars-triumph-over-madagascar-in-world-cup-qualifiers/
Portugal defeat Denmark in extra time to reach Nations League semifinals,https://citinewsroom.com/2025/03/portugal-defeat-denmark-in-extra-time-to-reach-nations-league-semifinals/
Back to Your Village Food Festival: A Celebration of Ghana’s Culinary Heritage,https://citinewsroom.com/2025/03/back-to-your-village-food-festival-a-celebration-of-ghanas-culinary-heritage/
AratheJay drops new single “Fire” with Bella Shmurda,https://citinewsroom.com/2025/03/arathejay-drops-new-single-fire-with-bella-shmurda/
Legendary Naa Amanua to be laid to rest today,https://citinewsroom.com/2025/03/legendary-naa-amanua-goes-home-tomorrow/
Chinua Achebe was the first to publish my poetry – Abena Busia,https://citinewsroom.com/2025/03/chinua-achebe-was-the-first-to-publish-my-poetry-abena-busia/
My dad had profound influence on my passion for poetry – Abena Busia,https://citinewsroom.com/2025/03/my-dad-had-profound-influence-on-my-passion-for-poetry-abena-busia/
‘It’s going to get worse’: US car buyers brace for sweeping auto tariffs,https://citinewsroom.com/2025/03/its-going-to-get-worse-us-car-buyers-brace-for-sweeping-auto-tariffs/
Under the shelter: Life amid Israel’s unseen war sirens – Fred Duhoe writes,https://citinewsroom.com/2025/03/under-the-shelter-life-amid-israels-unseen-war-sirens/
Former VOA journalist Shaka Ssali passes on,https://citinewsroom.com/2025/03/former-voa-journalist-shaka-ssali-passes-on/
"Germany leads defiance to Trump car tariffs, saying it ‘will not give in’",https://citinewsroom.com/2025/03/germany-leads-defiance-to-trump-car-tariffs-saying-it-will-not-give-in/
"South Sudan VP Machar under house arrest, his party says",https://citinewsroom.com/2025/03/south-sudan-vp-machar-under-house-arrest-his-party-says/
PassportPay: Transforming Bill Payments and Money Transfers for Ghanaians Abroad,https://citinewsroom.com/2025/03/passportpay-transforming-bill-payments-and-money-transfers-and-for-ghanaians-abroad/
What is the Signal messaging app and how secure is it?,https://citinewsroom.com/2025/03/what-is-the-signal-messaging-app-and-how-secure-is-it/
Chinese electric carmaker BYD sales beat Tesla,https://citinewsroom.com/2025/03/chinese-electric-carmaker-byd-sales-beat-tesla/
"Samsung marks step forward with AI for everyone by introducing New Galaxy A56 5G, others",https://citinewsroom.com/2025/03/samsung-marks-step-forward-with-ai-for-everyone-by-introducing-new-galaxy-a56-5g-others/
Genetic testing firm 23andme files for bankruptcy protection,https://citinewsroom.com/2025/03/genetic-testing-firm-23andme-files-for-bankruptcy-protection/
Private health facilities lament over unpaid GHS150m arrears,https://citinewsroom.com/2025/03/private-health-facilities-lament-over-unpaid-ghs150m-arrears/
"DKT International donates CHPS compound, borehole to Aframase",https://citinewsroom.com/2025/03/dkt-international-donates-chps-compound-borehole-to-aframase/
A/R: KATH suspends surgical cases following water crisis,https://citinewsroom.com/2025/03/a-r-kath-suspends-surgical-cases-following-water-crisis/
Health Minister urges foreign support to align with national policies,https://citinewsroom.com/2025/03/health-minister-urges-foreign-support-to-align-with-national-policies/
HIV/AIDS deaths could increase globally amid US aid freeze – UN,https://citinewsroom.com/2025/03/hiv-and-aids-deaths-could-increase-globally-amid-us-aid-freeze-un-says/
“All that glitters is not gold” – initial comments on Ghana’s Gold Board,https://citinewsroom.com/2025/03/all-that-glitters-is-not-gold-initial-comments-on-ghanas-gold-board/
"Ravaged forests, a nation at risk: Will Ghana’s green comeback be led by business?",https://citinewsroom.com/2025/03/ravaged-forests-a-nation-at-risk-will-ghanas-green-comeback-be-led-by-business/
Beyond USAID: Finding new lifelines for global development,https://citinewsroom.com/2025/03/beyond-usaid-finding-new-lifelines-for-global-development/
A letter to President Mahama,https://citinewsroom.com/2025/03/a-letter-to-president-mahama/
Unlocking Women’s Economic Potential Through Tailored Financial Solutions,https://citinewsroom.com/2025/03/unlocking-womens-economic-potential-through-tailored-financial-solutions/
