Headline,Link
ORAL: Go to Court if you feel defamed – Domelevo,https://citinewsroom.com/2025/02/oral-go-to-court-if-you-feel-defamed-domelevo/
Northern Region: Alhaji Mumuni wins Council of State seat with 26 votes,https://citinewsroom.com/2025/02/northern-region-alhaji-mumuni-wins-council-of-state-seat-with-26-votes/
Over 30 Sawla SHS students indefinitely suspended for indiscipline,https://citinewsroom.com/2025/02/over-30-sawla-shs-students-indefinitely-suspended-for-indiscipline/
ORAL report based on mere rumors – Tuah-Yeboah,https://citinewsroom.com/2025/02/oral-report-based-on-mere-rumors-tuah-yeboah/
ORAL: Majority of cases need auditing to confirm wrongdoing – Domelevo,https://citinewsroom.com/2025/02/oral-majority-of-cases-need-auditing-to-confirm-wrongdoing-domelevo/
"Ghana falls in 2024 Corruption Perception Index, scores 42",https://citinewsroom.com/2025/02/ghana-falls-in-2024-corruption-perception-index-scores-42/
Why some Ghanaians are fighting in insurgency-hit Burkina Faso,https://citinewsroom.com/2025/02/why-some-ghanaians-are-fighting-in-insurgency-hit-burkina-faso/
Council of State elections to be held today,https://citinewsroom.com/2025/02/council-of-state-elections-to-be-held-today/
"Tax cuts, energy debt, and cedi stability dominate Gov’t-IMF talks",https://citinewsroom.com/2025/02/tax-cuts-energy-debt-cedi-stability-dominate-imf-govt-talks/
Kwakye Ofosu defends AG’s decision to drop ‘politically motivated cases’,https://citinewsroom.com/2025/02/kwakye-ofosu-defends-ags-decision-to-drop-politically-motivated-cases/
Kwakye Ofosu: Shorten transition to prevent post-election violence,https://citinewsroom.com/2025/02/kwakye-ofosu-shorten-transition-to-prevent-post-election-violence/
"I’ll prioritise job creation, employment – Labour Minister",https://citinewsroom.com/2025/02/ill-prioritise-job-creation-employment-labour-minister/
[PICTURES] Heritage Month: Citi FM/Channel One TV pays courtesy call on Ga Mantse,https://citinewsroom.com/2025/02/pictures-heritage-month-citi-fm-channel-one-tv-pays-courtesy-call-on-ga-mantse/
AG must give reasons for discontinuing high-profile cases – Kpebu,https://citinewsroom.com/2025/02/ag-must-give-reasons-for-discontinuing-high-profile-cases-kpebu/
Uganda battles new Ebola outbreak – and a vaccine hesitancy crisis,https://citinewsroom.com/2025/02/uganda-battles-new-ebola-outbreak-and-a-vaccine-hesitancy-crisis/
"Citi Breakfast Show, Friday, 24th January, 2025",https://citinewsroom.com/2025/01/citi-breakfast-show-friday-24th-january-2025/
"Citi Business Edition | Oxfam Tax Dialogue – Taxing High Net-Worth Individuals | Friday, 24th January, 2025",https://citinewsroom.com/2025/01/citi-business-edition-oxfam-tax-dialogue-taxing-high-net-worth-individuals-friday-24th-january-2025/
Effective Living Series | Personal and Family Budgeting w/ Doris Ahiati | Ep. 10,https://citinewsroom.com/2025/01/effective-living-series-personal-and-family-budgeting-w-doris-ahiati-ep-10/
"Citi Breakfast Show, Wednesday, 21st January, 2025",https://citinewsroom.com/2025/01/citi-breakfast-show-wednesday-21st-january-2025/
Eastern Region: Heavy security presence as Council of State election commences,https://citinewsroom.com/2025/02/eastern-region-heavy-security-presence-as-council-of-state-election-commences/
"I’ll prioritise job creation, employment – Labour Minister",https://citinewsroom.com/2025/02/ill-prioritise-job-creation-employment-labour-minister/
Northern Region: Alhaji Mumuni wins Council of State seat with 26 votes,https://citinewsroom.com/2025/02/northern-region-alhaji-mumuni-wins-council-of-state-seat-with-26-votes/
ORAL: Go to Court if you feel defamed – Domelevo,https://citinewsroom.com/2025/02/oral-go-to-court-if-you-feel-defamed-domelevo/
ORAL: Majority of cases need auditing to confirm wrongdoing – Domelevo,https://citinewsroom.com/2025/02/oral-majority-of-cases-need-auditing-to-confirm-wrongdoing-domelevo/
Murtala Mohammed: Tough action awaits illegal mining culprits,https://citinewsroom.com/2025/02/murtala-mohammed-tough-action-awaits-illegal-mining-culprits/
Africa must close investment and infrastructure gaps to harness AI’s full potential – WTO Chief,https://citinewsroom.com/2025/02/africa-must-close-investment-and-infrastructure-gaps-to-harness-ais-full-potential-wto-chief/
Gov’t  in high-stakes talks with GPRTU over possible fare hikes,https://citinewsroom.com/2025/02/govt-in-high-stakes-talks-with-gprtu-over-possible-fare-hikes/
"Internet costs soar on currency volatility, energy prices and market barriers",https://citinewsroom.com/2025/02/internet-costs-soar-on-currency-volatility-energy-prices-and-market-barriers/
Govt to meet transport unions over fare hikes amid rising fuel prices,https://citinewsroom.com/2025/02/govt-to-meet-transport-unions-over-fare-hikes-amid-rising-fuel-prices/
A/R: Two perish in fatal crash on Tech-Oforikrom road,https://citinewsroom.com/2025/02/a-r-two-perish-in-fatal-crash-on-tech-oforikrom-stretch/
Labadi Beach Hotel denies withdrawing legal case against Polo Beach Club,https://citinewsroom.com/2025/02/labadi-beach-hotel-denies-withdrawing-legal-case-against-polo-beach-club/
Murtala Mohammed: Tough action awaits illegal mining culprits,https://citinewsroom.com/2025/02/murtala-mohammed-tough-action-awaits-illegal-mining-culprits/
GHS urges Upper West to uphold hygiene amid CMS outbreak,https://citinewsroom.com/2025/02/ghs-urges-upper-west-to-uphold-hygiene-amid-cms-outbreak/
"Two Nigerians in court for alleged $20,000 fraud",https://citinewsroom.com/2025/02/two-nigerians-in-court-for-alleged-20000-fraud/
Ancelotti defends Real’s Ballon d’Or snub,https://citinewsroom.com/2025/02/ancelotti-defends-reals-ballon-dor-snub/
Eagles demolish Chiefs to deny them Super Bowl three-peat,https://citinewsroom.com/2025/02/eagles-demolish-chiefs-to-deny-them-super-bowl-three-peat/
Kofi Adams: GFA cannot operate in isolation – Kofi Adams warns,https://citinewsroom.com/2025/02/kofi-adams-gfa-cannot-operate-in-isolation-kofi-adams-warns/
"Newmont invests over $400,000 in sports dev’t in Birim North Municipality",https://citinewsroom.com/2025/02/newmont-invests-over-400000-in-sports-devt-in-birim-north-municipality/
Baseball star Ohtani’s interpreter jailed for $17m gambling fraud,https://citinewsroom.com/2025/02/baseball-star-ohtanis-interpreter-jailed-for-17m-gambling-fraud/
Upside Down: Stage play tougher than filmmaking – Peter Sedufia,https://citinewsroom.com/2025/02/upside-down-stage-play-tougher-than-filmmaking-peter-sedufia/
The Chat: I record most of my songs myself – Sista Afia,https://citinewsroom.com/2025/02/the-chat-i-record-most-of-my-songs-myself-sista-afia/
The Chat: Record Labels play key role in winning a Grammy – George Britton,https://citinewsroom.com/2025/02/the-chat-record-labels-play-key-role-in-winning-a-grammy-george-britton/
"DJ Wallpaper hosts KiDi, OliveTheBoy, Xlimkid at 2025 ‘The Vibe Experience’",https://citinewsroom.com/2025/02/dj-wallpaper-hosts-kidi-olivetheboy-xlimkid-at-2025-the-vibe-experience/
2025 Grammys: See the complete list of winners,https://citinewsroom.com/2025/02/2025-grammys-see-the-complete-list-of-winners/
Why some Ghanaians are fighting in insurgency-hit Burkina Faso,https://citinewsroom.com/2025/02/why-some-ghanaians-are-fighting-in-insurgency-hit-burkina-faso/
Uganda battles new Ebola outbreak – and a vaccine hesitancy crisis,https://citinewsroom.com/2025/02/uganda-battles-new-ebola-outbreak-and-a-vaccine-hesitancy-crisis/
‘No thanks’: White South Africans turn down Trump’s US immigration offer,https://citinewsroom.com/2025/02/no-thanks-white-south-africans-turn-down-trumps-us-immigration-offer/
Israel troops withdraw from corridor that split Gaza in two,https://citinewsroom.com/2025/02/israel-troops-withdraw-from-corridor-that-split-gaza-in-two/
Israel kills eight-month-pregnant woman in occupied West Bank raid,https://citinewsroom.com/2025/02/israel-kills-eight-month-pregnant-woman-in-occupied-west-bank-raid/
Musk-led group makes $97.4bn bid for ChatGPT maker OpenAI,https://citinewsroom.com/2025/02/musk-led-group-makes-97-4bn-bid-for-chatgpt-maker-openai/
"Yamoransa Model’s 4th Impact Roundtable Discussion, robotics competition set for February 22-26",https://citinewsroom.com/2025/02/yamoransa-model-4th-impact-roundtable-discussion-robotics-competition-set-for-february-22-26/
Concern UK’s AI ambitions could lead to water shortages,https://citinewsroom.com/2025/02/concern-uks-ai-ambitions-could-lead-to-water-shortages/
Google joins firms dropping diversity recruitment goals,https://citinewsroom.com/2025/02/google-joins-firms-dropping-diversity-recruitment-goals/
Google drops pledge on AI use for weapons,https://citinewsroom.com/2025/02/google-drops-pledge-on-ai-use-for-weapons/
GHS urges Upper West to uphold hygiene amid CMS outbreak,https://citinewsroom.com/2025/02/ghs-urges-upper-west-to-uphold-hygiene-amid-cms-outbreak/
Effutu: 17 new cholera cases recorded,https://citinewsroom.com/2025/02/effutu-17-new-cholera-cases-recorded/
Winneba records 29 confirmed cases of cholera,https://citinewsroom.com/2025/02/winneba-records-29-confirmed-cases-of-cholera/
Upper West: CSM cases increase from 42 to 60 with 14 deaths,https://citinewsroom.com/2025/02/upper-west-csm-cases-increase-from-42-to-60-with-14-deaths/
Korle Bu Hospital begins major overhaul of deteriorating morgue,https://citinewsroom.com/2025/02/korle-bu-hospital-begins-major-overhaul-of-deteriorating-morgue/
"America First, Africa Last? The Economic and Geopolitical Fallout of Trump’s Policies -Scott Edward Agyemang writes",https://citinewsroom.com/2025/02/america-first-africa-last-the-economic-and-geopolitical-fallout-of-trumps-policies-scott-edward-agyemang-writes/
"Africa’s place in the AI revolution: Innovation, challenges, and the path forward",https://citinewsroom.com/2025/02/africas-place-in-the-ai-revolution-innovation-challenges-and-the-path-forward/
Beyond 8-to-5: Preparing Ghana’s Supply Chains for a 24-Hour Economy,https://citinewsroom.com/2025/02/beyond-8-to-5-preparing-ghanas-supply-chains-for-a-24-hour-economy/
Population boom presents Accra with rising challenges – Afua Adwubi Wiafe Akenteng writes,https://citinewsroom.com/2025/02/population-boom-presents-accra-with-rising-challenges-afua-adwubi-wiafe-akenteng-writes/
Can an appointed BoG Governor begin official duties pending confirmation? [Article],https://citinewsroom.com/2025/02/can-an-appointed-bog-governor-begin-official-duties-pending-confirmation-article/
