Headline,Link
"Mahama champions collaboration, trade during Bamako visit",https://citinewsroom.com/2025/03/mahama-champions-collaboration-trade-during-bamako-visit/
Bole Chief Imam bans extravagant weddings to preserve ‘Islamic traditions’,https://citinewsroom.com/2025/03/bole-chief-imam-bans-extravagant-weddings-to-preserve-islamic-traditions/
Mahama pledges to eliminate trade barriers between Ghana and Mali,https://citinewsroom.com/2025/03/mahama-pledges-to-eliminate-trade-barriers-between-ghana-and-mali/
Hit-and-run on Achimota highway kills two Old Achimotans,https://citinewsroom.com/2025/03/hit-and-run-on-achimota-highway-kills-two-old-achimotans/
"A-G appoints Kasser-Tee, Sosu, and Bamba to General Legal Council",https://citinewsroom.com/2025/03/a-g-appoints-kasser-tee-sosu-and-bamba-to-general-legal-council/
"Jubilee House route, major roads remain dark despite Linda Ocloo’s streetlights pledge",https://citinewsroom.com/2025/03/jubilee-house-route-major-roads-still-dark-despite-ministers-streetlight-pledge/
"Dansoman, Legon residents urge Mahama to complete Agenda 111 Projects",https://citinewsroom.com/2025/03/dansoman-legon-residents-urge-mahama-to-complete-agenda-111-projects/
Mahama visits Mali as part of ‘Good Neighbourliness’ tour,https://citinewsroom.com/2025/03/mahama-visits-mali-as-part-of-good-neighbourliness-tour/
IWD: Jean Mensa calls for stronger efforts to achieve gender equality,https://citinewsroom.com/2025/03/iwd-jean-mensa-calls-for-stronger-efforts-to-achieve-gender-equality/
2025 Heritage Caravan: Participants enjoy thrilling boat ride at Maaha Beach Village,https://citinewsroom.com/2025/03/2025-heritage-caravan-participants-enjoy-thrilling-boat-ride-at-maaha-beach-village/
"Ato Forson engages traders, ‘kayayei’ at Makola ahead of Budget presentation",https://citinewsroom.com/2025/03/ato-forson-engages-traders-kayayei-at-makola-ahead-of-budget-presentation/
Nigerian Senate suspends female senator who made sexual harassment claim,https://citinewsroom.com/2025/03/nigerian-senate-suspends-female-senator-who-made-sexual-harassment-claim/
Gifty Oware detained over NSA payroll fraud probe,https://citinewsroom.com/2025/03/gifty-oware-detained-over-nsa-payroll-fraud-probe/
Achimota School celebrates 98th founders’ day with a call to excellence,https://citinewsroom.com/2025/03/achimota-school-celebrates-98th-founders-day-with-a-call-to-excellence/
G/A region : Kayayei hostel neglected,https://citinewsroom.com/2025/03/g-a-region-kayayei-hostel-neglected/
Heritage on-Air Series | The legacies of Sir Edward Asafu-Adjaye and Justice Henry Kwesi Prempeh with Kweku Darko Ankrah | Ep3,https://citinewsroom.com/2025/03/heritage-on-air-series-the-legacies-of-sir-edward-asafu-adjaye-and-justice-henry-kwesi-prempeh-with-kweku-darko-ankrah-ep3/
"Eyewitness News, Tuesday, 4th March, 2025",https://citinewsroom.com/2025/03/eyewitness-news-tuesday-4th-march-2025/
Heritage On-Air Series | The legacies of Alfred Ocansey and Augustus Akiwumi with Kweku Darko Ankrah | Ep2,https://citinewsroom.com/2025/03/heritage-on-air-series-the-legacies-of-alfred-ocansey-and-augustus-akiwumi-with-kweku-darko-ankrah-ep2/
"Citi Breakfast Show, Tuesday, 4th March, 2025",https://citinewsroom.com/2025/03/citi-breakfast-show-tuesday-4th-march-2025/
"Mahama champions collaboration, trade during Bamako visit",https://citinewsroom.com/2025/03/mahama-champions-collaboration-trade-during-bamako-visit/
Mahama pledges to eliminate trade barriers between Ghana and Mali,https://citinewsroom.com/2025/03/mahama-pledges-to-eliminate-trade-barriers-between-ghana-and-mali/
"Jubilee House route, major roads remain dark despite Linda Ocloo’s streetlights pledge",https://citinewsroom.com/2025/03/jubilee-house-route-major-roads-still-dark-despite-ministers-streetlight-pledge/
Mahama visits Mali as part of ‘Good Neighbourliness’ tour,https://citinewsroom.com/2025/03/mahama-visits-mali-as-part-of-good-neighbourliness-tour/
Affirmative Action law must go beyond statistics – Jane Opoku-Agyemang,https://citinewsroom.com/2025/03/affirmative-action-law-must-go-beyond-statistics-jane-opoku-agyemang/
Ecobank Ghana expands ‘Ellevate’ to empower more women entrepreneurs,https://citinewsroom.com/2025/03/ecobank-ghana-expands-ellevate-to-empower-more-women-entrepreneurs/
"Ato Forson engages traders, ‘kayayei’ at Makola ahead of Budget presentation",https://citinewsroom.com/2025/03/ato-forson-engages-traders-kayayei-at-makola-ahead-of-budget-presentation/
Economic Dialogue paves the way for renewed investor confidence – Prof. Khalid,https://citinewsroom.com/2025/03/ghanas-economic-dialogue-sets-the-stage-for-renewed-investor-confidence-prof-khalid/
National economic dialogue has value – Franklin Cudjoe,https://citinewsroom.com/2025/03/national-economic-dialogue-has-value-franklin-cudjoe/
"Fire destroys two shops at Tudu, GNFS contains blaze",https://citinewsroom.com/2025/03/fire-destroys-two-shops-at-tudu-gnfs-contains-blaze/
Croydon commemorates Ghana’s 68th Independence with unity and reflection,https://citinewsroom.com/2025/03/croydon-commemorates-ghanas-68th-independence-with-unity-and-reflection/
MTN pledges to empower entrepreneurial women for national development,https://citinewsroom.com/2025/03/mtn-pledges-to-empower-entrepreneurial-women-for-national-development/
IWD: COCOBOD reaffirms commitment to creating equal opportunities for women in cocoa,https://citinewsroom.com/2025/03/iwd-cocobod-reaffirms-commitment-to-creating-equal-opportunities-for-women-in-cocoa/
16-year-old scoliosis patient appeals for GHS235K for life-saving surgery,https://citinewsroom.com/2025/03/16-year-old-scoliosis-patient-appeals-for-ghs235k-for-life-saving-surgery/
#IWD2025: Upper East Regional Minister pledges to champion women empowerment,https://citinewsroom.com/2025/03/iwd2025-upper-east-regional-minister-pledges-to-champion-women-empowerment/
Late Hudson-Odoi strike earns Forest victory over Man City,https://citinewsroom.com/2025/03/late-hudson-odoi-strike-earns-forest-victory-over-man-city/
Barcelona and Atletico Madrid draw in eight-goal thriller,https://citinewsroom.com/2025/02/barcelona-and-atletico-madrid-draw-in-eight-goal-thriller/
Liverpool beat Man City to extend lead at top to 11 points,https://citinewsroom.com/2025/02/liverpool-beat-man-city-to-extend-lead-at-top-to-11-points/
Ten-player Arsenal suffer huge blow to title hopes with West Ham loss,https://citinewsroom.com/2025/02/ten-player-arsenal-suffer-huge-blow-to-title-hopes-with-west-ham-loss/
Eto’o claims victory in ethics breach case,https://citinewsroom.com/2025/02/etoo-claims-victory-in-ethics-breach-case/
TiC storms Nigeria with Ghana Independence Day Party,https://citinewsroom.com/2025/03/tic-storms-nigeria-with-ghana-independence-day-party/
FOCAP welcomes Amoakohene’s decision to revive Kumawood,https://citinewsroom.com/2025/03/focap-welcomes-amoakohenes-decision-to-revive-kumawood/
Amoakohene inaugurates 17-member committee to revive Kumawood,https://citinewsroom.com/2025/03/amoakohene-inaugurates-17-member-committee-to-revive-kumawood/
From security guard to top Pharmacy student – The inspiring journey of Yahaya,https://citinewsroom.com/2025/03/from-security-guard-to-top-pharmacy-student-the-inspiring-journey-of-yahaya/
"No office, money or staff – Juliet Asante recounts struggles as NFA Boss",https://citinewsroom.com/2025/03/no-office-money-or-staff-juliet-asante-recounts-struggles-as-nfa-boss/
Nigerian Senate suspends female senator who made sexual harassment claim,https://citinewsroom.com/2025/03/nigerian-senate-suspends-female-senator-who-made-sexual-harassment-claim/
"Russian strikes kill at least 25, Ukraine says",https://citinewsroom.com/2025/03/russian-strikes-kill-at-least-25-ukraine-says/
Twelve injured in shooting at Toronto pub,https://citinewsroom.com/2025/03/twelve-injured-in-shooting-at-toronto-pub/
"Two dead, 186 missing after four boats sink off Yemen and Djibouti: UN",https://citinewsroom.com/2025/03/two-dead-186-missing-after-four-boats-sink-off-yemen-and-djibouti-un/
Trump says Ukraine ‘more difficult’ to deal with than Russia,https://citinewsroom.com/2025/03/trump-says-ukraine-more-difficult-to-deal-with-than-russia/
Workspace Global Turns 10: The Startup Transforming How African Businesses Access Creative Talent,https://citinewsroom.com/2025/03/workspace-global-turns-10-the-startup-transforming-how-african-businesses-access-creative-talent/
Nvidia says AI chip sales strong despite DeepSeek fears,https://citinewsroom.com/2025/02/nvidia-says-ai-chip-sales-strong-despite-deepseek-fears/
BP to slash green investment and ramp up gas and oil,https://citinewsroom.com/2025/02/bp-to-slash-green-investment-and-ramp-up-gas-and-oil/
Apple commits to $500bn US investment,https://citinewsroom.com/2025/02/apple-commits-to-500bn-us-investment/
"Legacy Media in a Digital-First World: Adapt, Evolve, or Die- Emmanuel Paa Kwesi Owusu Writes",https://citinewsroom.com/2025/02/legacy-media-in-a-digital-first-world-adapt-evolve-or-die-emmanuel-paa-kwesi-owusu-writes/
"Dansoman, Legon residents urge Mahama to complete Agenda 111 Projects",https://citinewsroom.com/2025/03/dansoman-legon-residents-urge-mahama-to-complete-agenda-111-projects/
Ghana Health Service reassigns Regional Health Directors,https://citinewsroom.com/2025/03/ghana-health-service-reassigns-regional-health-directors/
Agenda 111: Three ‘completed’ hospitals need $8m each – Health Ministry,https://citinewsroom.com/2025/03/agenda-111-three-completed-hospitals-need-8m-each-health-ministry/
Acting Korle Bu CEO warns against theft of critical equipment,https://citinewsroom.com/2025/03/acting-korle-bu-ceo-warns-against-theft-of-critical-equipment/
Someone very powerful wants to flood Ghana with poisons – Bright Simons,https://citinewsroom.com/2025/02/someone-very-powerful-wants-to-flood-ghana-with-poisons-bright-simons/
Working for equality is a permanent struggle – Shirley A. Botchwey writes,https://citinewsroom.com/2025/03/working-for-equality-is-a-permanent-struggle-shirley-a-botchwey-writes/
"Women, Work and Impact of Temperament on Career Fulfillment",https://citinewsroom.com/2025/03/women-work-and-impact-of-temperament-on-career-fulfillment/
Appraising Mahama’s vision for the environment; embedding PPP in Ghana’s environment governance [Article],https://citinewsroom.com/2025/03/1152264/
Mahama needs to be commended for successfully undertaking a scaled-down Independence Day celebration,https://citinewsroom.com/2025/03/mahama-needs-to-be-commended-for-successfully-undertaking-a-scaled-down-independence-day-celebration/
"Ghana, in the morning – A poem by Apiokor",https://citinewsroom.com/2025/03/ghana-in-the-morning-a-poem-by-apiokor/
