Headline,Link
"Sharp Cedi gains could hurt exports, undermine growth – Prof. Baah-Boateng",https://citinewsroom.com/2025/05/sharp-cedi-gains-could-hurt-exports-undermine-growth-prof-baah-boateng/
Koo Fori pleads not guilty to $50K fraud; granted ₵320K bail,https://citinewsroom.com/2025/05/koo-fori-pleads-not-guilty-to-50k-fraud-granted-%e2%82%b5320k-bail/
"E/R:Three dead, two injured in truck accident at Akyem Asafo",https://citinewsroom.com/2025/05/e-rthree-dead-two-injured-in-truck-accident-at-akyem-asafo/
Mensah Thompson appointed Acting deputy Director General of SEC,https://citinewsroom.com/2025/05/mensah-thompson-appointed-acting-deputy-director-general-of-sec/
$800 is nothing – Agradaa defends Sammy Gyamfi,https://citinewsroom.com/2025/05/800-is-nothing-agradaa-defends-sammy-gyamfi/
Publish benchmark prices to support Cedi gains – CUTS Int’l to GSS,https://citinewsroom.com/2025/05/publish-benchmark-prices-to-support-cedi-gains-cuts-intl-to-gss/
"GUTA: Fiscal discipline, BoG action key to cedi stability",https://citinewsroom.com/2025/05/guta-fiscal-discipline-bog-action-key-to-cedi-stability/
Declare source of dollar gift to Agradaa – Ibrahim Adjei to Sammy Gyamfi,https://citinewsroom.com/2025/05/declare-source-of-dollar-gift-to-agradaa-ibrahim-adjei-to-sammy-gyamfi/
Dumsor: Power supply to stabilise by end of May – Energy Minister,https://citinewsroom.com/2025/05/dumsor-power-supply-to-stabilise-by-end-of-may-energy-minister/
Chief of Staff summons Sammy Gyamfi over cash gift to Agradaa,https://citinewsroom.com/2025/05/chief-of-staff-summons-sammy-gyamfi-over-cash-gift-to-agradaa/
Cedi appreciation: Reduce prices to benefit consumers – GUTA to traders,https://citinewsroom.com/2025/05/cedi-appreciation-reduce-prices-to-benefit-consumers-guta-to-traders/
Tight security as Bole MCE nominee faces confirmation,https://citinewsroom.com/2025/05/tight-security-as-bole-mce-nominee-faces-confirmation/
Failure to sack Sammy Gyamfi will undermine Code of Conduct – Elvis Darko,https://citinewsroom.com/2025/05/failure-to-sack-sammy-gyamfi-will-undermine-code-of-conduct-elvis-darko/
T-bill auction: Gov’t misses target by GHS169m as yields dip,https://citinewsroom.com/2025/05/t-bill-auction-govt-misses-target-by-ghs169m-as-yields-dip/
2025 Hajj: First batch of Ghanaian Muslim pilgrims arrive in Jeddah,https://citinewsroom.com/2025/05/2025-hajj-first-batch-of-ghanaian-muslim-pilgrims-arrive-in-jeddah/
"Eyewitness News, Monday, 10th March, 2025",https://citinewsroom.com/2025/03/eyewitness-news-monday-10th-march-2025/
"Citi Breakfast Show, Monday, 10th March, 2025",https://citinewsroom.com/2025/03/citi-breakfast-show-monday-10th-march-2025/
Heritage on-Air Series | Celebrating Iconic Ghanaian Music | Ep5,https://citinewsroom.com/2025/03/heritage-on-air-series-the-story-of-ghanaian-music-through-the-years-ep5/
"FamLife | Ghanaian Marriage Paradigms | Saturday, 8th March, 2025",https://citinewsroom.com/2025/03/famlife-ghanaian-marriage-paradigms-saturday-8th-march-2025/
"Sharp Cedi gains could hurt exports, undermine growth – Prof. Baah-Boateng",https://citinewsroom.com/2025/05/sharp-cedi-gains-could-hurt-exports-undermine-growth-prof-baah-boateng/
$800 is nothing – Agradaa defends Sammy Gyamfi,https://citinewsroom.com/2025/05/800-is-nothing-agradaa-defends-sammy-gyamfi/
Publish benchmark prices to support Cedi gains – CUTS Int’l to GSS,https://citinewsroom.com/2025/05/publish-benchmark-prices-to-support-cedi-gains-cuts-intl-to-gss/
Declare source of dollar gift to Agradaa – Ibrahim Adjei to Sammy Gyamfi,https://citinewsroom.com/2025/05/declare-source-of-dollar-gift-to-agradaa-ibrahim-adjei-to-sammy-gyamfi/
Act on Sammy Gyamfi’s cash gift to Agradaa – Mary Addah tells Mahama,https://citinewsroom.com/2025/05/act-on-sammy-gyamfis-cash-gift-to-agradaa-mary-addah-tells-mahama/
Mensah Thompson appointed Acting deputy Director General of SEC,https://citinewsroom.com/2025/05/mensah-thompson-appointed-acting-deputy-director-general-of-sec/
"GUTA: Fiscal discipline, BoG action key to cedi stability",https://citinewsroom.com/2025/05/guta-fiscal-discipline-bog-action-key-to-cedi-stability/
Attorney-General urges end to politicisation of Ghanaian businesses,https://citinewsroom.com/2025/05/attorney-general-urges-end-to-politicisation-of-ghanaian-businesses/
T-bill auction: Gov’t misses target by GHS169m as yields dip,https://citinewsroom.com/2025/05/t-bill-auction-govt-misses-target-by-ghs169m-as-yields-dip/
COCOBOD moves to strengthen anti-smuggling laws,https://citinewsroom.com/2025/05/cocobod-moves-to-strengthen-anti-smuggling-laws/
Apaak: Mahama prioritises inclusive education to uplift Ghanaians,https://citinewsroom.com/2025/05/apaak-mahama-prioritises-inclusive-education-to-uplift-ghanaians/
Bagbin urges NHIS reform to ease burden on lupus patients,https://citinewsroom.com/2025/05/bagbin-urges-nhis-reform-to-ease-burden-on-lupus-patients/
Slum expansion fuelling urban fire risk – GNFS warns,https://citinewsroom.com/2025/05/slum-expansion-fuelling-urban-fire-risk-gnfs-warns/
Mother’s Day: Ghana thrives because of you – Opoku-Agyemang to Mothers,https://citinewsroom.com/2025/05/mothers-day-ghana-thrives-because-of-you-opoku-agyemang-to-mothers/
Police arrest man with 92 slabs of suspected Indian Hemp in Akatsi,https://citinewsroom.com/2025/05/police-arrest-man-with-92-slabs-of-suspected-indian-hemp-in-akatsi/
Weija-Gbawe MP re-elected President of Ghana Weightlifting Federation,https://citinewsroom.com/2025/05/weija-gbawe-mp-re-elected-president-of-ghana-weightlifting-federation/
Trump administration warns World Cup visitors against overstaying visas,https://citinewsroom.com/2025/05/trump-administration-warns-world-cup-visitors-against-overstaying-visas/
‘Clock ticking on Arteta to prove he can be a winner’,https://citinewsroom.com/2025/05/clock-ticking-on-arteta-to-prove-he-can-be-a-winner/
Inter Milan defeat Barcelona by equalling Champions League semifinal record,https://citinewsroom.com/2025/05/inter-milan-defeat-barcelona-by-equalling-champions-league-semifinal-record/
Curry helps Warriors claim decider against Rockets,https://citinewsroom.com/2025/05/curry-helps-warriors-claim-decider-against-rockets/
Koo Fori pleads not guilty to $50K fraud; granted ₵320K bail,https://citinewsroom.com/2025/05/koo-fori-pleads-not-guilty-to-50k-fraud-granted-%e2%82%b5320k-bail/
Yaw Darling secures Unsung Artiste of the Year at TGMA 26,https://citinewsroom.com/2025/05/yaw-darling-secures-unsung-artiste-of-the-year-at-tgma-26/
Full list of 2025 Telecel Ghana Music Awards winners,https://citinewsroom.com/2025/05/full-list-of-2025-telecel-ghana-music-awards-winners/
Okyeame Kwame embraces regal African aesthetics with Pharaoh look at TGMA 2025,https://citinewsroom.com/2025/05/okyeame-kwame-embraces-regal-african-aesthetics-with-pharaoh-look-at-tgma-2025/
King Promise crowned Artiste of the Year at 26th TGMA Awards,https://citinewsroom.com/2025/05/king-promise-crowned-artiste-of-the-year-at-26th-tgma-awards/
India reopens 32 airports after ceasefire with Pakistan,https://citinewsroom.com/2025/05/india-reopens-32-airports-after-ceasefire-with-pakistan/
Pope Leo appeals for no more war in first Sunday address,https://citinewsroom.com/2025/05/pope-leo-appeals-for-no-more-war-in-first-sunday-address/
Student faces deportation after running red light – police discover her entire family has been living illegally in US,https://citinewsroom.com/2025/05/student-faces-deportation-after-running-red-light-police-discover-her-entire-family-has-been-living-illegally-in-us/
Pope Leo XIV to hold first mass today in Sistine Chapel as papacy duty begins,https://citinewsroom.com/2025/05/pope-leo-xiv-to-hold-first-mass-today-in-sistine-chapel-as-papacy-duty-begins/
"Who is Robert Prevost, the new Pope Leo XIV?",https://citinewsroom.com/2025/05/who-is-robert-prevost-the-new-pope-leo-xiv/
VFS Global leverages SAP Software to power digital cross-border mobility,https://citinewsroom.com/2025/05/vfs-global-leverages-sap-software-to-power-digital-cross-border-mobility/
"Govt committed to rescuing troubled AT, protecting 500 jobs – Sam George",https://citinewsroom.com/2025/05/govt-committed-to-rescuing-troubled-at-protecting-500-jobs-sam-george/
VIA to commission AI-driven security operations and forensic center,https://citinewsroom.com/2025/05/via-to-commission-ai-driven-security-operations-and-forensic-center/
"Communications Minister visits ShaQ Express, commends local innovation",https://citinewsroom.com/2025/05/communications-minister-visits-shaq-express-commends-local-innovation/
Real QLED TV from Samsung: Mirroring real life,https://citinewsroom.com/2025/04/real-qled-tv-from-samsung-mirroring-real-life/
Bagbin urges NHIS reform to ease burden on lupus patients,https://citinewsroom.com/2025/05/bagbin-urges-nhis-reform-to-ease-burden-on-lupus-patients/
Health Minister reaffirms healthcare reform agenda at Family Health University Ceremony,https://citinewsroom.com/2025/05/health-minister-reaffirms-healthcare-reform-agenda-at-family-health-university-ceremony/
Pharmacy Council pushes telemedicine to bridge healthcare access gaps,https://citinewsroom.com/2025/05/pharmacy-council-pushes-telemedicine-to-bridge-healthcare-access-gaps/
Enterprise Group supports establishment of Dialysis Centre at Tetteh Quarshie Memorial Hospital,https://citinewsroom.com/2025/05/enterprise-group-supports-the-establishment-of-dialysis-centre-at-tetteh-quarshie-memorial-hospital/
I’ve come to serve with a clean heart and clear mind – Acting KATH CEO,https://citinewsroom.com/2025/05/ive-come-to-serve-with-a-clean-heart-and-clear-mind-acting-kath-ceo/
"Remembering May 9th Accra Sports Stadium Disaster, 24 Years On",https://citinewsroom.com/2025/05/remembering-may-9-accra-sports-stadium-disaster-24-years-on/
Public Sector Recruitment: A Broken System in Need of Urgent Reform,https://citinewsroom.com/2025/05/public-sector-recruitment-a-broken-system-in-need-of-urgent-reform/
From Promise to Disappointment: My Experience with Intercity STC,https://citinewsroom.com/2025/05/from-promise-to-disappointment-my-experience-with-intercity-stc/
The Impact of FinTech on customer satisfaction and service delivery in the banking industry – Victor Agbeve writes,https://citinewsroom.com/2025/05/the-impact-of-fintech-on-customer-satisfaction-and-service-delivery-in-the-banking-industry-victor-agbeve-writes/
The path to a stable income: how Ousmane successfully joined 1xpartners,https://citinewsroom.com/2025/05/the-path-to-a-stable-income-how-ousmane-successfully-joined-1xpartners/
