Headline,Link
"National Security operatives stole Ernest Addison’s cash, wife’s jewellery – Afenyo-Markin",https://citinewsroom.com/2025/03/national-security-operatives-stole-ernest-addisons-cash-wifes-jewelry-afenyo-markin/
"Afenyo-Markin to Mahama: End National Security raids, leave a legacy",https://citinewsroom.com/2025/03/afenyo-markin-to-mahama-end-national-security-raids-leave-a-legacy/
Sena Okity-Duah appointed coordinator for FSHS secretariat,https://citinewsroom.com/2025/03/sena-okity-duah-appointed-coordinator-for-fshs-secretariat/
GJA commends Police for arrest in Ahmed Suale murder case,https://citinewsroom.com/2025/03/gja-commends-police-for-arrest-in-ahmed-suale-murder-case/
Okatakyie Afrifa Mensah released after arrest,https://citinewsroom.com/2025/03/okatakyie-afrifa-mensah-released-after-arrest/
GH¢78m allocated to my office woefully inadequate – Kwakye Ofosu,https://citinewsroom.com/2025/03/gh%c2%a278m-allocated-to-my-office-woefully-inadequate-kwakye-ofosu/
"2025 Budget offers optimism, but sluggish growth projection concerning – ISSER",https://citinewsroom.com/2025/03/2025-budget-offers-optimism-but-sluggish-growth-projection-concerning-isser/
Afenyo-Markin visits former BoG Governor after National Security raid,https://citinewsroom.com/2025/03/afenyo-markin-visits-former-bog-governor-after-national-security-raid/
Top 10 SOEs recorded GHC11bn net loss in 2023 – Kpessa-Whyte,https://citinewsroom.com/2025/03/top-10-soes-recorded-ghc11bn-net-loss-in-2023-kpessa-whyte/
Mahama won’t hesitate to sack Heads of non-performing SOEs – Kpessa-Whyte,https://citinewsroom.com/2025/03/mahama-wont-hesitate-to-sack-heads-of-non-performing-soes-kpessa-whyte/
COP Tiwaa Addo-Danquah moved to Interior Ministry as Technical Adviser,https://citinewsroom.com/2025/03/cop-tiwaa-addo-danquah-moved-to-interior-ministry-as-technical-adviser/
“We haven’t given up on you” – Mahama tells Black Stars,https://citinewsroom.com/2025/03/we-havent-given-up-on-you-mahama-tells-black-stars/
"Pope Francis stops using oxygen mask as condition improves, Vatican says",https://citinewsroom.com/2025/03/pope-francis-stops-using-oxygen-mask-as-condition-improves-vatican-says/
Govt to convert fuel stations into EV charging centers,https://citinewsroom.com/2025/03/govt-to-convert-fuel-stations-into-ev-charging-centers/
Deploying unarmed water guards could endanger lives – Nitiwul warns,https://citinewsroom.com/2025/03/deploying-unarmed-water-guards-could-endanger-lives-nitiwul-warns/
"Eyewitness News, Monday, 10th March, 2025",https://citinewsroom.com/2025/03/eyewitness-news-monday-10th-march-2025/
"Citi Breakfast Show, Monday, 10th March, 2025",https://citinewsroom.com/2025/03/citi-breakfast-show-monday-10th-march-2025/
Heritage on-Air Series | Celebrating Iconic Ghanaian Music | Ep5,https://citinewsroom.com/2025/03/heritage-on-air-series-the-story-of-ghanaian-music-through-the-years-ep5/
"FamLife | Ghanaian Marriage Paradigms | Saturday, 8th March, 2025",https://citinewsroom.com/2025/03/famlife-ghanaian-marriage-paradigms-saturday-8th-march-2025/
"Afenyo-Markin to Mahama: End National Security raids, leave a legacy",https://citinewsroom.com/2025/03/afenyo-markin-to-mahama-end-national-security-raids-leave-a-legacy/
Sena Okity-Duah appointed coordinator for FSHS secretariat,https://citinewsroom.com/2025/03/sena-okity-duah-appointed-coordinator-for-fshs-secretariat/
"National Security operatives stole Ernest Addison’s cash, wife’s jewellery – Afenyo-Markin",https://citinewsroom.com/2025/03/national-security-operatives-stole-ernest-addisons-cash-wifes-jewelry-afenyo-markin/
Govt establishes technical committee to sanitise small-scale mining sector,https://citinewsroom.com/2025/03/govt-establishes-technical-committee-to-sanitise-small-scale-mining-sector/
GH¢78m allocated to my office woefully inadequate – Kwakye Ofosu,https://citinewsroom.com/2025/03/gh%c2%a278m-allocated-to-my-office-woefully-inadequate-kwakye-ofosu/
Cybersecurity analysts demand urgent audit of govt’s social media accounts,https://citinewsroom.com/2025/03/cybersecurity-analysts-demand-urgent-audit-of-govts-social-media-accounts/
Freight forwarders seek default judgment against Shipping Lines over port charges,https://citinewsroom.com/2025/03/freight-forwarders-seek-default-judgment-against-shipping-lines-over-port-charges/
"2025 Budget offers optimism, but sluggish growth projection concerning – ISSER",https://citinewsroom.com/2025/03/2025-budget-offers-optimism-but-sluggish-growth-projection-concerning-isser/
Top 10 SOEs recorded GHC11bn net loss in 2023 – Kpessa-Whyte,https://citinewsroom.com/2025/03/top-10-soes-recorded-ghc11bn-net-loss-in-2023-kpessa-whyte/
"Ghana Hubs Network, Building Bytes partner to launch Ghana Innovation Tour",https://citinewsroom.com/2025/03/ghana-hubs-network-building-bytes-partner-to-launch-ghana-innovation-tour/
Free SHS: Expanding access should not lower standards – Education expert cautions,https://citinewsroom.com/2025/03/free-shs-expanding-access-should-not-lower-standards-education-expert-cautions/
MP calls for urgent funding to tackle opioid abuse among youth,https://citinewsroom.com/2025/03/mp-calls-for-urgent-funding-to-tackle-opioid-abuse-among-youth/
Cybersecurity analysts demand urgent audit of govt’s social media accounts,https://citinewsroom.com/2025/03/cybersecurity-analysts-demand-urgent-audit-of-govts-social-media-accounts/
Freight forwarders seek default judgment against Shipping Lines over port charges,https://citinewsroom.com/2025/03/freight-forwarders-seek-default-judgment-against-shipping-lines-over-port-charges/
GAEC raises alarm over land encroachments,https://citinewsroom.com/2025/03/gaec-raises-alarm-over-land-encroachments/
“We haven’t given up on you” – Mahama tells Black Stars,https://citinewsroom.com/2025/03/we-havent-given-up-on-you-mahama-tells-black-stars/
1xBet explores new horizons at the prestigious SiGMA Africa exhibition,https://citinewsroom.com/2025/03/1xbet-explores-new-horizons-at-the-prestigious-sigma-africa-exhibition/
Messi left out of Argentina’s next World Cup qualifiers,https://citinewsroom.com/2025/03/messi-left-out-of-argentinas-next-world-cup-qualifiers/
Lionel Messi scores as Inter Miami win against Atlanta United,https://citinewsroom.com/2025/03/lionel-messi-scores-as-inter-miami-win-against-atlanta-united/
Nathaniel Tetteh appointed Eastern Regional NSA boss,https://citinewsroom.com/2025/03/nathaniel-tetteh-appointed-eastern-regional-nsa-boss/
Unreleased Eminem music stolen and sold online – man charged,https://citinewsroom.com/2025/03/unreleased-eminem-music-stolen-and-sold-online-man-charged/
Entertainment Week Ghana team meets KOD to discuss cultural initiatives,https://citinewsroom.com/2025/03/entertainment-week-ghana-team-meets-kod-to-discuss-cultural-initiatives/
Africa’s Wealth Titans: Meet the 5 richest billionaires of 2025,https://citinewsroom.com/2025/03/africas-wealth-titans-meet-the-5-richest-billionaires-of-2025/
[VIDEO] “Very Solid” – Kaywa endorses Joseph Matthew’s ‘Love In You’ reggae hit song,https://citinewsroom.com/2025/03/video-very-solid-kaywa-endorses-joseph-matthews-love-in-you-reggae-hit-song/
Gambo’s ‘Drip Remix’ earns TGMA nomination,https://citinewsroom.com/2025/03/gambos-drip-remix-earns-tgma-nomination-2/
Greenpeace ordered to pay more than $660m for defaming oil firm in protests,https://citinewsroom.com/2025/03/greenpeace-ordered-to-pay-more-than-660m-for-defaming-oil-firm-in-protests/
"Pope Francis stops using oxygen mask as condition improves, Vatican says",https://citinewsroom.com/2025/03/pope-francis-stops-using-oxygen-mask-as-condition-improves-vatican-says/
"Congolese, Rwandan leaders meet in Qatar, call for ceasefire in eastern DRC",https://citinewsroom.com/2025/03/congolese-rwandan-leaders-meet-in-qatar-call-for-ceasefire-in-eastern-drc/
Astronauts Butch and Suni finally back on Earth,https://citinewsroom.com/2025/03/astronauts-butch-and-suni-finally-back-on-earth/
Putin agrees in Trump call to pause Ukraine energy attacks but no full ceasefire,https://citinewsroom.com/2025/03/putin-agrees-in-trump-call-to-pause-ukraine-energy-attacks-but-no-full-ceasefire/
Google agrees to pay $28m in racial bias lawsuit,https://citinewsroom.com/2025/03/google-agrees-to-pay-28m-in-racial-bias-lawsuit/
Telegram founder allowed to leave France following arrest,https://citinewsroom.com/2025/03/telegram-founder-allowed-to-leave-france-following-arrest/
Samuel Nartey George to receive honorary award at Yango Mobility Digital Awards,https://citinewsroom.com/2025/03/samuel-nartey-george-to-receive-honorary-award-at-yango-mobility-digital-awards/
SpaceX capsule docks as astronauts prepare return after nine months,https://citinewsroom.com/2025/03/spacex-capsule-docks-as-astronauts-prepare-return-after-nine-months/
Global smartwatch sales fall for first time,https://citinewsroom.com/2025/03/global-smartwatch-sales-fall-for-first-time/
Govt will continue free dialysis programme – NHIA,https://citinewsroom.com/2025/03/govt-will-continue-free-dialysis-programme-nhia/
Ashanti Region records 1000 maternal deaths between 2020 and 2024,https://citinewsroom.com/2025/03/ashanti-region-records-1000-maternal-deaths-between-2020-and-2024/
Only GH¢4m was allocated to free dialysis programme – Akandoh,https://citinewsroom.com/2025/03/only-gh%c2%a24m-was-allocated-to-free-dialysis-programme-akandoh/
Chamber of Pharmacy calls for targeted support for pharmaceutical industry,https://citinewsroom.com/2025/03/chamber-of-pharmacy-calls-for-targeted-support-for-pharmaceutical-industry/
Mahama seeks external support to complete Agenda 111 projects,https://citinewsroom.com/2025/03/mahama-seeks-external-support-to-complete-agenda-111-projects/
Scam alert: How hackers hijacked John Mahama’s account to push Solanafrica fraud,https://citinewsroom.com/2025/03/scam-alert-how-hackers-hijacked-john-mahamas-account-to-push-solanafrica-fraud/
Opinion: Unpacking the alleged oil cartel campaign against SML in Ghana,https://citinewsroom.com/2025/03/opinion-unpacking-the-alleged-oil-cartel-campaign-against-sml-in-ghana/
Resetting the nation: The Council of State’s critical role,https://citinewsroom.com/2025/03/resetting-the-nation-the-council-of-states-critical-role/
How revamping the jury system can improve justice delivery – Naa Kwaamah Siaw-Marfo writes,https://citinewsroom.com/2025/03/how-revamping-the-jury-system-can-improve-justice-delivery-naa-kwaamah-siaw-marfo-writes/
The 2025 Budget failed to adequately finance sanitation,https://citinewsroom.com/2025/03/the-2025-budget-failed-to-adequately-finance-sanitation/
