Headline,Link
[Watch Live] Finance Minister presents 2025 budget to Parliament,https://citinewsroom.com/2025/03/watch-live-finance-minister-presents-2025-budget-to-parliament/
Prof. Bokpin: Mahama must cut wasteful spending at Jubilee House,https://citinewsroom.com/2025/03/prof-bokpin-mahama-must-cut-wasteful-spending-at-jubilee-house/
2025 budget will expose NPP’s terrible economic record – Armah-Kofi Buah,https://citinewsroom.com/2025/03/2025-budget-will-expose-npps-terrible-economic-record-armah-kofi-buah/
2025 budget won’t introduce draconian taxes – Sammy Gyamfi,https://citinewsroom.com/2025/03/2025-budget-wont-introduce-draconian-taxes-sammy-gyamfi/
ECG announces power outages in several regions for maintenance work,https://citinewsroom.com/2025/03/ecg-announces-power-outages-in-several-regions-for-maintenance-work/
Channel One TV/Citi FM expresses gratitude to sponsors of 2025 Heritage Caravan,https://citinewsroom.com/2025/03/channel-one-tv-citi-fm-expresses-gratitude-to-sponsors-of-2025-heritage-caravan/
Govt lacks funds to complete Agenda 111 projects – Akandoh,https://citinewsroom.com/2025/03/govt-lacks-funds-to-complete-agenda-111-projects-akandoh/
Galamsey: Declare state of emergency now – Miracles to govt,https://citinewsroom.com/2025/03/galamsey-declare-state-of-emergency-now-miracles-to-govt/
Ato Forson to present 2025 Budget today,https://citinewsroom.com/2025/03/ato-forson-to-present-2025-budget-today/
"Don’t write off former prisoners, they can be influential – Prof. Adarkwa",https://citinewsroom.com/2025/03/dont-write-off-former-prisoners-they-can-be-influential-prof-adarkwa/
2025 budget: Don’t cut Free SHS funding – Akim Oda MP to govt,https://citinewsroom.com/2025/03/2025-budget-dont-cut-free-shs-funding-akim-oda-mp-to-govt/
Current VAT structure does not support dynamics in retail sector – GUTA,https://citinewsroom.com/2025/03/current-vat-structure-does-not-support-dynamics-in-retail-sector-guta/
Ashanti Regional Minister vows to tackle rampant streetlight theft,https://citinewsroom.com/2025/03/ashanti-regional-minister-vows-to-tackle-rampant-streetlight-theft/
US stock market sheds $1.75 trillion after Trump’s recession remarks,https://citinewsroom.com/2025/03/us-stock-market-sheds-1-75-trillion-after-trumps-recession-remarks/
North Korean hackers cash out hundreds of millions from $1.5bn ByBit hack,https://citinewsroom.com/2025/03/north-korean-hackers-cash-out-hundreds-of-millions-from-1-5bn-bybit-hack/
"Eyewitness News, Monday, 10th March, 2025",https://citinewsroom.com/2025/03/eyewitness-news-monday-10th-march-2025/
"Citi Breakfast Show, Monday, 10th March, 2025",https://citinewsroom.com/2025/03/citi-breakfast-show-monday-10th-march-2025/
Heritage on-Air Series | Celebrating Iconic Ghanaian Music | Ep5,https://citinewsroom.com/2025/03/heritage-on-air-series-the-story-of-ghanaian-music-through-the-years-ep5/
"FamLife | Ghanaian Marriage Paradigms | Saturday, 8th March, 2025",https://citinewsroom.com/2025/03/famlife-ghanaian-marriage-paradigms-saturday-8th-march-2025/
Prof. Bokpin: Mahama must cut wasteful spending at Jubilee House,https://citinewsroom.com/2025/03/prof-bokpin-mahama-must-cut-wasteful-spending-at-jubilee-house/
2025 budget will expose NPP’s terrible economic record – Armah-Kofi Buah,https://citinewsroom.com/2025/03/2025-budget-will-expose-npps-terrible-economic-record-armah-kofi-buah/
2025 budget won’t introduce draconian taxes – Sammy Gyamfi,https://citinewsroom.com/2025/03/2025-budget-wont-introduce-draconian-taxes-sammy-gyamfi/
"2025 Budget: Scrap E-Levy, Betting Tax – Boako to Ato Forson",https://citinewsroom.com/2025/03/2025-budget-scrap-e-levy-betting-tax-boako-to-ato-forson/
[Watch Live] Finance Minister presents 2025 budget to Parliament,https://citinewsroom.com/2025/03/watch-live-finance-minister-presents-2025-budget-to-parliament/
Current VAT structure does not support dynamics in retail sector – GUTA,https://citinewsroom.com/2025/03/current-vat-structure-does-not-support-dynamics-in-retail-sector-guta/
Govt committed to supporting women Agripreneurs – Godfrey Jasaw,https://citinewsroom.com/2025/03/govt-committed-to-supporting-women-agripreneurs-godfrey-jasaw/
ACEP urges govt to fast-track funding for second gas plant,https://citinewsroom.com/2025/03/acep-urges-govt-to-fast-track-funding-for-second-gas-plant/
First Atlantic Bank celebrates five-award victory with exclusive appreciation cocktail,https://citinewsroom.com/2025/03/first-atlantic-bank-celebrates-five-award-victory-with-exclusive-appreciation-cocktail/
"2025 Budget: IEA urges Govt to retain Betting Tax, Proposes 5% rate cut",https://citinewsroom.com/2025/03/2025-budget-iea-urges-govt-to-retain-betting-tax-proposes-5-rate-cut/
77% of households in Ada practice open defecation – IOM Report,https://citinewsroom.com/2025/03/77-of-households-in-ada-practice-open-defecation-iom-report/
NDC Sowutuom branch organizer granted GHC100k bail pending appeal,https://citinewsroom.com/2025/03/ndc-sowutuom-branch-organizer-granted-ghc100k-bail-pending-appeal/
"GPHA, GSA reaffirm commitment to reduce port business cost",https://citinewsroom.com/2025/03/gpha-gsa-reaffirm-commitment-to-reduce-port-business-cost/
Geisha champions women’s empowerment and progress at 7th National Women’s summit & EXPO,https://citinewsroom.com/2025/03/geisha-champions-womens-empowerment-and-progress-at-7th-national-womens-summit-expo/
"“Stay home, do not work” – CLOGSAG renews strike over registrar appointment",https://citinewsroom.com/2025/03/stay-home-do-not-work-clogsag-renews-strike-over-registrar-appointment/
Late Hudson-Odoi strike earns Forest victory over Man City,https://citinewsroom.com/2025/03/late-hudson-odoi-strike-earns-forest-victory-over-man-city/
Barcelona and Atletico Madrid draw in eight-goal thriller,https://citinewsroom.com/2025/02/barcelona-and-atletico-madrid-draw-in-eight-goal-thriller/
Liverpool beat Man City to extend lead at top to 11 points,https://citinewsroom.com/2025/02/liverpool-beat-man-city-to-extend-lead-at-top-to-11-points/
Ten-player Arsenal suffer huge blow to title hopes with West Ham loss,https://citinewsroom.com/2025/02/ten-player-arsenal-suffer-huge-blow-to-title-hopes-with-west-ham-loss/
Eto’o claims victory in ethics breach case,https://citinewsroom.com/2025/02/etoo-claims-victory-in-ethics-breach-case/
Channel One TV/Citi FM expresses gratitude to sponsors of 2025 Heritage Caravan,https://citinewsroom.com/2025/03/channel-one-tv-citi-fm-expresses-gratitude-to-sponsors-of-2025-heritage-caravan/
Stonebwoy electrifies sold-out O2 Shepherd’s Bush Empire with an unforgettable performance,https://citinewsroom.com/2025/03/stonebwoy-electrifies-sold-out-o2-shepherds-bush-empire-with-an-unforgettable-performance/
Daddy Lumba’s ‘Mpempem Do Me’ featured on King Charles’ Apple playlist,https://citinewsroom.com/2025/03/daddy-lumbas-mpempem-do-me-featured-on-king-charles-apple-playlist/
Smoove Network drops new single “Fool” with rising Star Kiki Celine,https://citinewsroom.com/2025/03/smoove-network-drops-new-single-fool-with-rising-star-kiki-celine/
Daughters of Glorious Jesus announce dates for Glorious Praise 2025,https://citinewsroom.com/2025/03/daughters-of-glorious-jesus-announce-dates-for-glorious-praise-2025/
US stock market sheds $1.75 trillion after Trump’s recession remarks,https://citinewsroom.com/2025/03/us-stock-market-sheds-1-75-trillion-after-trumps-recession-remarks/
Philippines ex-leader Duterte arrested on ICC warrant over drug killings,https://citinewsroom.com/2025/03/philippines-ex-leader-duterte-arrested-on-icc-warrant-over-drug-killings/
"Cargo vessel collides with US-flagged tanker carrying jet fuel off UK coast, causing huge fire",https://citinewsroom.com/2025/03/cargo-vessel-collides-with-us-flagged-tanker-carrying-jet-fuel-off-uk-coast-causing-huge-fire/
Ontario threatens to slap 25% surcharge on US-bound electricity,https://citinewsroom.com/2025/03/ontario-says-it-will-slap-a-25-surcharge-on-us-bound-electricity/
Stocks slide as Trump warns of US economy ‘transition’,https://citinewsroom.com/2025/03/stocks-slide-as-trump-warns-of-us-economy-transition/
North Korean hackers cash out hundreds of millions from $1.5bn ByBit hack,https://citinewsroom.com/2025/03/north-korean-hackers-cash-out-hundreds-of-millions-from-1-5bn-bybit-hack/
TECNO launches CAMON 40 Series and AI innovations at MWC Barcelona 2025,https://citinewsroom.com/2025/03/tecno-launches-camon-40-series-and-ai-innovations-at-mwc-barcelona-2025/
Workspace Global Turns 10: The Startup Transforming How African Businesses Access Creative Talent,https://citinewsroom.com/2025/03/workspace-global-turns-10-the-startup-transforming-how-african-businesses-access-creative-talent/
Nvidia says AI chip sales strong despite DeepSeek fears,https://citinewsroom.com/2025/02/nvidia-says-ai-chip-sales-strong-despite-deepseek-fears/
BP to slash green investment and ramp up gas and oil,https://citinewsroom.com/2025/02/bp-to-slash-green-investment-and-ramp-up-gas-and-oil/
Govt lacks funds to complete Agenda 111 projects – Akandoh,https://citinewsroom.com/2025/03/govt-lacks-funds-to-complete-agenda-111-projects-akandoh/
GHS140m needed to fully operationalize Bokoro Agenda 111 Hospital – Akandoh,https://citinewsroom.com/2025/03/ghs140-million-needed-to-fully-operationalize-bokoro-agenda-111-hospital-akandoh/
E/R: Residents urge completion of Nsuapemso agenda 111 Hospital project,https://citinewsroom.com/2025/03/e-r-residents-urge-completion-of-nsuapemso-agenda-111-hospital-project/
Surging ‘RED’ opioid addiction wreaks havoc on Ghana’s youth,https://citinewsroom.com/2025/03/surging-red-opioid-addiction-wreaks-havoc-on-ghanas-youth/
"Dansoman, Legon residents urge Mahama to complete Agenda 111 Projects",https://citinewsroom.com/2025/03/dansoman-legon-residents-urge-mahama-to-complete-agenda-111-projects/
Promoting food security and empowering women in agribusiness: Charity M.E Adupong’s vision with Meannan Foods,https://citinewsroom.com/2025/03/promoting-food-security-and-empowering-women-in-agribusiness-charity-m-e-adupongs-vision-with-meannan-foods/
"Cedi, Cocoa, and Calendars: Aligning Ghana’s financial year with reality",https://citinewsroom.com/2025/03/cedi-cocoa-and-calendars-aligning-ghanas-financial-year-with-reality/
Ghana is open for business: A new dawn for investment and economic prosperity,https://citinewsroom.com/2025/03/ghana-is-open-for-business-a-new-dawn-for-investment-and-economic-prosperity/
Working for equality is a permanent struggle – Shirley A. Botchwey writes,https://citinewsroom.com/2025/03/working-for-equality-is-a-permanent-struggle-shirley-a-botchwey-writes/
"Women, Work and Impact of Temperament on Career Fulfillment",https://citinewsroom.com/2025/03/women-work-and-impact-of-temperament-on-career-fulfillment/
